"Origin Movement ID","Origin Display Name","Destination Movement ID","Destination Display Name","Date Range","Mean Travel Time (Seconds)","Range - Lower Bound Travel Time (Seconds)","Range - Upper Bound Travel Time (Seconds)"
"120","50, Pocket J & K, Dilshad Garden, Delhi","3","Unnamed Road, Mahipalpur, New Delhi","11/5/2016 - 11/5/2016, Every day, AM Peak",3064,2777,3379
"120","50, Pocket J & K, Dilshad Garden, Delhi","4","P-268/3, Rock View, Delhi Cantonment, Delhi","11/5/2016 - 11/5/2016, Every day, AM Peak",3081,2808,3379
"120","50, Pocket J & K, Dilshad Garden, Delhi","9","Mahatma Jyothi Rao Phule Marg, Mahatma Jyoti Rao Phule Marg Area, New Delhi","11/5/2016 - 11/5/2016, Every day, AM Peak",2016,1732,2346
"120","50, Pocket J & K, Dilshad Garden, Delhi","11","Mother Teresa Crescent, Talkatora Garden, Central Ridge Reserve Forest, New Delhi","11/5/2016 - 11/5/2016, Every day, AM Peak",2769,2470,3104
"120","50, Pocket J & K, Dilshad Garden, Delhi","13","10, Aurangzeb Road, New Delhi","11/5/2016 - 11/5/2016, Every day, AM Peak",2131,1864,2435
"120","50, Pocket J & K, Dilshad Garden, Delhi","16","Andre Malraux Marg, Ramnagar, Chanakyapuri, New Delhi","11/5/2016 - 11/5/2016, Every day, AM Peak",3000,2193,4102
"120","50, Pocket J & K, Dilshad Garden, Delhi","34","5/3, East Nathu Colony, GTB Enclave, Dilshad Garden, Delhi","11/5/2016 - 11/5/2016, Every day, AM Peak",427,237,767
"120","50, Pocket J & K, Dilshad Garden, Delhi","35","A/15, Block A, Dilshad Colony New Simapuri, Dilshad Garden, Delhi","11/5/2016 - 11/5/2016, Every day, AM Peak",120,56,255
"120","50, Pocket J & K, Dilshad Garden, Delhi","40","Gali Saini Tent, Ram Nagar, Shahdara, Delhi","11/5/2016 - 11/5/2016, Every day, AM Peak",681,390,1187
"120","50, Pocket J & K, Dilshad Garden, Delhi","41","Lala Raghubar Dayal Marg, Phase 4, Block B, Subhash Park, Shahdara, Delhi","11/5/2016 - 11/5/2016, Every day, AM Peak",743,448,1229
"120","50, Pocket J & K, Dilshad Garden, Delhi","43","A537, New Seelampur Phase II, New Seelampur, Shahdara, Delhi","11/5/2016 - 11/5/2016, Every day, AM Peak",1033,700,1523
"120","50, Pocket J & K, Dilshad Garden, Delhi","61","Unnamed Road, National Zoological Park, Sundar Nagar, New Delhi","11/5/2016 - 11/5/2016, Every day, AM Peak",1695,1465,1961
"120","50, Pocket J & K, Dilshad Garden, Delhi","62","D/116, Jeewan Nagar, Sunlight Colony, New Delhi","11/5/2016 - 11/5/2016, Every day, AM Peak",2676,1776,4029
"120","50, Pocket J & K, Dilshad Garden, Delhi","63","Jawaharlal Nehru Stadium Marg, CGO Complex, Pragati Vihar, New Delhi","11/5/2016 - 11/5/2016, Every day, AM Peak",1922,1810,2040
"120","50, Pocket J & K, Dilshad Garden, Delhi","64","6/37, Vikram Vihar, Lajpat Nagar IV, Lajpat Nagar, New Delhi","11/5/2016 - 11/5/2016, Every day, AM Peak",2786,1946,3988
"120","50, Pocket J & K, Dilshad Garden, Delhi","70","G288, Sector 3, Block G, Nanak Pura, South Moti Bagh, New Delhi","11/5/2016 - 11/5/2016, Every day, AM Peak",3034,2694,3416
"120","50, Pocket J & K, Dilshad Garden, Delhi","84","nullMathura Road, Friends Colony West, Block A, New Friends Colony, New Delhi","11/5/2016 - 11/5/2016, Every day, AM Peak",2683,1772,4060
"120","50, Pocket J & K, Dilshad Garden, Delhi","114","9/434, Gandhi Nagar, Seelampur, Shahdara, Delhi","11/5/2016 - 11/5/2016, Every day, AM Peak",1130,887,1438
"120","50, Pocket J & K, Dilshad Garden, Delhi","116","9/5284, Shanti Mohalla, Seelampur, Shahdara, Delhi","11/5/2016 - 11/5/2016, Every day, AM Peak",888,572,1378
"120","50, Pocket J & K, Dilshad Garden, Delhi","118","0 Circular Road, Jawala Nagar, Shahdara, Delhi","11/5/2016 - 11/5/2016, Every day, AM Peak",539,276,1050
"120","50, Pocket J & K, Dilshad Garden, Delhi","119","81, Zulfe Bengal, Dilshad Garden, Delhi","11/5/2016 - 11/5/2016, Every day, AM Peak",227,109,472
"120","50, Pocket J & K, Dilshad Garden, Delhi","132","1600 Lothian Road, Chabi Ganj, Kashmere Gate, New Delhi","11/5/2016 - 11/5/2016, Every day, AM Peak",1433,1048,1957
"120","50, Pocket J & K, Dilshad Garden, Delhi","133","0 Raj Niwas Marg, Ludlow Castle, Civil Lines, Delhi","11/5/2016 - 11/5/2016, Every day, AM Peak",1635,1121,2382
"120","50, Pocket J & K, Dilshad Garden, Delhi","148","Unnamed Road, Patparganj, New Delhi","11/5/2016 - 11/5/2016, Every day, AM Peak",1509,1080,2108
"120","50, Pocket J & K, Dilshad Garden, Delhi","151","Shaheed Budh Ram Singh Marg, Dallupura, New Delhi","11/5/2016 - 11/5/2016, Every day, AM Peak",963,776,1194
"120","50, Pocket J & K, Dilshad Garden, Delhi","154","nullGali Number 6, Block B, Block D, Vinod Nagar North, Delhi","11/5/2016 - 11/5/2016, Every day, AM Peak",1142,975,1336
"120","50, Pocket J & K, Dilshad Garden, Delhi","191","0 Hasanpur, I.P.Extension, Patparganj, Delhi","11/5/2016 - 11/5/2016, Every day, AM Peak",683,504,924
"120","50, Pocket J & K, Dilshad Garden, Delhi","192","0 Bhartendu Harish Chandra Marg, Ram Vihar, Anand Vihar, Delhi","11/5/2016 - 11/5/2016, Every day, AM Peak",423,240,745
"120","50, Pocket J & K, Dilshad Garden, Delhi","193","Unnamed Road, Usmanpur, Shahdara, Delhi","11/5/2016 - 11/5/2016, Every day, AM Peak",1530,1080,2165
"120","50, Pocket J & K, Dilshad Garden, Delhi","197","177-B, Mayur Vihar Phase 2, Pocket B, Mayur Vihar, New Delhi","11/5/2016 - 11/5/2016, Every day, AM Peak",1014,868,1183
"120","50, Pocket J & K, Dilshad Garden, Delhi","222","Sector E, Mahipalpur Village, Vasant Kunj, New Delhi","11/5/2016 - 11/5/2016, Every day, AM Peak",3331,3011,3684
"120","50, Pocket J & K, Dilshad Garden, Delhi","223","Urban Extension Road II, Indira Gandhi International Airport, New Delhi","11/5/2016 - 11/5/2016, Every day, AM Peak",3577,3235,3955
"120","50, Pocket J & K, Dilshad Garden, Delhi","246","nullShiv Mandir Marg, Block G, Lajpat Nagar I, Lajpat Nagar, New Delhi","11/5/2016 - 11/5/2016, Every day, AM Peak",2197,1862,2591
"120","50, Pocket J & K, Dilshad Garden, Delhi","263","200 Pirwali Gali, Block P, Block P, Patparganj, New Delhi","11/5/2016 - 11/5/2016, Every day, AM Peak",1209,1054,1385
"120","50, Pocket J & K, Dilshad Garden, Delhi","264","Noida Link Road, Nehru Enclave, Shakarpur Khas, New Delhi","11/5/2016 - 11/5/2016, Every day, AM Peak",1316,1094,1582
"120","50, Pocket J & K, Dilshad Garden, Delhi","266","Yamuna Marginal Bandh Marg, Block A, Shastri Park, Jagjit Nagar, New Delhi","11/5/2016 - 11/5/2016, Every day, AM Peak",1068,726,1570
"120","50, Pocket J & K, Dilshad Garden, Delhi","267","nullPanduk Shila Marg, Kaithwara Jagjivan Nagar, New Usmanpur, Shahdara, Delhi","11/5/2016 - 11/5/2016, Every day, AM Peak",1111,686,1797
"120","50, Pocket J & K, Dilshad Garden, Delhi","275","125/16, Jogabai Extension, Zakir Nagar, Okhla, New Delhi","11/5/2016 - 11/5/2016, Every day, AM Peak",2337,1481,3686
"120","50, Pocket J & K, Dilshad Garden, Delhi","282","Velodrome Road, Gandhi Smriti, Raj Ghat, New Delhi","11/5/2016 - 11/5/2016, Every day, AM Peak",1683,1415,2000