"Origin Movement ID","Origin Display Name","Destination Movement ID","Destination Display Name","Date Range","Mean Travel Time (Seconds)","Range - Lower Bound Travel Time (Seconds)","Range - Upper Bound Travel Time (Seconds)"
"186","14, Sector 21, Rohini, Delhi","2","Unnamed Road, Delhi Cantonment, New Delhi","11/6/2016 - 11/6/2016, Every day, AM Peak",2277,1929,2686
"186","14, Sector 21, Rohini, Delhi","3","Unnamed Road, Mahipalpur, New Delhi","11/6/2016 - 11/6/2016, Every day, AM Peak",2876,2500,3308
"186","14, Sector 21, Rohini, Delhi","4","P-268/3, Rock View, Delhi Cantonment, Delhi","11/6/2016 - 11/6/2016, Every day, AM Peak",2719,2417,3058
"186","14, Sector 21, Rohini, Delhi","5","Old Palam Road, Delhi Cantonment, New Delhi","11/6/2016 - 11/6/2016, Every day, AM Peak",2977,2631,3368
"186","14, Sector 21, Rohini, Delhi","7","P 13, Baird Place, Delhi Cantonment, New Delhi","11/6/2016 - 11/6/2016, Every day, AM Peak",2282,1958,2659
"186","14, Sector 21, Rohini, Delhi","8","Mall Road, Khyber Lines, Delhi Cantonment, New Delhi","11/6/2016 - 11/6/2016, Every day, AM Peak",2351,2075,2663
"186","14, Sector 21, Rohini, Delhi","16","Andre Malraux Marg, Ramnagar, Chanakyapuri, New Delhi","11/6/2016 - 11/6/2016, Every day, AM Peak",2492,2202,2820
"186","14, Sector 21, Rohini, Delhi","24","268, Block B2, Shiv Nagar, Janakpuri, New Delhi","11/6/2016 - 11/6/2016, Every day, AM Peak",1875,1537,2286
"186","14, Sector 21, Rohini, Delhi","27","0 Ram Mandir Marg, C5B Block, Janakpuri, New Delhi","11/6/2016 - 11/6/2016, Every day, AM Peak",2014,1650,2457
"186","14, Sector 21, Rohini, Delhi","70","G288, Sector 3, Block G, Nanak Pura, South Moti Bagh, New Delhi","11/6/2016 - 11/6/2016, Every day, AM Peak",2725,2343,3168
"186","14, Sector 21, Rohini, Delhi","105","nullGoswami Girdhari Lal Marg, Industrial Area Phase I, Block C, Naraina Industrial Area Phase 1, Naraina, New Delhi","11/6/2016 - 11/6/2016, Every day, AM Peak",2007,1692,2379
"186","14, Sector 21, Rohini, Delhi","121","22/55, West Punjabi Bagh, Punjabi Bagh, Delhi","11/6/2016 - 11/6/2016, Every day, AM Peak",1677,1281,2195
"186","14, Sector 21, Rohini, Delhi","124","30, 31, Block B, Mansarover Garden, New Delhi","11/6/2016 - 11/6/2016, Every day, AM Peak",1873,1561,2247
"186","14, Sector 21, Rohini, Delhi","136","nullKeshopur Road, New Chaukhandi, Paschim Vihar, Delhi","11/6/2016 - 11/6/2016, Every day, AM Peak",1452,1164,1809
"186","14, Sector 21, Rohini, Delhi","137","nullRoad Number 235, Block H, Vikaspuri, Delhi","11/6/2016 - 11/6/2016, Every day, AM Peak",1520,1213,1903
"186","14, Sector 21, Rohini, Delhi","146","nullKotla Road, Pocket F2, Pocket 1, Sector 11F, Rohini, Delhi","11/6/2016 - 11/6/2016, Every day, AM Peak",454,185,1111
"186","14, Sector 21, Rohini, Delhi","156","Doctor Satpal Sachdeva Marg, Keshav Puram, Tri Nagar, Delhi","11/6/2016 - 11/6/2016, Every day, AM Peak",1494,1194,1869
"186","14, Sector 21, Rohini, Delhi","160","23, Shiva Enclave, Pitampura, Delhi","11/6/2016 - 11/6/2016, Every day, AM Peak",1091,827,1437
"186","14, Sector 21, Rohini, Delhi","161","nullLawrence Road, Rampura Industrial Area, Tri Nagar, Delhi","11/6/2016 - 11/6/2016, Every day, AM Peak",1542,1122,2117
"186","14, Sector 21, Rohini, Delhi","163","0 Guru Harkishan Marg, Maulana Azad Society, Bhagwan Buddha Housing Corporation Society, Pitampura, Delhi","11/6/2016 - 11/6/2016, Every day, AM Peak",1048,715,1534
"186","14, Sector 21, Rohini, Delhi","164","Shakurbasti Pedestrian Foot Over Bridge, Shakur Basti Railway Colony, Railway Colony South, Pitampura, Delhi","11/6/2016 - 11/6/2016, Every day, AM Peak",1454,918,2301
"186","14, Sector 21, Rohini, Delhi","165","31, Cottage Enclave, Paschim Vihar, Delhi","11/6/2016 - 11/6/2016, Every day, AM Peak",1195,855,1669
"186","14, Sector 21, Rohini, Delhi","166","nullRBI Enclave Road, Ankur Enclave, Paschim Vihar, Delhi","11/6/2016 - 11/6/2016, Every day, AM Peak",1349,995,1827
"186","14, Sector 21, Rohini, Delhi","170","nullColony Road, Block QP, Poorvi Pitampura, Pitampura, Delhi","11/6/2016 - 11/6/2016, Every day, AM Peak",1264,1018,1568
"186","14, Sector 21, Rohini, Delhi","171","nullG Block Road, Pocket 21, Sector 7G, Rohini, Delhi","11/6/2016 - 11/6/2016, Every day, AM Peak",751,581,969
"186","14, Sector 21, Rohini, Delhi","172","nullShiva Road, Pocket 14, Sector 8D, Rohini, Delhi","11/6/2016 - 11/6/2016, Every day, AM Peak",987,752,1294
"186","14, Sector 21, Rohini, Delhi","173","Unnamed Road, Swarn Jayanti Park, Sector 10, Rohini, Delhi","11/6/2016 - 11/6/2016, Every day, AM Peak",816,572,1163
"186","14, Sector 21, Rohini, Delhi","175","235, Block E, Block E, Mangolpuri, Delhi","11/6/2016 - 11/6/2016, Every day, AM Peak",943,615,1443
"186","14, Sector 21, Rohini, Delhi","176","B7-187, Pocket 7, Sector 3B, Rohini, Delhi","11/6/2016 - 11/6/2016, Every day, AM Peak",794,531,1186
"186","14, Sector 21, Rohini, Delhi","182","C2/5, Block C2, Sultanpuri, Delhi","11/6/2016 - 11/6/2016, Every day, AM Peak",843,552,1287
"186","14, Sector 21, Rohini, Delhi","184","Tau Bihari Marg, Ladpur, Delhi","11/6/2016 - 11/6/2016, Every day, AM Peak",483,359,648
"186","14, Sector 21, Rohini, Delhi","185","Bawana Road, Puth Khurd, Delhi","11/6/2016 - 11/6/2016, Every day, AM Peak",260,128,525
"186","14, Sector 21, Rohini, Delhi","187","60, Vijay Vihar Phase II, Pocket C, Sector 1, Rohini, Delhi","11/6/2016 - 11/6/2016, Every day, AM Peak",616,348,1088
"186","14, Sector 21, Rohini, Delhi","193","Unnamed Road, Usmanpur, Shahdara, Delhi","11/6/2016 - 11/6/2016, Every day, AM Peak",2794,2051,3804
"186","14, Sector 21, Rohini, Delhi","196","nullSir Chotu Ram Marg, Pocket 4, Sector 6C, Rohini, Delhi","11/6/2016 - 11/6/2016, Every day, AM Peak",586,328,1045
"186","14, Sector 21, Rohini, Delhi","199","0 Shivaji Marg, New Moti Nagar, Najafgarh Road Industrial Area, Delhi","11/6/2016 - 11/6/2016, Every day, AM Peak",2046,1523,2747
"186","14, Sector 21, Rohini, Delhi","212","Bawana Road, Sector 30, Rohini, Delhi","11/6/2016 - 11/6/2016, Every day, AM Peak",250,158,395
"186","14, Sector 21, Rohini, Delhi","219","461, Block AG, Sanjay Gandhi Transport Nagar, Delhi","11/6/2016 - 11/6/2016, Every day, AM Peak",1108,743,1651
"186","14, Sector 21, Rohini, Delhi","229","200 Road Number 28, Nehru Nagar, Shivaji Place, Basai Dara pur, Tagore Garden Extension, New Delhi","11/6/2016 - 11/6/2016, Every day, AM Peak",1759,1452,2130
"186","14, Sector 21, Rohini, Delhi","232","4-3, Mayapuri Industrial Area Phase II, Mayapuri, New Delhi","11/6/2016 - 11/6/2016, Every day, AM Peak",2131,1779,2552
"186","14, Sector 21, Rohini, Delhi","236","nullRithala Road, Pocket A, Budh Vihar Phase I, Budh Vihar, Delhi","11/6/2016 - 11/6/2016, Every day, AM Peak",310,139,689
"186","14, Sector 21, Rohini, Delhi","239","nullSultanpuri, सुल्तानपुरी, Block E 4, Ratan Vihar, Sultanpuri, Delhi","11/6/2016 - 11/6/2016, Every day, AM Peak",709,421,1193
"186","14, Sector 21, Rohini, Delhi","240","37, Sector 15, Pocket 6, Sector 15B, Rohini, Delhi","11/6/2016 - 11/6/2016, Every day, AM Peak",988,647,1507
"186","14, Sector 21, Rohini, Delhi","244","Dhingra Park Trail, Punjabi Bagh Cooperative Housing Soceity, East Punjabi Bagh, Punjabi Bagh, Delhi","11/6/2016 - 11/6/2016, Every day, AM Peak",1662,1260,2191
"186","14, Sector 21, Rohini, Delhi","245","N-1/17, Block M, Mangolpuri, Delhi","11/6/2016 - 11/6/2016, Every day, AM Peak",810,532,1232
"186","14, Sector 21, Rohini, Delhi","257","y 788, Block W, Mangolpur Khurd, Mangolpuri, नई दिल्ली","11/6/2016 - 11/6/2016, Every day, AM Peak",839,574,1226
"186","14, Sector 21, Rohini, Delhi","279","Nightingale Road, Budella, Vikaspuri, Delhi","11/6/2016 - 11/6/2016, Every day, AM Peak",1650,1361,1999
"186","14, Sector 21, Rohini, Delhi","281","D915, New Mahavir Nagar, Tilak Nagar, Delhi","11/6/2016 - 11/6/2016, Every day, AM Peak",1611,1297,1999