"Origin Movement ID","Origin Display Name","Destination Movement ID","Destination Display Name","Date Range","Mean Travel Time (Seconds)","Range - Lower Bound Travel Time (Seconds)","Range - Upper Bound Travel Time (Seconds)"
"81","126, Block L 1, Alaknanda, New Delhi","1","300 Ring Road, Block CB, Naraina Village, Naraina, New Delhi","11/8/2016 - 11/8/2016, Every day, AM Peak",2311,1877,2844
"81","126, Block L 1, Alaknanda, New Delhi","2","Unnamed Road, Delhi Cantonment, New Delhi","11/8/2016 - 11/8/2016, Every day, AM Peak",2222,1827,2701
"81","126, Block L 1, Alaknanda, New Delhi","3","Unnamed Road, Mahipalpur, New Delhi","11/8/2016 - 11/8/2016, Every day, AM Peak",1629,1200,2210
"81","126, Block L 1, Alaknanda, New Delhi","4","P-268/3, Rock View, Delhi Cantonment, Delhi","11/8/2016 - 11/8/2016, Every day, AM Peak",1626,983,2689
"81","126, Block L 1, Alaknanda, New Delhi","5","Old Palam Road, Delhi Cantonment, New Delhi","11/8/2016 - 11/8/2016, Every day, AM Peak",1717,1346,2189
"81","126, Block L 1, Alaknanda, New Delhi","8","Mall Road, Khyber Lines, Delhi Cantonment, New Delhi","11/8/2016 - 11/8/2016, Every day, AM Peak",2028,1736,2367
"81","126, Block L 1, Alaknanda, New Delhi","9","Mahatma Jyothi Rao Phule Marg, Mahatma Jyoti Rao Phule Marg Area, New Delhi","11/8/2016 - 11/8/2016, Every day, AM Peak",1919,1398,2633
"81","126, Block L 1, Alaknanda, New Delhi","10","0 Shaheed Bhagat Singh Marg, DIZ Staff Quarters, Connaught Place, New Delhi","11/8/2016 - 11/8/2016, Every day, AM Peak",2065,1726,2470
"81","126, Block L 1, Alaknanda, New Delhi","11","Mother Teresa Crescent, Talkatora Garden, Central Ridge Reserve Forest, New Delhi","11/8/2016 - 11/8/2016, Every day, AM Peak",2272,1770,2915
"81","126, Block L 1, Alaknanda, New Delhi","12","Jantar Mantar Road, Janpath, Connaught Place, New Delhi","11/8/2016 - 11/8/2016, Every day, AM Peak",2037,1565,2649
"81","126, Block L 1, Alaknanda, New Delhi","13","10, Aurangzeb Road, New Delhi","11/8/2016 - 11/8/2016, Every day, AM Peak",1624,1197,2201
"81","126, Block L 1, Alaknanda, New Delhi","14","Mahatma Gandhi Road, Kidwai Nagar West, Kidwai Nagar, New Delhi","11/8/2016 - 11/8/2016, Every day, AM Peak",1475,1165,1866
"81","126, Block L 1, Alaknanda, New Delhi","15","H205, Block H, Sarojini Nagar, New Delhi","11/8/2016 - 11/8/2016, Every day, AM Peak",1610,1272,2037
"81","126, Block L 1, Alaknanda, New Delhi","16","Andre Malraux Marg, Ramnagar, Chanakyapuri, New Delhi","11/8/2016 - 11/8/2016, Every day, AM Peak",1837,1461,2308
"81","126, Block L 1, Alaknanda, New Delhi","17","0 Khanna Market Road, Aliganj, Lodi Colony, New Delhi","11/8/2016 - 11/8/2016, Every day, AM Peak",1777,1546,2041
"81","126, Block L 1, Alaknanda, New Delhi","18","Unnamed Road, Lal Qila, Chandni Chowk, New Delhi","11/8/2016 - 11/8/2016, Every day, AM Peak",3216,2250,4594
"81","126, Block L 1, Alaknanda, New Delhi","19","Mirdard Road, 64 Khamba, Maulana Azad Medical College Campus, New Delhi","11/8/2016 - 11/8/2016, Every day, AM Peak",2861,2232,3666
"81","126, Block L 1, Alaknanda, New Delhi","61","Unnamed Road, National Zoological Park, Sundar Nagar, New Delhi","11/8/2016 - 11/8/2016, Every day, AM Peak",1687,1209,2353
"81","126, Block L 1, Alaknanda, New Delhi","62","D/116, Jeewan Nagar, Sunlight Colony, New Delhi","11/8/2016 - 11/8/2016, Every day, AM Peak",1495,1051,2124
"81","126, Block L 1, Alaknanda, New Delhi","63","Jawaharlal Nehru Stadium Marg, CGO Complex, Pragati Vihar, New Delhi","11/8/2016 - 11/8/2016, Every day, AM Peak",1302,981,1726
"81","126, Block L 1, Alaknanda, New Delhi","64","6/37, Vikram Vihar, Lajpat Nagar IV, Lajpat Nagar, New Delhi","11/8/2016 - 11/8/2016, Every day, AM Peak",1011,723,1413
"81","126, Block L 1, Alaknanda, New Delhi","65","Shaheed Jeet Singh Marg, NCERT Campus, Qutab Institutional Area, New Delhi","11/8/2016 - 11/8/2016, Every day, AM Peak",733,475,1130
"81","126, Block L 1, Alaknanda, New Delhi","66","nullBhagat Singh Market Marg, Block K, Malviya Nagar, New Delhi","11/8/2016 - 11/8/2016, Every day, AM Peak",945,620,1439
"81","126, Block L 1, Alaknanda, New Delhi","67","63/33, Hudco Place, Andrews Ganj Extension, Andrews Ganj, New Delhi","11/8/2016 - 11/8/2016, Every day, AM Peak",1074,781,1475
"81","126, Block L 1, Alaknanda, New Delhi","68","0 Paschimi Marg, Block E, Vasant Vihar, New Delhi","11/8/2016 - 11/8/2016, Every day, AM Peak",1103,806,1508
"81","126, Block L 1, Alaknanda, New Delhi","69","1129, Sector 2 R K Puram, Sector 2, RK Puram, New Delhi","11/8/2016 - 11/8/2016, Every day, AM Peak",901,629,1290
"81","126, Block L 1, Alaknanda, New Delhi","70","G288, Sector 3, Block G, Nanak Pura, South Moti Bagh, New Delhi","11/8/2016 - 11/8/2016, Every day, AM Peak",1273,918,1763
"81","126, Block L 1, Alaknanda, New Delhi","71","JNU Ring Road, Jawaharlal Nehru University, New Delhi","11/8/2016 - 11/8/2016, Every day, AM Peak",870,582,1300
"81","126, Block L 1, Alaknanda, New Delhi","72","7/254, Dakshinpuri Extension, Block 7, Sector 6, Dakshinpuri, New Delhi","11/8/2016 - 11/8/2016, Every day, AM Peak",543,304,966
"81","126, Block L 1, Alaknanda, New Delhi","73","0 Central Avenue, Block E, Sainik Farm, New Delhi","11/8/2016 - 11/8/2016, Every day, AM Peak",818,537,1244
"81","126, Block L 1, Alaknanda, New Delhi","74","F-269, Ambedkar Nagar, Block F, Sector 5, Dakshinpuri, New Delhi","11/8/2016 - 11/8/2016, Every day, AM Peak",588,410,842
"81","126, Block L 1, Alaknanda, New Delhi","76","124, SPG Quarters, Sector 4, Pushp Vihar, New Delhi","11/8/2016 - 11/8/2016, Every day, AM Peak",688,414,1142
"81","126, Block L 1, Alaknanda, New Delhi","77","0 Mehrauli - Badarpur Road, Tughlakabad Institutional Area, Vayusenabad, New Delhi","11/8/2016 - 11/8/2016, Every day, AM Peak",375,188,745
"81","126, Block L 1, Alaknanda, New Delhi","79","Shooting Range Road, Asola Wild Life Sanctuary, Asola, New Delhi","11/8/2016 - 11/8/2016, Every day, AM Peak",664,509,864
"81","126, Block L 1, Alaknanda, New Delhi","80","E-492, Block E, Greater Kailash II, Greater Kailash, New Delhi","11/8/2016 - 11/8/2016, Every day, AM Peak",268,94,758
"81","126, Block L 1, Alaknanda, New Delhi","82","286, Asian Games Village Complex, Siri Fort, New Delhi","11/8/2016 - 11/8/2016, Every day, AM Peak",444,220,895
"81","126, Block L 1, Alaknanda, New Delhi","83","C2, Block C, Kailash Colony, Greater Kailash, New Delhi","11/8/2016 - 11/8/2016, Every day, AM Peak",442,123,1575
"81","126, Block L 1, Alaknanda, New Delhi","84","nullMathura Road, Friends Colony West, Block A, New Friends Colony, New Delhi","11/8/2016 - 11/8/2016, Every day, AM Peak",800,487,1314
"81","126, Block L 1, Alaknanda, New Delhi","85","Outer Ring Road, Block 13, Nehru Enclave East, Okhla Industrial Area, New Delhi","11/8/2016 - 11/8/2016, Every day, AM Peak",396,187,838
"81","126, Block L 1, Alaknanda, New Delhi","86","100 Kalkaji Main Road, Bhoomiheen Camp, Govindpuri, New Delhi","11/8/2016 - 11/8/2016, Every day, AM Peak",305,115,802
"81","126, Block L 1, Alaknanda, New Delhi","87","0 Maharaja Agarsen Marg, Subash Khand, Giri Nagar, Kalkaji, New Delhi","11/8/2016 - 11/8/2016, Every day, AM Peak",389,174,868
"81","126, Block L 1, Alaknanda, New Delhi","88","Krishan Marg, Tughlaqabad Village, Tughlakabad, New Delhi","11/8/2016 - 11/8/2016, Every day, AM Peak",562,269,1174
"81","126, Block L 1, Alaknanda, New Delhi","89","A15/2, Chungi No 2, Kotla Mahingiran, Lal Kuan, New Delhi","11/8/2016 - 11/8/2016, Every day, AM Peak",941,711,1243
"81","126, Block L 1, Alaknanda, New Delhi","90","C-86, Pocket C, Okhla Phase I, Okhla Industrial Area, New Delhi","11/8/2016 - 11/8/2016, Every day, AM Peak",905,556,1472
"81","126, Block L 1, Alaknanda, New Delhi","91","nullTum Road, Sanjay Colony II, Sanjay Colony, Okhla Phase II, Okhla Industrial Area, New Delhi","11/8/2016 - 11/8/2016, Every day, AM Peak",760,516,1119
"81","126, Block L 1, Alaknanda, New Delhi","94","2212, Gautampuri Awas, Badarpur, New Delhi","11/8/2016 - 11/8/2016, Every day, AM Peak",1225,1065,1407
"81","126, Block L 1, Alaknanda, New Delhi","96","0 Street Number 9, Noor Nagar Extension, Noor Nagar, Okhla, New Delhi","11/8/2016 - 11/8/2016, Every day, AM Peak",1005,648,1556
"81","126, Block L 1, Alaknanda, New Delhi","105","nullGoswami Girdhari Lal Marg, Industrial Area Phase I, Block C, Naraina Industrial Area Phase 1, Naraina, New Delhi","11/8/2016 - 11/8/2016, Every day, AM Peak",2187,2026,2359
"81","126, Block L 1, Alaknanda, New Delhi","106","IGNOU Residential Campus Road, Rocky Area, Stone Quarries, Maidan Garhi, New Delhi","11/8/2016 - 11/8/2016, Every day, AM Peak",1241,853,1804
"81","126, Block L 1, Alaknanda, New Delhi","107","1100 Zia UL Haq Road, Block A1, Chattarpur, Chhattarpur, New Delhi","11/8/2016 - 11/8/2016, Every day, AM Peak",1936,1515,2473
"81","126, Block L 1, Alaknanda, New Delhi","108","Unnamed Road, Block G, Bhim Basti, Jaunapur, New Delhi","11/8/2016 - 11/8/2016, Every day, AM Peak",2637,2100,3309
"81","126, Block L 1, Alaknanda, New Delhi","109","Main Chhatarpur Road, Bhatti Kalan, New Delhi","11/8/2016 - 11/8/2016, Every day, AM Peak",1922,1667,2215
"81","126, Block L 1, Alaknanda, New Delhi","110","Pusta Road, Madanpur Khadar Phase 3, Madanpur Khadar, New Delhi","11/8/2016 - 11/8/2016, Every day, AM Peak",1214,880,1673
"81","126, Block L 1, Alaknanda, New Delhi","111","61 TO 80, Pocket J, Sarita Vihar, New Delhi","11/8/2016 - 11/8/2016, Every day, AM Peak",1001,722,1386
"81","126, Block L 1, Alaknanda, New Delhi","132","1600 Lothian Road, Chabi Ganj, Kashmere Gate, New Delhi","11/8/2016 - 11/8/2016, Every day, AM Peak",3514,2423,5096
"81","126, Block L 1, Alaknanda, New Delhi","133","0 Raj Niwas Marg, Ludlow Castle, Civil Lines, Delhi","11/8/2016 - 11/8/2016, Every day, AM Peak",3742,2599,5385
"81","126, Block L 1, Alaknanda, New Delhi","143","nullRoad Number 221, Pocket 1, Sector 10 Dwarka, Dwarka, Delhi","11/8/2016 - 11/8/2016, Every day, AM Peak",2325,2041,2648
"81","126, Block L 1, Alaknanda, New Delhi","148","Unnamed Road, Patparganj, New Delhi","11/8/2016 - 11/8/2016, Every day, AM Peak",1903,1450,2497
"81","126, Block L 1, Alaknanda, New Delhi","154","nullGali Number 6, Block B, Block D, Vinod Nagar North, Delhi","11/8/2016 - 11/8/2016, Every day, AM Peak",2097,1484,2961
"81","126, Block L 1, Alaknanda, New Delhi","191","0 Hasanpur, I.P.Extension, Patparganj, Delhi","11/8/2016 - 11/8/2016, Every day, AM Peak",2290,1656,3166
"81","126, Block L 1, Alaknanda, New Delhi","192","0 Bhartendu Harish Chandra Marg, Ram Vihar, Anand Vihar, Delhi","11/8/2016 - 11/8/2016, Every day, AM Peak",2904,2147,3927
"81","126, Block L 1, Alaknanda, New Delhi","193","Unnamed Road, Usmanpur, Shahdara, Delhi","11/8/2016 - 11/8/2016, Every day, AM Peak",1871,1295,2702
"81","126, Block L 1, Alaknanda, New Delhi","200","Dabri - Gurgaon Road, Pocket 2, Sector 1 Dwarka, Dwarka, New Delhi","11/8/2016 - 11/8/2016, Every day, AM Peak",2142,1888,2429
"81","126, Block L 1, Alaknanda, New Delhi","222","Sector E, Mahipalpur Village, Vasant Kunj, New Delhi","11/8/2016 - 11/8/2016, Every day, AM Peak",2294,1734,3034
"81","126, Block L 1, Alaknanda, New Delhi","223","Urban Extension Road II, Indira Gandhi International Airport, New Delhi","11/8/2016 - 11/8/2016, Every day, AM Peak",2469,1890,3224
"81","126, Block L 1, Alaknanda, New Delhi","224","Main Road, Bharthal, Sector 27 Dwarka, Bharthal, New Delhi","11/8/2016 - 11/8/2016, Every day, AM Peak",2632,2429,2851
"81","126, Block L 1, Alaknanda, New Delhi","228","0 Lucknow Road, Banarsi Das Estate, Timarpur, Delhi","11/8/2016 - 11/8/2016, Every day, AM Peak",4491,3354,6012
"81","126, Block L 1, Alaknanda, New Delhi","246","nullShiv Mandir Marg, Block G, Lajpat Nagar I, Lajpat Nagar, New Delhi","11/8/2016 - 11/8/2016, Every day, AM Peak",1164,833,1626
"81","126, Block L 1, Alaknanda, New Delhi","247","9/2082, Pocket 2, Block RZ, Palam Colony, New Delhi","11/8/2016 - 11/8/2016, Every day, AM Peak",2048,1760,2383
"81","126, Block L 1, Alaknanda, New Delhi","248","Unnamed Road, Harijan Basti, Rajokri, New Delhi","11/8/2016 - 11/8/2016, Every day, AM Peak",2368,1704,3290
"81","126, Block L 1, Alaknanda, New Delhi","251","A25, Block R, Pocket A, Rajender Nagar Part 1, New Rajinder Nagar, New Delhi","11/8/2016 - 11/8/2016, Every day, AM Peak",2586,2284,2926
"81","126, Block L 1, Alaknanda, New Delhi","252","813, Sector 1, RK Puram, New Delhi","11/8/2016 - 11/8/2016, Every day, AM Peak",960,650,1417
"81","126, Block L 1, Alaknanda, New Delhi","253","0 Chaudhary Harsukh Marg, B6, Block B6, Humayunpur, Safdarjung Enclave, New Delhi","11/8/2016 - 11/8/2016, Every day, AM Peak",926,605,1416
"81","126, Block L 1, Alaknanda, New Delhi","254","Squadron Leader Mohinder Kumar Jain Marg, Block B, New Delhi","11/8/2016 - 11/8/2016, Every day, AM Peak",731,453,1178
"81","126, Block L 1, Alaknanda, New Delhi","255","1700 Uday Chand Marg, Arya Basti, Zafar Nagar, Kotla Mubarakpur, South Extension I, New Delhi","11/8/2016 - 11/8/2016, Every day, AM Peak",1392,1049,1846
"81","126, Block L 1, Alaknanda, New Delhi","256","D-70, Mahavir Enclave I, Mahavir Enclave Part 2, Mahavir Enclave, New Delhi","11/8/2016 - 11/8/2016, Every day, AM Peak",1996,1746,2281
"81","126, Block L 1, Alaknanda, New Delhi","259","Jogging Lane, Pocket B-C, Sector-A, Vasant Kunj, New Delhi","11/8/2016 - 11/8/2016, Every day, AM Peak",1081,732,1595
"81","126, Block L 1, Alaknanda, New Delhi","263","200 Pirwali Gali, Block P, Block P, Patparganj, New Delhi","11/8/2016 - 11/8/2016, Every day, AM Peak",1990,1386,2856
"81","126, Block L 1, Alaknanda, New Delhi","264","Noida Link Road, Nehru Enclave, Shakarpur Khas, New Delhi","11/8/2016 - 11/8/2016, Every day, AM Peak",2052,1455,2893
"81","126, Block L 1, Alaknanda, New Delhi","272","Anuvrat Marg, Butterfly Park, Qila Rai Pithora, Mehrauli, New Delhi","11/8/2016 - 11/8/2016, Every day, AM Peak",1377,1020,1858
"81","126, Block L 1, Alaknanda, New Delhi","275","125/16, Jogabai Extension, Zakir Nagar, Okhla, New Delhi","11/8/2016 - 11/8/2016, Every day, AM Peak",1688,1316,2164
"81","126, Block L 1, Alaknanda, New Delhi","282","Velodrome Road, Gandhi Smriti, Raj Ghat, New Delhi","11/8/2016 - 11/8/2016, Every day, AM Peak",2811,2033,3886