"Origin Movement ID","Origin Display Name","Destination Movement ID","Destination Display Name","Date Range","Mean Travel Time (Seconds)","Range - Lower Bound Travel Time (Seconds)","Range - Upper Bound Travel Time (Seconds)"
"128","0 Shakti Mandir Marg, Block 10, Shakti Nagar, Delhi","3","Unnamed Road, Mahipalpur, New Delhi","11/4/2016 - 11/4/2016, Every day, AM Peak",2669,2201,3235
"128","0 Shakti Mandir Marg, Block 10, Shakti Nagar, Delhi","4","P-268/3, Rock View, Delhi Cantonment, Delhi","11/4/2016 - 11/4/2016, Every day, AM Peak",2718,2197,3361
"128","0 Shakti Mandir Marg, Block 10, Shakti Nagar, Delhi","5","Old Palam Road, Delhi Cantonment, New Delhi","11/4/2016 - 11/4/2016, Every day, AM Peak",2823,2314,3442
"128","0 Shakti Mandir Marg, Block 10, Shakti Nagar, Delhi","8","Mall Road, Khyber Lines, Delhi Cantonment, New Delhi","11/4/2016 - 11/4/2016, Every day, AM Peak",2119,1681,2669
"128","0 Shakti Mandir Marg, Block 10, Shakti Nagar, Delhi","9","Mahatma Jyothi Rao Phule Marg, Mahatma Jyoti Rao Phule Marg Area, New Delhi","11/4/2016 - 11/4/2016, Every day, AM Peak",2035,1556,2660
"128","0 Shakti Mandir Marg, Block 10, Shakti Nagar, Delhi","10","0 Shaheed Bhagat Singh Marg, DIZ Staff Quarters, Connaught Place, New Delhi","11/4/2016 - 11/4/2016, Every day, AM Peak",1437,1152,1791
"128","0 Shakti Mandir Marg, Block 10, Shakti Nagar, Delhi","11","Mother Teresa Crescent, Talkatora Garden, Central Ridge Reserve Forest, New Delhi","11/4/2016 - 11/4/2016, Every day, AM Peak",1613,1241,2096
"128","0 Shakti Mandir Marg, Block 10, Shakti Nagar, Delhi","12","Jantar Mantar Road, Janpath, Connaught Place, New Delhi","11/4/2016 - 11/4/2016, Every day, AM Peak",1753,1453,2114
"128","0 Shakti Mandir Marg, Block 10, Shakti Nagar, Delhi","13","10, Aurangzeb Road, New Delhi","11/4/2016 - 11/4/2016, Every day, AM Peak",2144,1717,2676
"128","0 Shakti Mandir Marg, Block 10, Shakti Nagar, Delhi","14","Mahatma Gandhi Road, Kidwai Nagar West, Kidwai Nagar, New Delhi","11/4/2016 - 11/4/2016, Every day, AM Peak",2582,2167,3075
"128","0 Shakti Mandir Marg, Block 10, Shakti Nagar, Delhi","16","Andre Malraux Marg, Ramnagar, Chanakyapuri, New Delhi","11/4/2016 - 11/4/2016, Every day, AM Peak",2103,1721,2568
"128","0 Shakti Mandir Marg, Block 10, Shakti Nagar, Delhi","18","Unnamed Road, Lal Qila, Chandni Chowk, New Delhi","11/4/2016 - 11/4/2016, Every day, AM Peak",1546,1276,1872
"128","0 Shakti Mandir Marg, Block 10, Shakti Nagar, Delhi","19","Mirdard Road, 64 Khamba, Maulana Azad Medical College Campus, New Delhi","11/4/2016 - 11/4/2016, Every day, AM Peak",2280,1927,2697
"128","0 Shakti Mandir Marg, Block 10, Shakti Nagar, Delhi","61","Unnamed Road, National Zoological Park, Sundar Nagar, New Delhi","11/4/2016 - 11/4/2016, Every day, AM Peak",2311,1810,2950
"128","0 Shakti Mandir Marg, Block 10, Shakti Nagar, Delhi","63","Jawaharlal Nehru Stadium Marg, CGO Complex, Pragati Vihar, New Delhi","11/4/2016 - 11/4/2016, Every day, AM Peak",2585,1991,3355
"128","0 Shakti Mandir Marg, Block 10, Shakti Nagar, Delhi","64","6/37, Vikram Vihar, Lajpat Nagar IV, Lajpat Nagar, New Delhi","11/4/2016 - 11/4/2016, Every day, AM Peak",2807,2277,3460
"128","0 Shakti Mandir Marg, Block 10, Shakti Nagar, Delhi","67","63/33, Hudco Place, Andrews Ganj Extension, Andrews Ganj, New Delhi","11/4/2016 - 11/4/2016, Every day, AM Peak",2692,2153,3364
"128","0 Shakti Mandir Marg, Block 10, Shakti Nagar, Delhi","68","0 Paschimi Marg, Block E, Vasant Vihar, New Delhi","11/4/2016 - 11/4/2016, Every day, AM Peak",3149,2562,3870
"128","0 Shakti Mandir Marg, Block 10, Shakti Nagar, Delhi","70","G288, Sector 3, Block G, Nanak Pura, South Moti Bagh, New Delhi","11/4/2016 - 11/4/2016, Every day, AM Peak",2253,1775,2858
"128","0 Shakti Mandir Marg, Block 10, Shakti Nagar, Delhi","71","JNU Ring Road, Jawaharlal Nehru University, New Delhi","11/4/2016 - 11/4/2016, Every day, AM Peak",3092,2656,3599
"128","0 Shakti Mandir Marg, Block 10, Shakti Nagar, Delhi","82","286, Asian Games Village Complex, Siri Fort, New Delhi","11/4/2016 - 11/4/2016, Every day, AM Peak",3727,3035,4576
"128","0 Shakti Mandir Marg, Block 10, Shakti Nagar, Delhi","83","C2, Block C, Kailash Colony, Greater Kailash, New Delhi","11/4/2016 - 11/4/2016, Every day, AM Peak",3057,2470,3782
"128","0 Shakti Mandir Marg, Block 10, Shakti Nagar, Delhi","100","Maharishi Balmiki Marg, Police Colony, Sarai Khalil, Sadar Bazaar, New Delhi","11/4/2016 - 11/4/2016, Every day, AM Peak",905,719,1138
"128","0 Shakti Mandir Marg, Block 10, Shakti Nagar, Delhi","101","4900 Ramdwara Road, Chuna Mandi, Aram Bagh, Paharganj, New Delhi","11/4/2016 - 11/4/2016, Every day, AM Peak",1262,999,1593
"128","0 Shakti Mandir Marg, Block 10, Shakti Nagar, Delhi","103","nullDasghara Road, Dasghara, New Delhi","11/4/2016 - 11/4/2016, Every day, AM Peak",1832,1445,2321
"128","0 Shakti Mandir Marg, Block 10, Shakti Nagar, Delhi","121","22/55, West Punjabi Bagh, Punjabi Bagh, Delhi","11/4/2016 - 11/4/2016, Every day, AM Peak",1461,1085,1966
"128","0 Shakti Mandir Marg, Block 10, Shakti Nagar, Delhi","123","Loknath Marg, Block M, Kirti Nagar, New Delhi","11/4/2016 - 11/4/2016, Every day, AM Peak",1152,898,1477
"128","0 Shakti Mandir Marg, Block 10, Shakti Nagar, Delhi","124","30, 31, Block B, Mansarover Garden, New Delhi","11/4/2016 - 11/4/2016, Every day, AM Peak",1413,1078,1850
"128","0 Shakti Mandir Marg, Block 10, Shakti Nagar, Delhi","126","nullSwami Narayan Underpass Road, Block E, Sangam Park, Ashok Vihar, Delhi","11/4/2016 - 11/4/2016, Every day, AM Peak",660,438,994
"128","0 Shakti Mandir Marg, Block 10, Shakti Nagar, Delhi","127","NDPL House, Lala Achintaram Marg, Block B, Gujranwala Town, Delhi","11/4/2016 - 11/4/2016, Every day, AM Peak",724,514,1019
"128","0 Shakti Mandir Marg, Block 10, Shakti Nagar, Delhi","129","Gali Number 8, Anand Parbat, New Delhi","11/4/2016 - 11/4/2016, Every day, AM Peak",504,296,857
"128","0 Shakti Mandir Marg, Block 10, Shakti Nagar, Delhi","130","Bhagat Singh Marg, Kashmiri Bagh, Chandra Shekhar Azad Colony, Sarai Rohilla, New Delhi","11/4/2016 - 11/4/2016, Every day, AM Peak",289,127,654
"128","0 Shakti Mandir Marg, Block 10, Shakti Nagar, Delhi","131","4400 Gali Bahuji, Pahari Dhiraj, Sadar Bazaar, Delhi","11/4/2016 - 11/4/2016, Every day, AM Peak",611,407,916
"128","0 Shakti Mandir Marg, Block 10, Shakti Nagar, Delhi","132","1600 Lothian Road, Chabi Ganj, Kashmere Gate, New Delhi","11/4/2016 - 11/4/2016, Every day, AM Peak",1192,832,1706
"128","0 Shakti Mandir Marg, Block 10, Shakti Nagar, Delhi","133","0 Raj Niwas Marg, Ludlow Castle, Civil Lines, Delhi","11/4/2016 - 11/4/2016, Every day, AM Peak",830,539,1277
"128","0 Shakti Mandir Marg, Block 10, Shakti Nagar, Delhi","155","Maharaja Agaersen Road, Block D, Pocket D, Phase 1, Ashok Vihar, Delhi","11/4/2016 - 11/4/2016, Every day, AM Peak",933,595,1460
"128","0 Shakti Mandir Marg, Block 10, Shakti Nagar, Delhi","156","Doctor Satpal Sachdeva Marg, Keshav Puram, Tri Nagar, Delhi","11/4/2016 - 11/4/2016, Every day, AM Peak",790,486,1282
"128","0 Shakti Mandir Marg, Block 10, Shakti Nagar, Delhi","157","CH Devender Singh Tewatia Marg, Ashok Vihar II, Pocket B 1, Phase 3, Ashok Vihar, Delhi","11/4/2016 - 11/4/2016, Every day, AM Peak",303,123,743
"128","0 Shakti Mandir Marg, Block 10, Shakti Nagar, Delhi","158","484, Block E, Nimri Colony, Ashok Vihar, Delhi","11/4/2016 - 11/4/2016, Every day, AM Peak",409,204,816
"128","0 Shakti Mandir Marg, Block 10, Shakti Nagar, Delhi","159","300 Maharishi Balmiki Mandir Marg, Block H, Shakurpur Colony, Pitampura, Delhi","11/4/2016 - 11/4/2016, Every day, AM Peak",1089,856,1384
"128","0 Shakti Mandir Marg, Block 10, Shakti Nagar, Delhi","161","nullLawrence Road, Rampura Industrial Area, Tri Nagar, Delhi","11/4/2016 - 11/4/2016, Every day, AM Peak",1134,841,1527
"128","0 Shakti Mandir Marg, Block 10, Shakti Nagar, Delhi","162","2400 Pt Govind Ram Shastri Marg, Ganeshpura, Tri Nagar, Delhi","11/4/2016 - 11/4/2016, Every day, AM Peak",862,636,1168
"128","0 Shakti Mandir Marg, Block 10, Shakti Nagar, Delhi","170","nullColony Road, Block QP, Poorvi Pitampura, Pitampura, Delhi","11/4/2016 - 11/4/2016, Every day, AM Peak",1054,835,1328
"128","0 Shakti Mandir Marg, Block 10, Shakti Nagar, Delhi","188","12/188, Shastri Nagar, Geeta Colony, New Delhi","11/4/2016 - 11/4/2016, Every day, AM Peak",1580,1245,2004
"128","0 Shakti Mandir Marg, Block 10, Shakti Nagar, Delhi","189","F22, Block F, Krishna Nagar, Delhi","11/4/2016 - 11/4/2016, Every day, AM Peak",1502,1169,1928
"128","0 Shakti Mandir Marg, Block 10, Shakti Nagar, Delhi","193","Unnamed Road, Usmanpur, Shahdara, Delhi","11/4/2016 - 11/4/2016, Every day, AM Peak",1525,1109,2096
"128","0 Shakti Mandir Marg, Block 10, Shakti Nagar, Delhi","199","0 Shivaji Marg, New Moti Nagar, Najafgarh Road Industrial Area, Delhi","11/4/2016 - 11/4/2016, Every day, AM Peak",889,668,1181
"128","0 Shakti Mandir Marg, Block 10, Shakti Nagar, Delhi","204","0 East Patel Nagar Road, Block 10A, East Patel Nagar, Patel Nagar, New Delhi","11/4/2016 - 11/4/2016, Every day, AM Peak",773,446,1336
"128","0 Shakti Mandir Marg, Block 10, Shakti Nagar, Delhi","206","0 Arya Samaj Road, Block 12B, Dev Nagar, Karol Bagh, New Delhi","11/4/2016 - 11/4/2016, Every day, AM Peak",851,662,1093
"128","0 Shakti Mandir Marg, Block 10, Shakti Nagar, Delhi","207","0 Maharana Pratap Road, Block 53, Karol Bagh, New Delhi","11/4/2016 - 11/4/2016, Every day, AM Peak",798,542,1174
"128","0 Shakti Mandir Marg, Block 10, Shakti Nagar, Delhi","208","Desh Bandhu Gupta Road, Block E, Jhandewalan Extension, Jhandewalan, New Delhi","11/4/2016 - 11/4/2016, Every day, AM Peak",1118,856,1459
"128","0 Shakti Mandir Marg, Block 10, Shakti Nagar, Delhi","209","nullMaharaja Agarsen Marg, Block A, CC Colony, Kalyan Vihar, नई दिल्ली","11/4/2016 - 11/4/2016, Every day, AM Peak",287,129,636
"128","0 Shakti Mandir Marg, Block 10, Shakti Nagar, Delhi","214","Doctor Bhim Rao Ambedkar Marg, Block H, Malka Ganj, Delhi","11/4/2016 - 11/4/2016, Every day, AM Peak",344,159,739
"128","0 Shakti Mandir Marg, Block 10, Shakti Nagar, Delhi","222","Sector E, Mahipalpur Village, Vasant Kunj, New Delhi","11/4/2016 - 11/4/2016, Every day, AM Peak",3287,2739,3943
"128","0 Shakti Mandir Marg, Block 10, Shakti Nagar, Delhi","223","Urban Extension Road II, Indira Gandhi International Airport, New Delhi","11/4/2016 - 11/4/2016, Every day, AM Peak",3544,2886,4351
"128","0 Shakti Mandir Marg, Block 10, Shakti Nagar, Delhi","225","0 Netaji Road, A Block, Block C, Adarsh Nagar, Delhi","11/4/2016 - 11/4/2016, Every day, AM Peak",868,655,1150
"128","0 Shakti Mandir Marg, Block 10, Shakti Nagar, Delhi","227","300 Lok Marg, Dhaka Colony, Mukherjee Nagar, Delhi","11/4/2016 - 11/4/2016, Every day, AM Peak",397,163,964
"128","0 Shakti Mandir Marg, Block 10, Shakti Nagar, Delhi","228","0 Lucknow Road, Banarsi Das Estate, Timarpur, Delhi","11/4/2016 - 11/4/2016, Every day, AM Peak",473,238,937
"128","0 Shakti Mandir Marg, Block 10, Shakti Nagar, Delhi","229","200 Road Number 28, Nehru Nagar, Shivaji Place, Basai Dara pur, Tagore Garden Extension, New Delhi","11/4/2016 - 11/4/2016, Every day, AM Peak",1463,1115,1918
"128","0 Shakti Mandir Marg, Block 10, Shakti Nagar, Delhi","231","G-17/6, Block G, Rajouri Garden, New Delhi","11/4/2016 - 11/4/2016, Every day, AM Peak",1426,1175,1729
"128","0 Shakti Mandir Marg, Block 10, Shakti Nagar, Delhi","246","nullShiv Mandir Marg, Block G, Lajpat Nagar I, Lajpat Nagar, New Delhi","11/4/2016 - 11/4/2016, Every day, AM Peak",2705,2192,3337
"128","0 Shakti Mandir Marg, Block 10, Shakti Nagar, Delhi","248","Unnamed Road, Harijan Basti, Rajokri, New Delhi","11/4/2016 - 11/4/2016, Every day, AM Peak",3624,3051,4303
"128","0 Shakti Mandir Marg, Block 10, Shakti Nagar, Delhi","251","A25, Block R, Pocket A, Rajender Nagar Part 1, New Rajinder Nagar, New Delhi","11/4/2016 - 11/4/2016, Every day, AM Peak",1376,1005,1882
"128","0 Shakti Mandir Marg, Block 10, Shakti Nagar, Delhi","252","813, Sector 1, RK Puram, New Delhi","11/4/2016 - 11/4/2016, Every day, AM Peak",2745,2284,3298
"128","0 Shakti Mandir Marg, Block 10, Shakti Nagar, Delhi","253","0 Chaudhary Harsukh Marg, B6, Block B6, Humayunpur, Safdarjung Enclave, New Delhi","11/4/2016 - 11/4/2016, Every day, AM Peak",2875,2542,3250
"128","0 Shakti Mandir Marg, Block 10, Shakti Nagar, Delhi","263","200 Pirwali Gali, Block P, Block P, Patparganj, New Delhi","11/4/2016 - 11/4/2016, Every day, AM Peak",2328,1962,2761
"128","0 Shakti Mandir Marg, Block 10, Shakti Nagar, Delhi","264","Noida Link Road, Nehru Enclave, Shakarpur Khas, New Delhi","11/4/2016 - 11/4/2016, Every day, AM Peak",2036,1593,2600
"128","0 Shakti Mandir Marg, Block 10, Shakti Nagar, Delhi","265","0 Lane Number 8, Krishan Kunj Extension Part 2, Block G, Vishwakarma Park, Laxmi Nagar, Delhi","11/4/2016 - 11/4/2016, Every day, AM Peak",1758,1316,2347
"128","0 Shakti Mandir Marg, Block 10, Shakti Nagar, Delhi","282","Velodrome Road, Gandhi Smriti, Raj Ghat, New Delhi","11/4/2016 - 11/4/2016, Every day, AM Peak",1910,1452,2510
"128","0 Shakti Mandir Marg, Block 10, Shakti Nagar, Delhi","287","L47, Block L, Shastri Nagar, Delhi","11/4/2016 - 11/4/2016, Every day, AM Peak",302,152,597