"Origin Movement ID","Origin Display Name","Destination Movement ID","Destination Display Name","Date Range","Mean Travel Time (Seconds)","Range - Lower Bound Travel Time (Seconds)","Range - Upper Bound Travel Time (Seconds)"
"200","Dabri - Gurgaon Road, Pocket 2, Sector 1 Dwarka, Dwarka, New Delhi","2","Unnamed Road, Delhi Cantonment, New Delhi","11/7/2016 - 11/7/2016, Every day, AM Peak",1659,1234,2229
"200","Dabri - Gurgaon Road, Pocket 2, Sector 1 Dwarka, Dwarka, New Delhi","3","Unnamed Road, Mahipalpur, New Delhi","11/7/2016 - 11/7/2016, Every day, AM Peak",2267,1510,3402
"200","Dabri - Gurgaon Road, Pocket 2, Sector 1 Dwarka, Dwarka, New Delhi","4","P-268/3, Rock View, Delhi Cantonment, Delhi","11/7/2016 - 11/7/2016, Every day, AM Peak",1715,1063,2764
"200","Dabri - Gurgaon Road, Pocket 2, Sector 1 Dwarka, Dwarka, New Delhi","5","Old Palam Road, Delhi Cantonment, New Delhi","11/7/2016 - 11/7/2016, Every day, AM Peak",1055,669,1662
"200","Dabri - Gurgaon Road, Pocket 2, Sector 1 Dwarka, Dwarka, New Delhi","6","Unnamed Road, CVD Line, Delhi Cantonment, New Delhi","11/7/2016 - 11/7/2016, Every day, AM Peak",1074,784,1471
"200","Dabri - Gurgaon Road, Pocket 2, Sector 1 Dwarka, Dwarka, New Delhi","7","P 13, Baird Place, Delhi Cantonment, New Delhi","11/7/2016 - 11/7/2016, Every day, AM Peak",1394,987,1967
"200","Dabri - Gurgaon Road, Pocket 2, Sector 1 Dwarka, Dwarka, New Delhi","8","Mall Road, Khyber Lines, Delhi Cantonment, New Delhi","11/7/2016 - 11/7/2016, Every day, AM Peak",1908,1425,2554
"200","Dabri - Gurgaon Road, Pocket 2, Sector 1 Dwarka, Dwarka, New Delhi","9","Mahatma Jyothi Rao Phule Marg, Mahatma Jyoti Rao Phule Marg Area, New Delhi","11/7/2016 - 11/7/2016, Every day, AM Peak",3424,2613,4485
"200","Dabri - Gurgaon Road, Pocket 2, Sector 1 Dwarka, Dwarka, New Delhi","10","0 Shaheed Bhagat Singh Marg, DIZ Staff Quarters, Connaught Place, New Delhi","11/7/2016 - 11/7/2016, Every day, AM Peak",3299,2574,4228
"200","Dabri - Gurgaon Road, Pocket 2, Sector 1 Dwarka, Dwarka, New Delhi","11","Mother Teresa Crescent, Talkatora Garden, Central Ridge Reserve Forest, New Delhi","11/7/2016 - 11/7/2016, Every day, AM Peak",2424,1861,3155
"200","Dabri - Gurgaon Road, Pocket 2, Sector 1 Dwarka, Dwarka, New Delhi","12","Jantar Mantar Road, Janpath, Connaught Place, New Delhi","11/7/2016 - 11/7/2016, Every day, AM Peak",3214,2477,4169
"200","Dabri - Gurgaon Road, Pocket 2, Sector 1 Dwarka, Dwarka, New Delhi","13","10, Aurangzeb Road, New Delhi","11/7/2016 - 11/7/2016, Every day, AM Peak",3132,2470,3970
"200","Dabri - Gurgaon Road, Pocket 2, Sector 1 Dwarka, Dwarka, New Delhi","14","Mahatma Gandhi Road, Kidwai Nagar West, Kidwai Nagar, New Delhi","11/7/2016 - 11/7/2016, Every day, AM Peak",2845,2102,3849
"200","Dabri - Gurgaon Road, Pocket 2, Sector 1 Dwarka, Dwarka, New Delhi","15","H205, Block H, Sarojini Nagar, New Delhi","11/7/2016 - 11/7/2016, Every day, AM Peak",3148,2456,4033
"200","Dabri - Gurgaon Road, Pocket 2, Sector 1 Dwarka, Dwarka, New Delhi","16","Andre Malraux Marg, Ramnagar, Chanakyapuri, New Delhi","11/7/2016 - 11/7/2016, Every day, AM Peak",2514,1898,3328
"200","Dabri - Gurgaon Road, Pocket 2, Sector 1 Dwarka, Dwarka, New Delhi","17","0 Khanna Market Road, Aliganj, Lodi Colony, New Delhi","11/7/2016 - 11/7/2016, Every day, AM Peak",3272,2704,3958
"200","Dabri - Gurgaon Road, Pocket 2, Sector 1 Dwarka, Dwarka, New Delhi","19","Mirdard Road, 64 Khamba, Maulana Azad Medical College Campus, New Delhi","11/7/2016 - 11/7/2016, Every day, AM Peak",4151,3064,5622
"200","Dabri - Gurgaon Road, Pocket 2, Sector 1 Dwarka, Dwarka, New Delhi","24","268, Block B2, Shiv Nagar, Janakpuri, New Delhi","11/7/2016 - 11/7/2016, Every day, AM Peak",885,593,1320
"200","Dabri - Gurgaon Road, Pocket 2, Sector 1 Dwarka, Dwarka, New Delhi","26","A3-214, Asalatpur Village, Janakpuri, Delhi","11/7/2016 - 11/7/2016, Every day, AM Peak",702,478,1029
"200","Dabri - Gurgaon Road, Pocket 2, Sector 1 Dwarka, Dwarka, New Delhi","27","0 Ram Mandir Marg, C5B Block, Janakpuri, New Delhi","11/7/2016 - 11/7/2016, Every day, AM Peak",628,436,904
"200","Dabri - Gurgaon Road, Pocket 2, Sector 1 Dwarka, Dwarka, New Delhi","28","nullSchool Road, Block M, Uttam Nagar, Delhi","11/7/2016 - 11/7/2016, Every day, AM Peak",692,505,948
"200","Dabri - Gurgaon Road, Pocket 2, Sector 1 Dwarka, Dwarka, New Delhi","29","Street Number 14, Block C, Sitapuri Part 1, Janakpuri, New Delhi","11/7/2016 - 11/7/2016, Every day, AM Peak",351,213,578
"200","Dabri - Gurgaon Road, Pocket 2, Sector 1 Dwarka, Dwarka, New Delhi","30","Unnamed Road, Asalatpur Khadar, Delhi","11/7/2016 - 11/7/2016, Every day, AM Peak",1371,1248,1504
"200","Dabri - Gurgaon Road, Pocket 2, Sector 1 Dwarka, Dwarka, New Delhi","31","Main Jhatikra Road, Paprawat, Delhi","11/7/2016 - 11/7/2016, Every day, AM Peak",894,611,1306
"200","Dabri - Gurgaon Road, Pocket 2, Sector 1 Dwarka, Dwarka, New Delhi","32","METRO MALL, Pocket 1, Sector 14 Dwarka, Dwarka, New Delhi","11/7/2016 - 11/7/2016, Every day, AM Peak",741,493,1112
"200","Dabri - Gurgaon Road, Pocket 2, Sector 1 Dwarka, Dwarka, New Delhi","61","Unnamed Road, National Zoological Park, Sundar Nagar, New Delhi","11/7/2016 - 11/7/2016, Every day, AM Peak",3789,2847,5041
"200","Dabri - Gurgaon Road, Pocket 2, Sector 1 Dwarka, Dwarka, New Delhi","62","D/116, Jeewan Nagar, Sunlight Colony, New Delhi","11/7/2016 - 11/7/2016, Every day, AM Peak",3430,2666,4412
"200","Dabri - Gurgaon Road, Pocket 2, Sector 1 Dwarka, Dwarka, New Delhi","63","Jawaharlal Nehru Stadium Marg, CGO Complex, Pragati Vihar, New Delhi","11/7/2016 - 11/7/2016, Every day, AM Peak",3361,2919,3869
"200","Dabri - Gurgaon Road, Pocket 2, Sector 1 Dwarka, Dwarka, New Delhi","64","6/37, Vikram Vihar, Lajpat Nagar IV, Lajpat Nagar, New Delhi","11/7/2016 - 11/7/2016, Every day, AM Peak",3335,2507,4435
"200","Dabri - Gurgaon Road, Pocket 2, Sector 1 Dwarka, Dwarka, New Delhi","65","Shaheed Jeet Singh Marg, NCERT Campus, Qutab Institutional Area, New Delhi","11/7/2016 - 11/7/2016, Every day, AM Peak",3075,2093,4515
"200","Dabri - Gurgaon Road, Pocket 2, Sector 1 Dwarka, Dwarka, New Delhi","66","nullBhagat Singh Market Marg, Block K, Malviya Nagar, New Delhi","11/7/2016 - 11/7/2016, Every day, AM Peak",4047,2729,5999
"200","Dabri - Gurgaon Road, Pocket 2, Sector 1 Dwarka, Dwarka, New Delhi","67","63/33, Hudco Place, Andrews Ganj Extension, Andrews Ganj, New Delhi","11/7/2016 - 11/7/2016, Every day, AM Peak",3229,2413,4320
"200","Dabri - Gurgaon Road, Pocket 2, Sector 1 Dwarka, Dwarka, New Delhi","68","0 Paschimi Marg, Block E, Vasant Vihar, New Delhi","11/7/2016 - 11/7/2016, Every day, AM Peak",2661,1820,3889
"200","Dabri - Gurgaon Road, Pocket 2, Sector 1 Dwarka, Dwarka, New Delhi","69","1129, Sector 2 R K Puram, Sector 2, RK Puram, New Delhi","11/7/2016 - 11/7/2016, Every day, AM Peak",2832,1958,4095
"200","Dabri - Gurgaon Road, Pocket 2, Sector 1 Dwarka, Dwarka, New Delhi","70","G288, Sector 3, Block G, Nanak Pura, South Moti Bagh, New Delhi","11/7/2016 - 11/7/2016, Every day, AM Peak",2365,1657,3374
"200","Dabri - Gurgaon Road, Pocket 2, Sector 1 Dwarka, Dwarka, New Delhi","71","JNU Ring Road, Jawaharlal Nehru University, New Delhi","11/7/2016 - 11/7/2016, Every day, AM Peak",2956,2061,4239
"200","Dabri - Gurgaon Road, Pocket 2, Sector 1 Dwarka, Dwarka, New Delhi","73","0 Central Avenue, Block E, Sainik Farm, New Delhi","11/7/2016 - 11/7/2016, Every day, AM Peak",4873,3602,6591
"200","Dabri - Gurgaon Road, Pocket 2, Sector 1 Dwarka, Dwarka, New Delhi","76","124, SPG Quarters, Sector 4, Pushp Vihar, New Delhi","11/7/2016 - 11/7/2016, Every day, AM Peak",4933,3622,6718
"200","Dabri - Gurgaon Road, Pocket 2, Sector 1 Dwarka, Dwarka, New Delhi","80","E-492, Block E, Greater Kailash II, Greater Kailash, New Delhi","11/7/2016 - 11/7/2016, Every day, AM Peak",3822,2502,5836
"200","Dabri - Gurgaon Road, Pocket 2, Sector 1 Dwarka, Dwarka, New Delhi","81","126, Block L 1, Alaknanda, New Delhi","11/7/2016 - 11/7/2016, Every day, AM Peak",3645,2439,5445
"200","Dabri - Gurgaon Road, Pocket 2, Sector 1 Dwarka, Dwarka, New Delhi","82","286, Asian Games Village Complex, Siri Fort, New Delhi","11/7/2016 - 11/7/2016, Every day, AM Peak",3610,2480,5254
"200","Dabri - Gurgaon Road, Pocket 2, Sector 1 Dwarka, Dwarka, New Delhi","83","C2, Block C, Kailash Colony, Greater Kailash, New Delhi","11/7/2016 - 11/7/2016, Every day, AM Peak",3780,2697,5297
"200","Dabri - Gurgaon Road, Pocket 2, Sector 1 Dwarka, Dwarka, New Delhi","84","nullMathura Road, Friends Colony West, Block A, New Friends Colony, New Delhi","11/7/2016 - 11/7/2016, Every day, AM Peak",3720,2849,4856
"200","Dabri - Gurgaon Road, Pocket 2, Sector 1 Dwarka, Dwarka, New Delhi","85","Outer Ring Road, Block 13, Nehru Enclave East, Okhla Industrial Area, New Delhi","11/7/2016 - 11/7/2016, Every day, AM Peak",3819,2799,5209
"200","Dabri - Gurgaon Road, Pocket 2, Sector 1 Dwarka, Dwarka, New Delhi","87","0 Maharaja Agarsen Marg, Subash Khand, Giri Nagar, Kalkaji, New Delhi","11/7/2016 - 11/7/2016, Every day, AM Peak",4546,3678,5618
"200","Dabri - Gurgaon Road, Pocket 2, Sector 1 Dwarka, Dwarka, New Delhi","90","C-86, Pocket C, Okhla Phase I, Okhla Industrial Area, New Delhi","11/7/2016 - 11/7/2016, Every day, AM Peak",3921,3288,4675
"200","Dabri - Gurgaon Road, Pocket 2, Sector 1 Dwarka, Dwarka, New Delhi","91","nullTum Road, Sanjay Colony II, Sanjay Colony, Okhla Phase II, Okhla Industrial Area, New Delhi","11/7/2016 - 11/7/2016, Every day, AM Peak",3832,2970,4942
"200","Dabri - Gurgaon Road, Pocket 2, Sector 1 Dwarka, Dwarka, New Delhi","101","4900 Ramdwara Road, Chuna Mandi, Aram Bagh, Paharganj, New Delhi","11/7/2016 - 11/7/2016, Every day, AM Peak",4071,3229,5131
"200","Dabri - Gurgaon Road, Pocket 2, Sector 1 Dwarka, Dwarka, New Delhi","102","nullGali Number 1A, Kailash Puri, Manglapuri, New Delhi","11/7/2016 - 11/7/2016, Every day, AM Peak",1074,471,2447
"200","Dabri - Gurgaon Road, Pocket 2, Sector 1 Dwarka, Dwarka, New Delhi","103","nullDasghara Road, Dasghara, New Delhi","11/7/2016 - 11/7/2016, Every day, AM Peak",2475,1915,3198
"200","Dabri - Gurgaon Road, Pocket 2, Sector 1 Dwarka, Dwarka, New Delhi","105","nullGoswami Girdhari Lal Marg, Industrial Area Phase I, Block C, Naraina Industrial Area Phase 1, Naraina, New Delhi","11/7/2016 - 11/7/2016, Every day, AM Peak",1614,1421,1831
"200","Dabri - Gurgaon Road, Pocket 2, Sector 1 Dwarka, Dwarka, New Delhi","111","61 TO 80, Pocket J, Sarita Vihar, New Delhi","11/7/2016 - 11/7/2016, Every day, AM Peak",3952,3158,4945
"200","Dabri - Gurgaon Road, Pocket 2, Sector 1 Dwarka, Dwarka, New Delhi","121","22/55, West Punjabi Bagh, Punjabi Bagh, Delhi","11/7/2016 - 11/7/2016, Every day, AM Peak",1731,1359,2204
"200","Dabri - Gurgaon Road, Pocket 2, Sector 1 Dwarka, Dwarka, New Delhi","123","Loknath Marg, Block M, Kirti Nagar, New Delhi","11/7/2016 - 11/7/2016, Every day, AM Peak",1967,1326,2916
"200","Dabri - Gurgaon Road, Pocket 2, Sector 1 Dwarka, Dwarka, New Delhi","124","30, 31, Block B, Mansarover Garden, New Delhi","11/7/2016 - 11/7/2016, Every day, AM Peak",1584,1116,2246
"200","Dabri - Gurgaon Road, Pocket 2, Sector 1 Dwarka, Dwarka, New Delhi","129","Gali Number 8, Anand Parbat, New Delhi","11/7/2016 - 11/7/2016, Every day, AM Peak",2637,1744,3985
"200","Dabri - Gurgaon Road, Pocket 2, Sector 1 Dwarka, Dwarka, New Delhi","135","0 Uggarsen Market Road, Meenakshi Garden, Ashok Nagar, Delhi","11/7/2016 - 11/7/2016, Every day, AM Peak",1633,1053,2530
"200","Dabri - Gurgaon Road, Pocket 2, Sector 1 Dwarka, Dwarka, New Delhi","136","nullKeshopur Road, New Chaukhandi, Paschim Vihar, Delhi","11/7/2016 - 11/7/2016, Every day, AM Peak",1116,880,1415
"200","Dabri - Gurgaon Road, Pocket 2, Sector 1 Dwarka, Dwarka, New Delhi","137","nullRoad Number 235, Block H, Vikaspuri, Delhi","11/7/2016 - 11/7/2016, Every day, AM Peak",1014,798,1287
"200","Dabri - Gurgaon Road, Pocket 2, Sector 1 Dwarka, Dwarka, New Delhi","141","nullBindapur Matiala Road, Nand Ram Park, Bhagat Enclave, Bindapur, Delhi","11/7/2016 - 11/7/2016, Every day, AM Peak",415,84,2038
"200","Dabri - Gurgaon Road, Pocket 2, Sector 1 Dwarka, Dwarka, New Delhi","142","Gali Number 1, Dabri Village, Dabri, New Delhi","11/7/2016 - 11/7/2016, Every day, AM Peak",461,292,727
"200","Dabri - Gurgaon Road, Pocket 2, Sector 1 Dwarka, Dwarka, New Delhi","143","nullRoad Number 221, Pocket 1, Sector 10 Dwarka, Dwarka, Delhi","11/7/2016 - 11/7/2016, Every day, AM Peak",374,152,914
"200","Dabri - Gurgaon Road, Pocket 2, Sector 1 Dwarka, Dwarka, New Delhi","146","nullKotla Road, Pocket F2, Pocket 1, Sector 11F, Rohini, Delhi","11/7/2016 - 11/7/2016, Every day, AM Peak",2293,1723,3050
"200","Dabri - Gurgaon Road, Pocket 2, Sector 1 Dwarka, Dwarka, New Delhi","148","Unnamed Road, Patparganj, New Delhi","11/7/2016 - 11/7/2016, Every day, AM Peak",3935,3140,4930
"200","Dabri - Gurgaon Road, Pocket 2, Sector 1 Dwarka, Dwarka, New Delhi","154","nullGali Number 6, Block B, Block D, Vinod Nagar North, Delhi","11/7/2016 - 11/7/2016, Every day, AM Peak",4142,3455,4965
"200","Dabri - Gurgaon Road, Pocket 2, Sector 1 Dwarka, Dwarka, New Delhi","155","Maharaja Agaersen Road, Block D, Pocket D, Phase 1, Ashok Vihar, Delhi","11/7/2016 - 11/7/2016, Every day, AM Peak",2154,1642,2824
"200","Dabri - Gurgaon Road, Pocket 2, Sector 1 Dwarka, Dwarka, New Delhi","156","Doctor Satpal Sachdeva Marg, Keshav Puram, Tri Nagar, Delhi","11/7/2016 - 11/7/2016, Every day, AM Peak",1828,1546,2161
"200","Dabri - Gurgaon Road, Pocket 2, Sector 1 Dwarka, Dwarka, New Delhi","159","300 Maharishi Balmiki Mandir Marg, Block H, Shakurpur Colony, Pitampura, Delhi","11/7/2016 - 11/7/2016, Every day, AM Peak",1903,1493,2425
"200","Dabri - Gurgaon Road, Pocket 2, Sector 1 Dwarka, Dwarka, New Delhi","160","23, Shiva Enclave, Pitampura, Delhi","11/7/2016 - 11/7/2016, Every day, AM Peak",1578,1270,1959
"200","Dabri - Gurgaon Road, Pocket 2, Sector 1 Dwarka, Dwarka, New Delhi","161","nullLawrence Road, Rampura Industrial Area, Tri Nagar, Delhi","11/7/2016 - 11/7/2016, Every day, AM Peak",1844,1450,2344
"200","Dabri - Gurgaon Road, Pocket 2, Sector 1 Dwarka, Dwarka, New Delhi","163","0 Guru Harkishan Marg, Maulana Azad Society, Bhagwan Buddha Housing Corporation Society, Pitampura, Delhi","11/7/2016 - 11/7/2016, Every day, AM Peak",1460,1117,1907
"200","Dabri - Gurgaon Road, Pocket 2, Sector 1 Dwarka, Dwarka, New Delhi","164","Shakurbasti Pedestrian Foot Over Bridge, Shakur Basti Railway Colony, Railway Colony South, Pitampura, Delhi","11/7/2016 - 11/7/2016, Every day, AM Peak",1777,1326,2380
"200","Dabri - Gurgaon Road, Pocket 2, Sector 1 Dwarka, Dwarka, New Delhi","165","31, Cottage Enclave, Paschim Vihar, Delhi","11/7/2016 - 11/7/2016, Every day, AM Peak",1274,1044,1554
"200","Dabri - Gurgaon Road, Pocket 2, Sector 1 Dwarka, Dwarka, New Delhi","166","nullRBI Enclave Road, Ankur Enclave, Paschim Vihar, Delhi","11/7/2016 - 11/7/2016, Every day, AM Peak",1171,944,1451
"200","Dabri - Gurgaon Road, Pocket 2, Sector 1 Dwarka, Dwarka, New Delhi","167","nullShaheed Udham Singh Marg, AE Block, Poorbi Shalimar Bag, Shalimar Bagh, Delhi","11/7/2016 - 11/7/2016, Every day, AM Peak",2099,1625,2709
"200","Dabri - Gurgaon Road, Pocket 2, Sector 1 Dwarka, Dwarka, New Delhi","169","G-9, Block F 1U, Ranikhet, Pitampura, Delhi","11/7/2016 - 11/7/2016, Every day, AM Peak",1570,1386,1778
"200","Dabri - Gurgaon Road, Pocket 2, Sector 1 Dwarka, Dwarka, New Delhi","170","nullColony Road, Block QP, Poorvi Pitampura, Pitampura, Delhi","11/7/2016 - 11/7/2016, Every day, AM Peak",1705,1311,2216
"200","Dabri - Gurgaon Road, Pocket 2, Sector 1 Dwarka, Dwarka, New Delhi","172","nullShiva Road, Pocket 14, Sector 8D, Rohini, Delhi","11/7/2016 - 11/7/2016, Every day, AM Peak",1637,1358,1973
"200","Dabri - Gurgaon Road, Pocket 2, Sector 1 Dwarka, Dwarka, New Delhi","173","Unnamed Road, Swarn Jayanti Park, Sector 10, Rohini, Delhi","11/7/2016 - 11/7/2016, Every day, AM Peak",1930,1548,2404
"200","Dabri - Gurgaon Road, Pocket 2, Sector 1 Dwarka, Dwarka, New Delhi","175","235, Block E, Block E, Mangolpuri, Delhi","11/7/2016 - 11/7/2016, Every day, AM Peak",1352,1122,1628
"200","Dabri - Gurgaon Road, Pocket 2, Sector 1 Dwarka, Dwarka, New Delhi","176","B7-187, Pocket 7, Sector 3B, Rohini, Delhi","11/7/2016 - 11/7/2016, Every day, AM Peak",1473,1228,1765
"200","Dabri - Gurgaon Road, Pocket 2, Sector 1 Dwarka, Dwarka, New Delhi","179","0 AB Road, Block RR, Mianwali Nagar, Paschim Vihar, Delhi","11/7/2016 - 11/7/2016, Every day, AM Peak",1328,1113,1584
"200","Dabri - Gurgaon Road, Pocket 2, Sector 1 Dwarka, Dwarka, New Delhi","180","GH-14/234, GH 14, Block GH 14, Paschim Vihar, Delhi","11/7/2016 - 11/7/2016, Every day, AM Peak",1181,967,1441
"200","Dabri - Gurgaon Road, Pocket 2, Sector 1 Dwarka, Dwarka, New Delhi","191","0 Hasanpur, I.P.Extension, Patparganj, Delhi","11/7/2016 - 11/7/2016, Every day, AM Peak",4849,4010,5863
"200","Dabri - Gurgaon Road, Pocket 2, Sector 1 Dwarka, Dwarka, New Delhi","193","Unnamed Road, Usmanpur, Shahdara, Delhi","11/7/2016 - 11/7/2016, Every day, AM Peak",3831,2969,4941
"200","Dabri - Gurgaon Road, Pocket 2, Sector 1 Dwarka, Dwarka, New Delhi","199","0 Shivaji Marg, New Moti Nagar, Najafgarh Road Industrial Area, Delhi","11/7/2016 - 11/7/2016, Every day, AM Peak",1944,1564,2415
"200","Dabri - Gurgaon Road, Pocket 2, Sector 1 Dwarka, Dwarka, New Delhi","208","Desh Bandhu Gupta Road, Block E, Jhandewalan Extension, Jhandewalan, New Delhi","11/7/2016 - 11/7/2016, Every day, AM Peak",3352,2751,4082
"200","Dabri - Gurgaon Road, Pocket 2, Sector 1 Dwarka, Dwarka, New Delhi","219","461, Block AG, Sanjay Gandhi Transport Nagar, Delhi","11/7/2016 - 11/7/2016, Every day, AM Peak",1909,1537,2370
"200","Dabri - Gurgaon Road, Pocket 2, Sector 1 Dwarka, Dwarka, New Delhi","222","Sector E, Mahipalpur Village, Vasant Kunj, New Delhi","11/7/2016 - 11/7/2016, Every day, AM Peak",2842,2065,3911
"200","Dabri - Gurgaon Road, Pocket 2, Sector 1 Dwarka, Dwarka, New Delhi","223","Urban Extension Road II, Indira Gandhi International Airport, New Delhi","11/7/2016 - 11/7/2016, Every day, AM Peak",1950,1294,2937
"200","Dabri - Gurgaon Road, Pocket 2, Sector 1 Dwarka, Dwarka, New Delhi","224","Main Road, Bharthal, Sector 27 Dwarka, Bharthal, New Delhi","11/7/2016 - 11/7/2016, Every day, AM Peak",943,541,1641
"200","Dabri - Gurgaon Road, Pocket 2, Sector 1 Dwarka, Dwarka, New Delhi","225","0 Netaji Road, A Block, Block C, Adarsh Nagar, Delhi","11/7/2016 - 11/7/2016, Every day, AM Peak",2054,1613,2613
"200","Dabri - Gurgaon Road, Pocket 2, Sector 1 Dwarka, Dwarka, New Delhi","226","Unnamed Road, Model Town, Delhi","11/7/2016 - 11/7/2016, Every day, AM Peak",2200,1729,2798
"200","Dabri - Gurgaon Road, Pocket 2, Sector 1 Dwarka, Dwarka, New Delhi","229","200 Road Number 28, Nehru Nagar, Shivaji Place, Basai Dara pur, Tagore Garden Extension, New Delhi","11/7/2016 - 11/7/2016, Every day, AM Peak",1936,1340,2795
"200","Dabri - Gurgaon Road, Pocket 2, Sector 1 Dwarka, Dwarka, New Delhi","231","G-17/6, Block G, Rajouri Garden, New Delhi","11/7/2016 - 11/7/2016, Every day, AM Peak",1726,1167,2551
"200","Dabri - Gurgaon Road, Pocket 2, Sector 1 Dwarka, Dwarka, New Delhi","232","4-3, Mayapuri Industrial Area Phase II, Mayapuri, New Delhi","11/7/2016 - 11/7/2016, Every day, AM Peak",854,606,1202
"200","Dabri - Gurgaon Road, Pocket 2, Sector 1 Dwarka, Dwarka, New Delhi","233","nullSatguru Ram Singh Marg, Block B, Mayapuri Industrial Area Phase I, Mayapuri, New Delhi","11/7/2016 - 11/7/2016, Every day, AM Peak",1167,904,1506
"200","Dabri - Gurgaon Road, Pocket 2, Sector 1 Dwarka, Dwarka, New Delhi","234","113, Press Colony, Press Colony, Mayapuri, New Delhi","11/7/2016 - 11/7/2016, Every day, AM Peak",1308,1000,1710
"200","Dabri - Gurgaon Road, Pocket 2, Sector 1 Dwarka, Dwarka, New Delhi","235","nullBharat Vihar Road, Block G, Raja Puri, Matiala, Delhi","11/7/2016 - 11/7/2016, Every day, AM Peak",307,175,537
"200","Dabri - Gurgaon Road, Pocket 2, Sector 1 Dwarka, Dwarka, New Delhi","240","37, Sector 15, Pocket 6, Sector 15B, Rohini, Delhi","11/7/2016 - 11/7/2016, Every day, AM Peak",1861,1420,2437
"200","Dabri - Gurgaon Road, Pocket 2, Sector 1 Dwarka, Dwarka, New Delhi","244","Dhingra Park Trail, Punjabi Bagh Cooperative Housing Soceity, East Punjabi Bagh, Punjabi Bagh, Delhi","11/7/2016 - 11/7/2016, Every day, AM Peak",1788,1378,2319
"200","Dabri - Gurgaon Road, Pocket 2, Sector 1 Dwarka, Dwarka, New Delhi","245","N-1/17, Block M, Mangolpuri, Delhi","11/7/2016 - 11/7/2016, Every day, AM Peak",1585,1350,1859
"200","Dabri - Gurgaon Road, Pocket 2, Sector 1 Dwarka, Dwarka, New Delhi","246","nullShiv Mandir Marg, Block G, Lajpat Nagar I, Lajpat Nagar, New Delhi","11/7/2016 - 11/7/2016, Every day, AM Peak",3158,2492,4001
"200","Dabri - Gurgaon Road, Pocket 2, Sector 1 Dwarka, Dwarka, New Delhi","247","9/2082, Pocket 2, Block RZ, Palam Colony, New Delhi","11/7/2016 - 11/7/2016, Every day, AM Peak",365,168,789
"200","Dabri - Gurgaon Road, Pocket 2, Sector 1 Dwarka, Dwarka, New Delhi","248","Unnamed Road, Harijan Basti, Rajokri, New Delhi","11/7/2016 - 11/7/2016, Every day, AM Peak",2860,2197,3721
"200","Dabri - Gurgaon Road, Pocket 2, Sector 1 Dwarka, Dwarka, New Delhi","251","A25, Block R, Pocket A, Rajender Nagar Part 1, New Rajinder Nagar, New Delhi","11/7/2016 - 11/7/2016, Every day, AM Peak",2913,2245,3779
"200","Dabri - Gurgaon Road, Pocket 2, Sector 1 Dwarka, Dwarka, New Delhi","252","813, Sector 1, RK Puram, New Delhi","11/7/2016 - 11/7/2016, Every day, AM Peak",2565,1828,3598
"200","Dabri - Gurgaon Road, Pocket 2, Sector 1 Dwarka, Dwarka, New Delhi","253","0 Chaudhary Harsukh Marg, B6, Block B6, Humayunpur, Safdarjung Enclave, New Delhi","11/7/2016 - 11/7/2016, Every day, AM Peak",2950,2015,4318
"200","Dabri - Gurgaon Road, Pocket 2, Sector 1 Dwarka, Dwarka, New Delhi","254","Squadron Leader Mohinder Kumar Jain Marg, Block B, New Delhi","11/7/2016 - 11/7/2016, Every day, AM Peak",3146,2105,4701
"200","Dabri - Gurgaon Road, Pocket 2, Sector 1 Dwarka, Dwarka, New Delhi","255","1700 Uday Chand Marg, Arya Basti, Zafar Nagar, Kotla Mubarakpur, South Extension I, New Delhi","11/7/2016 - 11/7/2016, Every day, AM Peak",2921,2232,3821
"200","Dabri - Gurgaon Road, Pocket 2, Sector 1 Dwarka, Dwarka, New Delhi","256","D-70, Mahavir Enclave I, Mahavir Enclave Part 2, Mahavir Enclave, New Delhi","11/7/2016 - 11/7/2016, Every day, AM Peak",288,141,586
"200","Dabri - Gurgaon Road, Pocket 2, Sector 1 Dwarka, Dwarka, New Delhi","258","Sant Sujan Singh Marg, JJ Colony, Block N, Tagore Garden, Tagore Garden Extension, New Delhi","11/7/2016 - 11/7/2016, Every day, AM Peak",1883,1199,2956
"200","Dabri - Gurgaon Road, Pocket 2, Sector 1 Dwarka, Dwarka, New Delhi","259","Jogging Lane, Pocket B-C, Sector-A, Vasant Kunj, New Delhi","11/7/2016 - 11/7/2016, Every day, AM Peak",3997,2779,5748
"200","Dabri - Gurgaon Road, Pocket 2, Sector 1 Dwarka, Dwarka, New Delhi","264","Noida Link Road, Nehru Enclave, Shakarpur Khas, New Delhi","11/7/2016 - 11/7/2016, Every day, AM Peak",4180,3059,5711
"200","Dabri - Gurgaon Road, Pocket 2, Sector 1 Dwarka, Dwarka, New Delhi","275","125/16, Jogabai Extension, Zakir Nagar, Okhla, New Delhi","11/7/2016 - 11/7/2016, Every day, AM Peak",4151,3633,4742
"200","Dabri - Gurgaon Road, Pocket 2, Sector 1 Dwarka, Dwarka, New Delhi","279","Nightingale Road, Budella, Vikaspuri, Delhi","11/7/2016 - 11/7/2016, Every day, AM Peak",977,747,1276
"200","Dabri - Gurgaon Road, Pocket 2, Sector 1 Dwarka, Dwarka, New Delhi","280","nullHastsal Road, Block A2, JJ Colony, Uttam Nagar, Delhi","11/7/2016 - 11/7/2016, Every day, AM Peak",980,732,1311
"200","Dabri - Gurgaon Road, Pocket 2, Sector 1 Dwarka, Dwarka, New Delhi","281","D915, New Mahavir Nagar, Tilak Nagar, Delhi","11/7/2016 - 11/7/2016, Every day, AM Peak",946,712,1256
"200","Dabri - Gurgaon Road, Pocket 2, Sector 1 Dwarka, Dwarka, New Delhi","282","Velodrome Road, Gandhi Smriti, Raj Ghat, New Delhi","11/7/2016 - 11/7/2016, Every day, AM Peak",4134,2965,5762