"Origin Movement ID","Origin Display Name","Destination Movement ID","Destination Display Name","Date Range","Mean Travel Time (Seconds)","Range - Lower Bound Travel Time (Seconds)","Range - Upper Bound Travel Time (Seconds)"
"169","G-9, Block F 1U, Ranikhet, Pitampura, Delhi","1","300 Ring Road, Block CB, Naraina Village, Naraina, New Delhi","11/7/2016 - 11/7/2016, Every day, AM Peak",2029,1469,2800
"169","G-9, Block F 1U, Ranikhet, Pitampura, Delhi","2","Unnamed Road, Delhi Cantonment, New Delhi","11/7/2016 - 11/7/2016, Every day, AM Peak",2189,1665,2877
"169","G-9, Block F 1U, Ranikhet, Pitampura, Delhi","3","Unnamed Road, Mahipalpur, New Delhi","11/7/2016 - 11/7/2016, Every day, AM Peak",3648,2918,4560
"169","G-9, Block F 1U, Ranikhet, Pitampura, Delhi","4","P-268/3, Rock View, Delhi Cantonment, Delhi","11/7/2016 - 11/7/2016, Every day, AM Peak",3646,2933,4531
"169","G-9, Block F 1U, Ranikhet, Pitampura, Delhi","5","Old Palam Road, Delhi Cantonment, New Delhi","11/7/2016 - 11/7/2016, Every day, AM Peak",3690,2753,4945
"169","G-9, Block F 1U, Ranikhet, Pitampura, Delhi","7","P 13, Baird Place, Delhi Cantonment, New Delhi","11/7/2016 - 11/7/2016, Every day, AM Peak",2224,1640,3014
"169","G-9, Block F 1U, Ranikhet, Pitampura, Delhi","8","Mall Road, Khyber Lines, Delhi Cantonment, New Delhi","11/7/2016 - 11/7/2016, Every day, AM Peak",2525,1940,3285
"169","G-9, Block F 1U, Ranikhet, Pitampura, Delhi","9","Mahatma Jyothi Rao Phule Marg, Mahatma Jyoti Rao Phule Marg Area, New Delhi","11/7/2016 - 11/7/2016, Every day, AM Peak",3227,2776,3751
"169","G-9, Block F 1U, Ranikhet, Pitampura, Delhi","10","0 Shaheed Bhagat Singh Marg, DIZ Staff Quarters, Connaught Place, New Delhi","11/7/2016 - 11/7/2016, Every day, AM Peak",2759,2280,3337
"169","G-9, Block F 1U, Ranikhet, Pitampura, Delhi","11","Mother Teresa Crescent, Talkatora Garden, Central Ridge Reserve Forest, New Delhi","11/7/2016 - 11/7/2016, Every day, AM Peak",2449,1891,3170
"169","G-9, Block F 1U, Ranikhet, Pitampura, Delhi","12","Jantar Mantar Road, Janpath, Connaught Place, New Delhi","11/7/2016 - 11/7/2016, Every day, AM Peak",3005,2418,3733
"169","G-9, Block F 1U, Ranikhet, Pitampura, Delhi","13","10, Aurangzeb Road, New Delhi","11/7/2016 - 11/7/2016, Every day, AM Peak",3354,2659,4229
"169","G-9, Block F 1U, Ranikhet, Pitampura, Delhi","14","Mahatma Gandhi Road, Kidwai Nagar West, Kidwai Nagar, New Delhi","11/7/2016 - 11/7/2016, Every day, AM Peak",2885,2316,3592
"169","G-9, Block F 1U, Ranikhet, Pitampura, Delhi","16","Andre Malraux Marg, Ramnagar, Chanakyapuri, New Delhi","11/7/2016 - 11/7/2016, Every day, AM Peak",2559,1981,3304
"169","G-9, Block F 1U, Ranikhet, Pitampura, Delhi","18","Unnamed Road, Lal Qila, Chandni Chowk, New Delhi","11/7/2016 - 11/7/2016, Every day, AM Peak",2438,1944,3056
"169","G-9, Block F 1U, Ranikhet, Pitampura, Delhi","19","Mirdard Road, 64 Khamba, Maulana Azad Medical College Campus, New Delhi","11/7/2016 - 11/7/2016, Every day, AM Peak",3395,2952,3904
"169","G-9, Block F 1U, Ranikhet, Pitampura, Delhi","24","268, Block B2, Shiv Nagar, Janakpuri, New Delhi","11/7/2016 - 11/7/2016, Every day, AM Peak",1124,837,1508
"169","G-9, Block F 1U, Ranikhet, Pitampura, Delhi","25","nullNehru Vihar Road, B Block, A Block, Nehru Vihar, Mukherjee Nagar, Delhi","11/7/2016 - 11/7/2016, Every day, AM Peak",773,561,1063
"169","G-9, Block F 1U, Ranikhet, Pitampura, Delhi","26","A3-214, Asalatpur Village, Janakpuri, Delhi","11/7/2016 - 11/7/2016, Every day, AM Peak",1136,862,1496
"169","G-9, Block F 1U, Ranikhet, Pitampura, Delhi","27","0 Ram Mandir Marg, C5B Block, Janakpuri, New Delhi","11/7/2016 - 11/7/2016, Every day, AM Peak",1359,1014,1819
"169","G-9, Block F 1U, Ranikhet, Pitampura, Delhi","28","nullSchool Road, Block M, Uttam Nagar, Delhi","11/7/2016 - 11/7/2016, Every day, AM Peak",1525,1161,2001
"169","G-9, Block F 1U, Ranikhet, Pitampura, Delhi","29","Street Number 14, Block C, Sitapuri Part 1, Janakpuri, New Delhi","11/7/2016 - 11/7/2016, Every day, AM Peak",1546,1207,1979
"169","G-9, Block F 1U, Ranikhet, Pitampura, Delhi","32","METRO MALL, Pocket 1, Sector 14 Dwarka, Dwarka, New Delhi","11/7/2016 - 11/7/2016, Every day, AM Peak",2647,2021,3466
"169","G-9, Block F 1U, Ranikhet, Pitampura, Delhi","40","Gali Saini Tent, Ram Nagar, Shahdara, Delhi","11/7/2016 - 11/7/2016, Every day, AM Peak",2325,1652,3271
"169","G-9, Block F 1U, Ranikhet, Pitampura, Delhi","41","Lala Raghubar Dayal Marg, Phase 4, Block B, Subhash Park, Shahdara, Delhi","11/7/2016 - 11/7/2016, Every day, AM Peak",2252,1578,3213
"169","G-9, Block F 1U, Ranikhet, Pitampura, Delhi","43","A537, New Seelampur Phase II, New Seelampur, Shahdara, Delhi","11/7/2016 - 11/7/2016, Every day, AM Peak",2074,1427,3012
"169","G-9, Block F 1U, Ranikhet, Pitampura, Delhi","61","Unnamed Road, National Zoological Park, Sundar Nagar, New Delhi","11/7/2016 - 11/7/2016, Every day, AM Peak",3236,2680,3907
"169","G-9, Block F 1U, Ranikhet, Pitampura, Delhi","62","D/116, Jeewan Nagar, Sunlight Colony, New Delhi","11/7/2016 - 11/7/2016, Every day, AM Peak",3592,2862,4508
"169","G-9, Block F 1U, Ranikhet, Pitampura, Delhi","63","Jawaharlal Nehru Stadium Marg, CGO Complex, Pragati Vihar, New Delhi","11/7/2016 - 11/7/2016, Every day, AM Peak",3298,2990,3637
"169","G-9, Block F 1U, Ranikhet, Pitampura, Delhi","64","6/37, Vikram Vihar, Lajpat Nagar IV, Lajpat Nagar, New Delhi","11/7/2016 - 11/7/2016, Every day, AM Peak",3806,3432,4219
"169","G-9, Block F 1U, Ranikhet, Pitampura, Delhi","65","Shaheed Jeet Singh Marg, NCERT Campus, Qutab Institutional Area, New Delhi","11/7/2016 - 11/7/2016, Every day, AM Peak",3506,2899,4239
"169","G-9, Block F 1U, Ranikhet, Pitampura, Delhi","67","63/33, Hudco Place, Andrews Ganj Extension, Andrews Ganj, New Delhi","11/7/2016 - 11/7/2016, Every day, AM Peak",3342,3124,3574
"169","G-9, Block F 1U, Ranikhet, Pitampura, Delhi","68","0 Paschimi Marg, Block E, Vasant Vihar, New Delhi","11/7/2016 - 11/7/2016, Every day, AM Peak",3575,2943,4342
"169","G-9, Block F 1U, Ranikhet, Pitampura, Delhi","69","1129, Sector 2 R K Puram, Sector 2, RK Puram, New Delhi","11/7/2016 - 11/7/2016, Every day, AM Peak",3130,2687,3645
"169","G-9, Block F 1U, Ranikhet, Pitampura, Delhi","70","G288, Sector 3, Block G, Nanak Pura, South Moti Bagh, New Delhi","11/7/2016 - 11/7/2016, Every day, AM Peak",2660,2054,3443
"169","G-9, Block F 1U, Ranikhet, Pitampura, Delhi","71","JNU Ring Road, Jawaharlal Nehru University, New Delhi","11/7/2016 - 11/7/2016, Every day, AM Peak",3597,2884,4486
"169","G-9, Block F 1U, Ranikhet, Pitampura, Delhi","84","nullMathura Road, Friends Colony West, Block A, New Friends Colony, New Delhi","11/7/2016 - 11/7/2016, Every day, AM Peak",4199,3371,5228
"169","G-9, Block F 1U, Ranikhet, Pitampura, Delhi","85","Outer Ring Road, Block 13, Nehru Enclave East, Okhla Industrial Area, New Delhi","11/7/2016 - 11/7/2016, Every day, AM Peak",4502,4090,4954
"169","G-9, Block F 1U, Ranikhet, Pitampura, Delhi","91","nullTum Road, Sanjay Colony II, Sanjay Colony, Okhla Phase II, Okhla Industrial Area, New Delhi","11/7/2016 - 11/7/2016, Every day, AM Peak",5114,4442,5887
"169","G-9, Block F 1U, Ranikhet, Pitampura, Delhi","100","Maharishi Balmiki Marg, Police Colony, Sarai Khalil, Sadar Bazaar, New Delhi","11/7/2016 - 11/7/2016, Every day, AM Peak",2064,1705,2497
"169","G-9, Block F 1U, Ranikhet, Pitampura, Delhi","101","4900 Ramdwara Road, Chuna Mandi, Aram Bagh, Paharganj, New Delhi","11/7/2016 - 11/7/2016, Every day, AM Peak",2443,2041,2922
"169","G-9, Block F 1U, Ranikhet, Pitampura, Delhi","103","nullDasghara Road, Dasghara, New Delhi","11/7/2016 - 11/7/2016, Every day, AM Peak",1675,1230,2280
"169","G-9, Block F 1U, Ranikhet, Pitampura, Delhi","105","nullGoswami Girdhari Lal Marg, Industrial Area Phase I, Block C, Naraina Industrial Area Phase 1, Naraina, New Delhi","11/7/2016 - 11/7/2016, Every day, AM Peak",1982,1459,2691
"169","G-9, Block F 1U, Ranikhet, Pitampura, Delhi","112","F-8, West Chandra Nagar, Chander Nagar, Krishna Nagar, Delhi","11/7/2016 - 11/7/2016, Every day, AM Peak",2497,1982,3145
"169","G-9, Block F 1U, Ranikhet, Pitampura, Delhi","116","9/5284, Shanti Mohalla, Seelampur, Shahdara, Delhi","11/7/2016 - 11/7/2016, Every day, AM Peak",2152,1489,3108
"169","G-9, Block F 1U, Ranikhet, Pitampura, Delhi","121","22/55, West Punjabi Bagh, Punjabi Bagh, Delhi","11/7/2016 - 11/7/2016, Every day, AM Peak",1031,705,1506
"169","G-9, Block F 1U, Ranikhet, Pitampura, Delhi","122","2600 Mandir Wali Gali, Ranjeet Nagar, Shadipur, Delhi","11/7/2016 - 11/7/2016, Every day, AM Peak",1477,1076,2025
"169","G-9, Block F 1U, Ranikhet, Pitampura, Delhi","123","Loknath Marg, Block M, Kirti Nagar, New Delhi","11/7/2016 - 11/7/2016, Every day, AM Peak",1247,853,1821
"169","G-9, Block F 1U, Ranikhet, Pitampura, Delhi","124","30, 31, Block B, Mansarover Garden, New Delhi","11/7/2016 - 11/7/2016, Every day, AM Peak",1549,1140,2102
"169","G-9, Block F 1U, Ranikhet, Pitampura, Delhi","127","NDPL House, Lala Achintaram Marg, Block B, Gujranwala Town, Delhi","11/7/2016 - 11/7/2016, Every day, AM Peak",1188,1014,1390
"169","G-9, Block F 1U, Ranikhet, Pitampura, Delhi","128","0 Shakti Mandir Marg, Block 10, Shakti Nagar, Delhi","11/7/2016 - 11/7/2016, Every day, AM Peak",1352,1187,1539
"169","G-9, Block F 1U, Ranikhet, Pitampura, Delhi","129","Gali Number 8, Anand Parbat, New Delhi","11/7/2016 - 11/7/2016, Every day, AM Peak",1296,999,1680
"169","G-9, Block F 1U, Ranikhet, Pitampura, Delhi","130","Bhagat Singh Marg, Kashmiri Bagh, Chandra Shekhar Azad Colony, Sarai Rohilla, New Delhi","11/7/2016 - 11/7/2016, Every day, AM Peak",1419,1147,1754
"169","G-9, Block F 1U, Ranikhet, Pitampura, Delhi","132","1600 Lothian Road, Chabi Ganj, Kashmere Gate, New Delhi","11/7/2016 - 11/7/2016, Every day, AM Peak",1789,1367,2339
"169","G-9, Block F 1U, Ranikhet, Pitampura, Delhi","133","0 Raj Niwas Marg, Ludlow Castle, Civil Lines, Delhi","11/7/2016 - 11/7/2016, Every day, AM Peak",1202,890,1622
"169","G-9, Block F 1U, Ranikhet, Pitampura, Delhi","135","0 Uggarsen Market Road, Meenakshi Garden, Ashok Nagar, Delhi","11/7/2016 - 11/7/2016, Every day, AM Peak",1221,819,1818
"169","G-9, Block F 1U, Ranikhet, Pitampura, Delhi","136","nullKeshopur Road, New Chaukhandi, Paschim Vihar, Delhi","11/7/2016 - 11/7/2016, Every day, AM Peak",780,596,1019
"169","G-9, Block F 1U, Ranikhet, Pitampura, Delhi","137","nullRoad Number 235, Block H, Vikaspuri, Delhi","11/7/2016 - 11/7/2016, Every day, AM Peak",841,638,1107
"169","G-9, Block F 1U, Ranikhet, Pitampura, Delhi","139","nullBudh Bazar Road, Nawada, Nawada Majra Village, Nawada, Delhi","11/7/2016 - 11/7/2016, Every day, AM Peak",1979,1554,2519
"169","G-9, Block F 1U, Ranikhet, Pitampura, Delhi","140","A12/B, Sainik Nagar, Mansa Ram Park, Uttam Nagar, Delhi","11/7/2016 - 11/7/2016, Every day, AM Peak",2081,1641,2637
"169","G-9, Block F 1U, Ranikhet, Pitampura, Delhi","142","Gali Number 1, Dabri Village, Dabri, New Delhi","11/7/2016 - 11/7/2016, Every day, AM Peak",1540,1131,2095
"169","G-9, Block F 1U, Ranikhet, Pitampura, Delhi","143","nullRoad Number 221, Pocket 1, Sector 10 Dwarka, Dwarka, Delhi","11/7/2016 - 11/7/2016, Every day, AM Peak",2458,1926,3136
"169","G-9, Block F 1U, Ranikhet, Pitampura, Delhi","146","nullKotla Road, Pocket F2, Pocket 1, Sector 11F, Rohini, Delhi","11/7/2016 - 11/7/2016, Every day, AM Peak",805,543,1192
"169","G-9, Block F 1U, Ranikhet, Pitampura, Delhi","148","Unnamed Road, Patparganj, New Delhi","11/7/2016 - 11/7/2016, Every day, AM Peak",3284,2647,4073
"169","G-9, Block F 1U, Ranikhet, Pitampura, Delhi","151","Shaheed Budh Ram Singh Marg, Dallupura, New Delhi","11/7/2016 - 11/7/2016, Every day, AM Peak",4172,3713,4686
"169","G-9, Block F 1U, Ranikhet, Pitampura, Delhi","154","nullGali Number 6, Block B, Block D, Vinod Nagar North, Delhi","11/7/2016 - 11/7/2016, Every day, AM Peak",3008,2576,3512
"169","G-9, Block F 1U, Ranikhet, Pitampura, Delhi","155","Maharaja Agaersen Road, Block D, Pocket D, Phase 1, Ashok Vihar, Delhi","11/7/2016 - 11/7/2016, Every day, AM Peak",924,681,1252
"169","G-9, Block F 1U, Ranikhet, Pitampura, Delhi","156","Doctor Satpal Sachdeva Marg, Keshav Puram, Tri Nagar, Delhi","11/7/2016 - 11/7/2016, Every day, AM Peak",704,448,1104
"169","G-9, Block F 1U, Ranikhet, Pitampura, Delhi","157","CH Devender Singh Tewatia Marg, Ashok Vihar II, Pocket B 1, Phase 3, Ashok Vihar, Delhi","11/7/2016 - 11/7/2016, Every day, AM Peak",1043,812,1338
"169","G-9, Block F 1U, Ranikhet, Pitampura, Delhi","158","484, Block E, Nimri Colony, Ashok Vihar, Delhi","11/7/2016 - 11/7/2016, Every day, AM Peak",901,642,1262
"169","G-9, Block F 1U, Ranikhet, Pitampura, Delhi","159","300 Maharishi Balmiki Mandir Marg, Block H, Shakurpur Colony, Pitampura, Delhi","11/7/2016 - 11/7/2016, Every day, AM Peak",648,361,1160
"169","G-9, Block F 1U, Ranikhet, Pitampura, Delhi","160","23, Shiva Enclave, Pitampura, Delhi","11/7/2016 - 11/7/2016, Every day, AM Peak",334,162,686
"169","G-9, Block F 1U, Ranikhet, Pitampura, Delhi","161","nullLawrence Road, Rampura Industrial Area, Tri Nagar, Delhi","11/7/2016 - 11/7/2016, Every day, AM Peak",845,501,1423
"169","G-9, Block F 1U, Ranikhet, Pitampura, Delhi","162","2400 Pt Govind Ram Shastri Marg, Ganeshpura, Tri Nagar, Delhi","11/7/2016 - 11/7/2016, Every day, AM Peak",937,704,1246
"169","G-9, Block F 1U, Ranikhet, Pitampura, Delhi","163","0 Guru Harkishan Marg, Maulana Azad Society, Bhagwan Buddha Housing Corporation Society, Pitampura, Delhi","11/7/2016 - 11/7/2016, Every day, AM Peak",421,263,672
"169","G-9, Block F 1U, Ranikhet, Pitampura, Delhi","164","Shakurbasti Pedestrian Foot Over Bridge, Shakur Basti Railway Colony, Railway Colony South, Pitampura, Delhi","11/7/2016 - 11/7/2016, Every day, AM Peak",853,533,1364
"169","G-9, Block F 1U, Ranikhet, Pitampura, Delhi","165","31, Cottage Enclave, Paschim Vihar, Delhi","11/7/2016 - 11/7/2016, Every day, AM Peak",562,395,798
"169","G-9, Block F 1U, Ranikhet, Pitampura, Delhi","166","nullRBI Enclave Road, Ankur Enclave, Paschim Vihar, Delhi","11/7/2016 - 11/7/2016, Every day, AM Peak",692,502,952
"169","G-9, Block F 1U, Ranikhet, Pitampura, Delhi","167","nullShaheed Udham Singh Marg, AE Block, Poorbi Shalimar Bag, Shalimar Bagh, Delhi","11/7/2016 - 11/7/2016, Every day, AM Peak",735,480,1123
"169","G-9, Block F 1U, Ranikhet, Pitampura, Delhi","168","nullGyan Shakti Mandir Marg, Block BA, West Shalimar Bagh, Shalimar Bagh, Delhi","11/7/2016 - 11/7/2016, Every day, AM Peak",362,212,616
"169","G-9, Block F 1U, Ranikhet, Pitampura, Delhi","170","nullColony Road, Block QP, Poorvi Pitampura, Pitampura, Delhi","11/7/2016 - 11/7/2016, Every day, AM Peak",313,148,659
"169","G-9, Block F 1U, Ranikhet, Pitampura, Delhi","171","nullG Block Road, Pocket 21, Sector 7G, Rohini, Delhi","11/7/2016 - 11/7/2016, Every day, AM Peak",565,339,940
"169","G-9, Block F 1U, Ranikhet, Pitampura, Delhi","172","nullShiva Road, Pocket 14, Sector 8D, Rohini, Delhi","11/7/2016 - 11/7/2016, Every day, AM Peak",241,77,754
"169","G-9, Block F 1U, Ranikhet, Pitampura, Delhi","173","Unnamed Road, Swarn Jayanti Park, Sector 10, Rohini, Delhi","11/7/2016 - 11/7/2016, Every day, AM Peak",476,220,1026
"169","G-9, Block F 1U, Ranikhet, Pitampura, Delhi","175","235, Block E, Block E, Mangolpuri, Delhi","11/7/2016 - 11/7/2016, Every day, AM Peak",451,308,659
"169","G-9, Block F 1U, Ranikhet, Pitampura, Delhi","176","B7-187, Pocket 7, Sector 3B, Rohini, Delhi","11/7/2016 - 11/7/2016, Every day, AM Peak",486,269,877
"169","G-9, Block F 1U, Ranikhet, Pitampura, Delhi","178","I334, Saini Mohalla, Shiv Vihar, Nangloi, Delhi","11/7/2016 - 11/7/2016, Every day, AM Peak",957,855,1071
"169","G-9, Block F 1U, Ranikhet, Pitampura, Delhi","179","0 AB Road, Block RR, Mianwali Nagar, Paschim Vihar, Delhi","11/7/2016 - 11/7/2016, Every day, AM Peak",800,570,1121
"169","G-9, Block F 1U, Ranikhet, Pitampura, Delhi","180","GH-14/234, GH 14, Block GH 14, Paschim Vihar, Delhi","11/7/2016 - 11/7/2016, Every day, AM Peak",1002,673,1490
"169","G-9, Block F 1U, Ranikhet, Pitampura, Delhi","185","Bawana Road, Puth Khurd, Delhi","11/7/2016 - 11/7/2016, Every day, AM Peak",1685,1184,2397
"169","G-9, Block F 1U, Ranikhet, Pitampura, Delhi","186","14, Sector 21, Rohini, Delhi","11/7/2016 - 11/7/2016, Every day, AM Peak",1374,978,1928
"169","G-9, Block F 1U, Ranikhet, Pitampura, Delhi","188","12/188, Shastri Nagar, Geeta Colony, New Delhi","11/7/2016 - 11/7/2016, Every day, AM Peak",2471,1898,3215
"169","G-9, Block F 1U, Ranikhet, Pitampura, Delhi","189","F22, Block F, Krishna Nagar, Delhi","11/7/2016 - 11/7/2016, Every day, AM Peak",2477,1938,3164
"169","G-9, Block F 1U, Ranikhet, Pitampura, Delhi","190","F-33, Block F, Preet Vihar, Delhi","11/7/2016 - 11/7/2016, Every day, AM Peak",3167,2829,3544
"169","G-9, Block F 1U, Ranikhet, Pitampura, Delhi","191","0 Hasanpur, I.P.Extension, Patparganj, Delhi","11/7/2016 - 11/7/2016, Every day, AM Peak",3579,3140,4078
"169","G-9, Block F 1U, Ranikhet, Pitampura, Delhi","193","Unnamed Road, Usmanpur, Shahdara, Delhi","11/7/2016 - 11/7/2016, Every day, AM Peak",2491,1839,3373
"169","G-9, Block F 1U, Ranikhet, Pitampura, Delhi","195","F-208/C, Block F, Laxmi Nagar, New Delhi","11/7/2016 - 11/7/2016, Every day, AM Peak",2724,2220,3342
"169","G-9, Block F 1U, Ranikhet, Pitampura, Delhi","196","nullSir Chotu Ram Marg, Pocket 4, Sector 6C, Rohini, Delhi","11/7/2016 - 11/7/2016, Every day, AM Peak",776,413,1457
"169","G-9, Block F 1U, Ranikhet, Pitampura, Delhi","199","0 Shivaji Marg, New Moti Nagar, Najafgarh Road Industrial Area, Delhi","11/7/2016 - 11/7/2016, Every day, AM Peak",1245,867,1786
"169","G-9, Block F 1U, Ranikhet, Pitampura, Delhi","200","Dabri - Gurgaon Road, Pocket 2, Sector 1 Dwarka, Dwarka, New Delhi","11/7/2016 - 11/7/2016, Every day, AM Peak",1856,1443,2385
"169","G-9, Block F 1U, Ranikhet, Pitampura, Delhi","204","0 East Patel Nagar Road, Block 10A, East Patel Nagar, Patel Nagar, New Delhi","11/7/2016 - 11/7/2016, Every day, AM Peak",1608,1186,2178
"169","G-9, Block F 1U, Ranikhet, Pitampura, Delhi","205","2100 Gali Number 14, Block B, Prem Nagar, Patel Nagar, New Delhi","11/7/2016 - 11/7/2016, Every day, AM Peak",1357,980,1877
"169","G-9, Block F 1U, Ranikhet, Pitampura, Delhi","207","0 Maharana Pratap Road, Block 53, Karol Bagh, New Delhi","11/7/2016 - 11/7/2016, Every day, AM Peak",1696,1345,2137
"169","G-9, Block F 1U, Ranikhet, Pitampura, Delhi","208","Desh Bandhu Gupta Road, Block E, Jhandewalan Extension, Jhandewalan, New Delhi","11/7/2016 - 11/7/2016, Every day, AM Peak",2192,1829,2626
"169","G-9, Block F 1U, Ranikhet, Pitampura, Delhi","210","Unnamed Road, Bakhtawar Pur, Bakhtawarpur, Delhi","11/7/2016 - 11/7/2016, Every day, AM Peak",804,638,1012
"169","G-9, Block F 1U, Ranikhet, Pitampura, Delhi","211","Holambi Main Road, Iradat Nagar, Delhi","11/7/2016 - 11/7/2016, Every day, AM Peak",689,546,868
"169","G-9, Block F 1U, Ranikhet, Pitampura, Delhi","212","Bawana Road, Sector 30, Rohini, Delhi","11/7/2016 - 11/7/2016, Every day, AM Peak",1079,751,1550
"169","G-9, Block F 1U, Ranikhet, Pitampura, Delhi","215","Unnamed Road, Bagiabad, Jharoda Majra Burari, Delhi","11/7/2016 - 11/7/2016, Every day, AM Peak",619,441,868
"169","G-9, Block F 1U, Ranikhet, Pitampura, Delhi","216","0 Main Canal Road, Harit Vihar, Mukandpur Part 2, Mukundpur, Delhi","11/7/2016 - 11/7/2016, Every day, AM Peak",485,337,696
"169","G-9, Block F 1U, Ranikhet, Pitampura, Delhi","218","nullTandoor Wali Gali, Swami Shraddhanand Park, Bhalswa Dairy, Jahangirpura, Delhi","11/7/2016 - 11/7/2016, Every day, AM Peak",259,150,446
"169","G-9, Block F 1U, Ranikhet, Pitampura, Delhi","219","461, Block AG, Sanjay Gandhi Transport Nagar, Delhi","11/7/2016 - 11/7/2016, Every day, AM Peak",182,73,451
"169","G-9, Block F 1U, Ranikhet, Pitampura, Delhi","221","Srinagar - Kanyakumari Highway, Bhalswa Jahangirpuri, Jahangirpuri, Delhi","11/7/2016 - 11/7/2016, Every day, AM Peak",257,117,563
"169","G-9, Block F 1U, Ranikhet, Pitampura, Delhi","222","Sector E, Mahipalpur Village, Vasant Kunj, New Delhi","11/7/2016 - 11/7/2016, Every day, AM Peak",4748,3899,5781
"169","G-9, Block F 1U, Ranikhet, Pitampura, Delhi","223","Urban Extension Road II, Indira Gandhi International Airport, New Delhi","11/7/2016 - 11/7/2016, Every day, AM Peak",4506,3484,5826
"169","G-9, Block F 1U, Ranikhet, Pitampura, Delhi","224","Main Road, Bharthal, Sector 27 Dwarka, Bharthal, New Delhi","11/7/2016 - 11/7/2016, Every day, AM Peak",2707,2174,3369
"169","G-9, Block F 1U, Ranikhet, Pitampura, Delhi","225","0 Netaji Road, A Block, Block C, Adarsh Nagar, Delhi","11/7/2016 - 11/7/2016, Every day, AM Peak",833,616,1126
"169","G-9, Block F 1U, Ranikhet, Pitampura, Delhi","226","Unnamed Road, Model Town, Delhi","11/7/2016 - 11/7/2016, Every day, AM Peak",686,417,1127
"169","G-9, Block F 1U, Ranikhet, Pitampura, Delhi","227","300 Lok Marg, Dhaka Colony, Mukherjee Nagar, Delhi","11/7/2016 - 11/7/2016, Every day, AM Peak",1517,1267,1815
"169","G-9, Block F 1U, Ranikhet, Pitampura, Delhi","228","0 Lucknow Road, Banarsi Das Estate, Timarpur, Delhi","11/7/2016 - 11/7/2016, Every day, AM Peak",961,688,1341
"169","G-9, Block F 1U, Ranikhet, Pitampura, Delhi","229","200 Road Number 28, Nehru Nagar, Shivaji Place, Basai Dara pur, Tagore Garden Extension, New Delhi","11/7/2016 - 11/7/2016, Every day, AM Peak",1163,810,1668
"169","G-9, Block F 1U, Ranikhet, Pitampura, Delhi","231","G-17/6, Block G, Rajouri Garden, New Delhi","11/7/2016 - 11/7/2016, Every day, AM Peak",1582,983,2545
"169","G-9, Block F 1U, Ranikhet, Pitampura, Delhi","232","4-3, Mayapuri Industrial Area Phase II, Mayapuri, New Delhi","11/7/2016 - 11/7/2016, Every day, AM Peak",1672,1323,2111
"169","G-9, Block F 1U, Ranikhet, Pitampura, Delhi","233","nullSatguru Ram Singh Marg, Block B, Mayapuri Industrial Area Phase I, Mayapuri, New Delhi","11/7/2016 - 11/7/2016, Every day, AM Peak",1855,1339,2569
"169","G-9, Block F 1U, Ranikhet, Pitampura, Delhi","234","113, Press Colony, Press Colony, Mayapuri, New Delhi","11/7/2016 - 11/7/2016, Every day, AM Peak",1838,1219,2771
"169","G-9, Block F 1U, Ranikhet, Pitampura, Delhi","240","37, Sector 15, Pocket 6, Sector 15B, Rohini, Delhi","11/7/2016 - 11/7/2016, Every day, AM Peak",170,33,862
"169","G-9, Block F 1U, Ranikhet, Pitampura, Delhi","241","Foot Road, Libas Pur Village, Siraspur, Delhi","11/7/2016 - 11/7/2016, Every day, AM Peak",420,325,541
"169","G-9, Block F 1U, Ranikhet, Pitampura, Delhi","244","Dhingra Park Trail, Punjabi Bagh Cooperative Housing Soceity, East Punjabi Bagh, Punjabi Bagh, Delhi","11/7/2016 - 11/7/2016, Every day, AM Peak",978,656,1457
"169","G-9, Block F 1U, Ranikhet, Pitampura, Delhi","246","nullShiv Mandir Marg, Block G, Lajpat Nagar I, Lajpat Nagar, New Delhi","11/7/2016 - 11/7/2016, Every day, AM Peak",3400,3090,3740
"169","G-9, Block F 1U, Ranikhet, Pitampura, Delhi","247","9/2082, Pocket 2, Block RZ, Palam Colony, New Delhi","11/7/2016 - 11/7/2016, Every day, AM Peak",2090,1704,2562
"169","G-9, Block F 1U, Ranikhet, Pitampura, Delhi","248","Unnamed Road, Harijan Basti, Rajokri, New Delhi","11/7/2016 - 11/7/2016, Every day, AM Peak",4855,3956,5956
"169","G-9, Block F 1U, Ranikhet, Pitampura, Delhi","251","A25, Block R, Pocket A, Rajender Nagar Part 1, New Rajinder Nagar, New Delhi","11/7/2016 - 11/7/2016, Every day, AM Peak",2006,1501,2679
"169","G-9, Block F 1U, Ranikhet, Pitampura, Delhi","252","813, Sector 1, RK Puram, New Delhi","11/7/2016 - 11/7/2016, Every day, AM Peak",2887,2308,3610
"169","G-9, Block F 1U, Ranikhet, Pitampura, Delhi","253","0 Chaudhary Harsukh Marg, B6, Block B6, Humayunpur, Safdarjung Enclave, New Delhi","11/7/2016 - 11/7/2016, Every day, AM Peak",2991,2424,3689
"169","G-9, Block F 1U, Ranikhet, Pitampura, Delhi","256","D-70, Mahavir Enclave I, Mahavir Enclave Part 2, Mahavir Enclave, New Delhi","11/7/2016 - 11/7/2016, Every day, AM Peak",1698,1289,2235
"169","G-9, Block F 1U, Ranikhet, Pitampura, Delhi","259","Jogging Lane, Pocket B-C, Sector-A, Vasant Kunj, New Delhi","11/7/2016 - 11/7/2016, Every day, AM Peak",3696,3113,4386
"169","G-9, Block F 1U, Ranikhet, Pitampura, Delhi","260","Unnamed Road, Sector A1, Narela, Delhi","11/7/2016 - 11/7/2016, Every day, AM Peak",1151,991,1336
"169","G-9, Block F 1U, Ranikhet, Pitampura, Delhi","261","Nangli Ibrahimpur Road, Kadipur, Kushak Colony, Kadipur Village, Delhi","11/7/2016 - 11/7/2016, Every day, AM Peak",400,263,607
"169","G-9, Block F 1U, Ranikhet, Pitampura, Delhi","263","200 Pirwali Gali, Block P, Block P, Patparganj, New Delhi","11/7/2016 - 11/7/2016, Every day, AM Peak",2967,2373,3709
"169","G-9, Block F 1U, Ranikhet, Pitampura, Delhi","264","Noida Link Road, Nehru Enclave, Shakarpur Khas, New Delhi","11/7/2016 - 11/7/2016, Every day, AM Peak",2812,2229,3547
"169","G-9, Block F 1U, Ranikhet, Pitampura, Delhi","265","0 Lane Number 8, Krishan Kunj Extension Part 2, Block G, Vishwakarma Park, Laxmi Nagar, Delhi","11/7/2016 - 11/7/2016, Every day, AM Peak",2594,2012,3344
"169","G-9, Block F 1U, Ranikhet, Pitampura, Delhi","267","nullPanduk Shila Marg, Kaithwara Jagjivan Nagar, New Usmanpur, Shahdara, Delhi","11/7/2016 - 11/7/2016, Every day, AM Peak",1912,1382,2644
"169","G-9, Block F 1U, Ranikhet, Pitampura, Delhi","275","125/16, Jogabai Extension, Zakir Nagar, Okhla, New Delhi","11/7/2016 - 11/7/2016, Every day, AM Peak",3680,2937,4609
"169","G-9, Block F 1U, Ranikhet, Pitampura, Delhi","277","700 Outer Ring Road, Bhalswa Jahangir Village, Jahangirpuri, नई दिल्ली","11/7/2016 - 11/7/2016, Every day, AM Peak",308,177,534
"169","G-9, Block F 1U, Ranikhet, Pitampura, Delhi","279","Nightingale Road, Budella, Vikaspuri, Delhi","11/7/2016 - 11/7/2016, Every day, AM Peak",928,697,1234
"169","G-9, Block F 1U, Ranikhet, Pitampura, Delhi","280","nullHastsal Road, Block A2, JJ Colony, Uttam Nagar, Delhi","11/7/2016 - 11/7/2016, Every day, AM Peak",1622,1271,2069
