"Origin Movement ID","Origin Display Name","Destination Movement ID","Destination Display Name","Date Range","Mean Travel Time (Seconds)","Range - Lower Bound Travel Time (Seconds)","Range - Upper Bound Travel Time (Seconds)"
"200","Dabri - Gurgaon Road, Pocket 2, Sector 1 Dwarka, Dwarka, New Delhi","2","Unnamed Road, Delhi Cantonment, New Delhi","11/6/2016 - 11/6/2016, Every day, AM Peak",1727,991,3007
"200","Dabri - Gurgaon Road, Pocket 2, Sector 1 Dwarka, Dwarka, New Delhi","3","Unnamed Road, Mahipalpur, New Delhi","11/6/2016 - 11/6/2016, Every day, AM Peak",934,698,1248
"200","Dabri - Gurgaon Road, Pocket 2, Sector 1 Dwarka, Dwarka, New Delhi","4","P-268/3, Rock View, Delhi Cantonment, Delhi","11/6/2016 - 11/6/2016, Every day, AM Peak",707,503,991
"200","Dabri - Gurgaon Road, Pocket 2, Sector 1 Dwarka, Dwarka, New Delhi","5","Old Palam Road, Delhi Cantonment, New Delhi","11/6/2016 - 11/6/2016, Every day, AM Peak",566,356,898
"200","Dabri - Gurgaon Road, Pocket 2, Sector 1 Dwarka, Dwarka, New Delhi","6","Unnamed Road, CVD Line, Delhi Cantonment, New Delhi","11/6/2016 - 11/6/2016, Every day, AM Peak",764,569,1024
"200","Dabri - Gurgaon Road, Pocket 2, Sector 1 Dwarka, Dwarka, New Delhi","7","P 13, Baird Place, Delhi Cantonment, New Delhi","11/6/2016 - 11/6/2016, Every day, AM Peak",814,140,4723
"200","Dabri - Gurgaon Road, Pocket 2, Sector 1 Dwarka, Dwarka, New Delhi","8","Mall Road, Khyber Lines, Delhi Cantonment, New Delhi","11/6/2016 - 11/6/2016, Every day, AM Peak",1169,771,1771
"200","Dabri - Gurgaon Road, Pocket 2, Sector 1 Dwarka, Dwarka, New Delhi","9","Mahatma Jyothi Rao Phule Marg, Mahatma Jyoti Rao Phule Marg Area, New Delhi","11/6/2016 - 11/6/2016, Every day, AM Peak",1851,1625,2107
"200","Dabri - Gurgaon Road, Pocket 2, Sector 1 Dwarka, Dwarka, New Delhi","10","0 Shaheed Bhagat Singh Marg, DIZ Staff Quarters, Connaught Place, New Delhi","11/6/2016 - 11/6/2016, Every day, AM Peak",1934,1632,2291
"200","Dabri - Gurgaon Road, Pocket 2, Sector 1 Dwarka, Dwarka, New Delhi","11","Mother Teresa Crescent, Talkatora Garden, Central Ridge Reserve Forest, New Delhi","11/6/2016 - 11/6/2016, Every day, AM Peak",1364,1092,1702
"200","Dabri - Gurgaon Road, Pocket 2, Sector 1 Dwarka, Dwarka, New Delhi","12","Jantar Mantar Road, Janpath, Connaught Place, New Delhi","11/6/2016 - 11/6/2016, Every day, AM Peak",1727,1511,1973
"200","Dabri - Gurgaon Road, Pocket 2, Sector 1 Dwarka, Dwarka, New Delhi","13","10, Aurangzeb Road, New Delhi","11/6/2016 - 11/6/2016, Every day, AM Peak",1611,1338,1939
"200","Dabri - Gurgaon Road, Pocket 2, Sector 1 Dwarka, Dwarka, New Delhi","14","Mahatma Gandhi Road, Kidwai Nagar West, Kidwai Nagar, New Delhi","11/6/2016 - 11/6/2016, Every day, AM Peak",1567,1229,1996
"200","Dabri - Gurgaon Road, Pocket 2, Sector 1 Dwarka, Dwarka, New Delhi","16","Andre Malraux Marg, Ramnagar, Chanakyapuri, New Delhi","11/6/2016 - 11/6/2016, Every day, AM Peak",1336,1057,1688
"200","Dabri - Gurgaon Road, Pocket 2, Sector 1 Dwarka, Dwarka, New Delhi","19","Mirdard Road, 64 Khamba, Maulana Azad Medical College Campus, New Delhi","11/6/2016 - 11/6/2016, Every day, AM Peak",1967,1784,2168
"200","Dabri - Gurgaon Road, Pocket 2, Sector 1 Dwarka, Dwarka, New Delhi","24","268, Block B2, Shiv Nagar, Janakpuri, New Delhi","11/6/2016 - 11/6/2016, Every day, AM Peak",754,491,1157
"200","Dabri - Gurgaon Road, Pocket 2, Sector 1 Dwarka, Dwarka, New Delhi","26","A3-214, Asalatpur Village, Janakpuri, Delhi","11/6/2016 - 11/6/2016, Every day, AM Peak",627,376,1044
"200","Dabri - Gurgaon Road, Pocket 2, Sector 1 Dwarka, Dwarka, New Delhi","27","0 Ram Mandir Marg, C5B Block, Janakpuri, New Delhi","11/6/2016 - 11/6/2016, Every day, AM Peak",523,340,804
"200","Dabri - Gurgaon Road, Pocket 2, Sector 1 Dwarka, Dwarka, New Delhi","28","nullSchool Road, Block M, Uttam Nagar, Delhi","11/6/2016 - 11/6/2016, Every day, AM Peak",830,519,1326
"200","Dabri - Gurgaon Road, Pocket 2, Sector 1 Dwarka, Dwarka, New Delhi","29","Street Number 14, Block C, Sitapuri Part 1, Janakpuri, New Delhi","11/6/2016 - 11/6/2016, Every day, AM Peak",342,195,596
"200","Dabri - Gurgaon Road, Pocket 2, Sector 1 Dwarka, Dwarka, New Delhi","31","Main Jhatikra Road, Paprawat, Delhi","11/6/2016 - 11/6/2016, Every day, AM Peak",881,632,1227
"200","Dabri - Gurgaon Road, Pocket 2, Sector 1 Dwarka, Dwarka, New Delhi","32","METRO MALL, Pocket 1, Sector 14 Dwarka, Dwarka, New Delhi","11/6/2016 - 11/6/2016, Every day, AM Peak",626,468,835
"200","Dabri - Gurgaon Road, Pocket 2, Sector 1 Dwarka, Dwarka, New Delhi","61","Unnamed Road, National Zoological Park, Sundar Nagar, New Delhi","11/6/2016 - 11/6/2016, Every day, AM Peak",2143,1832,2506
"200","Dabri - Gurgaon Road, Pocket 2, Sector 1 Dwarka, Dwarka, New Delhi","62","D/116, Jeewan Nagar, Sunlight Colony, New Delhi","11/6/2016 - 11/6/2016, Every day, AM Peak",1959,1706,2248
"200","Dabri - Gurgaon Road, Pocket 2, Sector 1 Dwarka, Dwarka, New Delhi","63","Jawaharlal Nehru Stadium Marg, CGO Complex, Pragati Vihar, New Delhi","11/6/2016 - 11/6/2016, Every day, AM Peak",2075,1674,2570
"200","Dabri - Gurgaon Road, Pocket 2, Sector 1 Dwarka, Dwarka, New Delhi","64","6/37, Vikram Vihar, Lajpat Nagar IV, Lajpat Nagar, New Delhi","11/6/2016 - 11/6/2016, Every day, AM Peak",1809,1530,2138
"200","Dabri - Gurgaon Road, Pocket 2, Sector 1 Dwarka, Dwarka, New Delhi","65","Shaheed Jeet Singh Marg, NCERT Campus, Qutab Institutional Area, New Delhi","11/6/2016 - 11/6/2016, Every day, AM Peak",1360,1085,1704
"200","Dabri - Gurgaon Road, Pocket 2, Sector 1 Dwarka, Dwarka, New Delhi","67","63/33, Hudco Place, Andrews Ganj Extension, Andrews Ganj, New Delhi","11/6/2016 - 11/6/2016, Every day, AM Peak",1751,1438,2131
"200","Dabri - Gurgaon Road, Pocket 2, Sector 1 Dwarka, Dwarka, New Delhi","68","0 Paschimi Marg, Block E, Vasant Vihar, New Delhi","11/6/2016 - 11/6/2016, Every day, AM Peak",1135,862,1494
"200","Dabri - Gurgaon Road, Pocket 2, Sector 1 Dwarka, Dwarka, New Delhi","69","1129, Sector 2 R K Puram, Sector 2, RK Puram, New Delhi","11/6/2016 - 11/6/2016, Every day, AM Peak",1270,982,1641
"200","Dabri - Gurgaon Road, Pocket 2, Sector 1 Dwarka, Dwarka, New Delhi","70","G288, Sector 3, Block G, Nanak Pura, South Moti Bagh, New Delhi","11/6/2016 - 11/6/2016, Every day, AM Peak",1074,819,1407
"200","Dabri - Gurgaon Road, Pocket 2, Sector 1 Dwarka, Dwarka, New Delhi","71","JNU Ring Road, Jawaharlal Nehru University, New Delhi","11/6/2016 - 11/6/2016, Every day, AM Peak",1323,1023,1709
"200","Dabri - Gurgaon Road, Pocket 2, Sector 1 Dwarka, Dwarka, New Delhi","80","E-492, Block E, Greater Kailash II, Greater Kailash, New Delhi","11/6/2016 - 11/6/2016, Every day, AM Peak",1739,1496,2021
"200","Dabri - Gurgaon Road, Pocket 2, Sector 1 Dwarka, Dwarka, New Delhi","81","126, Block L 1, Alaknanda, New Delhi","11/6/2016 - 11/6/2016, Every day, AM Peak",2141,1623,2823
"200","Dabri - Gurgaon Road, Pocket 2, Sector 1 Dwarka, Dwarka, New Delhi","82","286, Asian Games Village Complex, Siri Fort, New Delhi","11/6/2016 - 11/6/2016, Every day, AM Peak",1623,1312,2007
"200","Dabri - Gurgaon Road, Pocket 2, Sector 1 Dwarka, Dwarka, New Delhi","83","C2, Block C, Kailash Colony, Greater Kailash, New Delhi","11/6/2016 - 11/6/2016, Every day, AM Peak",1911,1531,2384
"200","Dabri - Gurgaon Road, Pocket 2, Sector 1 Dwarka, Dwarka, New Delhi","84","nullMathura Road, Friends Colony West, Block A, New Friends Colony, New Delhi","11/6/2016 - 11/6/2016, Every day, AM Peak",1965,1667,2315
"200","Dabri - Gurgaon Road, Pocket 2, Sector 1 Dwarka, Dwarka, New Delhi","85","Outer Ring Road, Block 13, Nehru Enclave East, Okhla Industrial Area, New Delhi","11/6/2016 - 11/6/2016, Every day, AM Peak",2008,1591,2533
"200","Dabri - Gurgaon Road, Pocket 2, Sector 1 Dwarka, Dwarka, New Delhi","90","C-86, Pocket C, Okhla Phase I, Okhla Industrial Area, New Delhi","11/6/2016 - 11/6/2016, Every day, AM Peak",2898,2289,3668
"200","Dabri - Gurgaon Road, Pocket 2, Sector 1 Dwarka, Dwarka, New Delhi","91","nullTum Road, Sanjay Colony II, Sanjay Colony, Okhla Phase II, Okhla Industrial Area, New Delhi","11/6/2016 - 11/6/2016, Every day, AM Peak",2386,1823,3122
"200","Dabri - Gurgaon Road, Pocket 2, Sector 1 Dwarka, Dwarka, New Delhi","103","nullDasghara Road, Dasghara, New Delhi","11/6/2016 - 11/6/2016, Every day, AM Peak",1512,1200,1904
"200","Dabri - Gurgaon Road, Pocket 2, Sector 1 Dwarka, Dwarka, New Delhi","105","nullGoswami Girdhari Lal Marg, Industrial Area Phase I, Block C, Naraina Industrial Area Phase 1, Naraina, New Delhi","11/6/2016 - 11/6/2016, Every day, AM Peak",2534,1570,4089
"200","Dabri - Gurgaon Road, Pocket 2, Sector 1 Dwarka, Dwarka, New Delhi","121","22/55, West Punjabi Bagh, Punjabi Bagh, Delhi","11/6/2016 - 11/6/2016, Every day, AM Peak",2040,1102,3776
"200","Dabri - Gurgaon Road, Pocket 2, Sector 1 Dwarka, Dwarka, New Delhi","124","30, 31, Block B, Mansarover Garden, New Delhi","11/6/2016 - 11/6/2016, Every day, AM Peak",1851,1037,3302
"200","Dabri - Gurgaon Road, Pocket 2, Sector 1 Dwarka, Dwarka, New Delhi","135","0 Uggarsen Market Road, Meenakshi Garden, Ashok Nagar, Delhi","11/6/2016 - 11/6/2016, Every day, AM Peak",1235,904,1687
"200","Dabri - Gurgaon Road, Pocket 2, Sector 1 Dwarka, Dwarka, New Delhi","136","nullKeshopur Road, New Chaukhandi, Paschim Vihar, Delhi","11/6/2016 - 11/6/2016, Every day, AM Peak",877,784,980
"200","Dabri - Gurgaon Road, Pocket 2, Sector 1 Dwarka, Dwarka, New Delhi","137","nullRoad Number 235, Block H, Vikaspuri, Delhi","11/6/2016 - 11/6/2016, Every day, AM Peak",901,710,1141
"200","Dabri - Gurgaon Road, Pocket 2, Sector 1 Dwarka, Dwarka, New Delhi","139","nullBudh Bazar Road, Nawada, Nawada Majra Village, Nawada, Delhi","11/6/2016 - 11/6/2016, Every day, AM Peak",924,701,1217
"200","Dabri - Gurgaon Road, Pocket 2, Sector 1 Dwarka, Dwarka, New Delhi","140","A12/B, Sainik Nagar, Mansa Ram Park, Uttam Nagar, Delhi","11/6/2016 - 11/6/2016, Every day, AM Peak",928,665,1294
"200","Dabri - Gurgaon Road, Pocket 2, Sector 1 Dwarka, Dwarka, New Delhi","141","nullBindapur Matiala Road, Nand Ram Park, Bhagat Enclave, Bindapur, Delhi","11/6/2016 - 11/6/2016, Every day, AM Peak",798,392,1623
"200","Dabri - Gurgaon Road, Pocket 2, Sector 1 Dwarka, Dwarka, New Delhi","142","Gali Number 1, Dabri Village, Dabri, New Delhi","11/6/2016 - 11/6/2016, Every day, AM Peak",369,207,657
"200","Dabri - Gurgaon Road, Pocket 2, Sector 1 Dwarka, Dwarka, New Delhi","143","nullRoad Number 221, Pocket 1, Sector 10 Dwarka, Dwarka, Delhi","11/6/2016 - 11/6/2016, Every day, AM Peak",339,160,714
"200","Dabri - Gurgaon Road, Pocket 2, Sector 1 Dwarka, Dwarka, New Delhi","144","Najafgarh Road, Indra Park, Block A, Masudabad, Najafgarh, Delhi","11/6/2016 - 11/6/2016, Every day, AM Peak",1215,957,1542
"200","Dabri - Gurgaon Road, Pocket 2, Sector 1 Dwarka, Dwarka, New Delhi","148","Unnamed Road, Patparganj, New Delhi","11/6/2016 - 11/6/2016, Every day, AM Peak",2419,2043,2863
"200","Dabri - Gurgaon Road, Pocket 2, Sector 1 Dwarka, Dwarka, New Delhi","154","nullGali Number 6, Block B, Block D, Vinod Nagar North, Delhi","11/6/2016 - 11/6/2016, Every day, AM Peak",2559,2321,2820
"200","Dabri - Gurgaon Road, Pocket 2, Sector 1 Dwarka, Dwarka, New Delhi","160","23, Shiva Enclave, Pitampura, Delhi","11/6/2016 - 11/6/2016, Every day, AM Peak",1782,1276,2488
"200","Dabri - Gurgaon Road, Pocket 2, Sector 1 Dwarka, Dwarka, New Delhi","161","nullLawrence Road, Rampura Industrial Area, Tri Nagar, Delhi","11/6/2016 - 11/6/2016, Every day, AM Peak",2087,989,4403
"200","Dabri - Gurgaon Road, Pocket 2, Sector 1 Dwarka, Dwarka, New Delhi","163","0 Guru Harkishan Marg, Maulana Azad Society, Bhagwan Buddha Housing Corporation Society, Pitampura, Delhi","11/6/2016 - 11/6/2016, Every day, AM Peak",1816,1150,2865
"200","Dabri - Gurgaon Road, Pocket 2, Sector 1 Dwarka, Dwarka, New Delhi","164","Shakurbasti Pedestrian Foot Over Bridge, Shakur Basti Railway Colony, Railway Colony South, Pitampura, Delhi","11/6/2016 - 11/6/2016, Every day, AM Peak",2220,1435,3433
"200","Dabri - Gurgaon Road, Pocket 2, Sector 1 Dwarka, Dwarka, New Delhi","165","31, Cottage Enclave, Paschim Vihar, Delhi","11/6/2016 - 11/6/2016, Every day, AM Peak",1629,1074,2469
"200","Dabri - Gurgaon Road, Pocket 2, Sector 1 Dwarka, Dwarka, New Delhi","166","nullRBI Enclave Road, Ankur Enclave, Paschim Vihar, Delhi","11/6/2016 - 11/6/2016, Every day, AM Peak",1369,858,2182
"200","Dabri - Gurgaon Road, Pocket 2, Sector 1 Dwarka, Dwarka, New Delhi","170","nullColony Road, Block QP, Poorvi Pitampura, Pitampura, Delhi","11/6/2016 - 11/6/2016, Every day, AM Peak",1741,785,3856
"200","Dabri - Gurgaon Road, Pocket 2, Sector 1 Dwarka, Dwarka, New Delhi","172","nullShiva Road, Pocket 14, Sector 8D, Rohini, Delhi","11/6/2016 - 11/6/2016, Every day, AM Peak",1794,1310,2455
"200","Dabri - Gurgaon Road, Pocket 2, Sector 1 Dwarka, Dwarka, New Delhi","175","235, Block E, Block E, Mangolpuri, Delhi","11/6/2016 - 11/6/2016, Every day, AM Peak",1630,1047,2537
"200","Dabri - Gurgaon Road, Pocket 2, Sector 1 Dwarka, Dwarka, New Delhi","176","B7-187, Pocket 7, Sector 3B, Rohini, Delhi","11/6/2016 - 11/6/2016, Every day, AM Peak",1836,1195,2820
"200","Dabri - Gurgaon Road, Pocket 2, Sector 1 Dwarka, Dwarka, New Delhi","179","0 AB Road, Block RR, Mianwali Nagar, Paschim Vihar, Delhi","11/6/2016 - 11/6/2016, Every day, AM Peak",1437,942,2191
"200","Dabri - Gurgaon Road, Pocket 2, Sector 1 Dwarka, Dwarka, New Delhi","180","GH-14/234, GH 14, Block GH 14, Paschim Vihar, Delhi","11/6/2016 - 11/6/2016, Every day, AM Peak",1123,841,1498
"200","Dabri - Gurgaon Road, Pocket 2, Sector 1 Dwarka, Dwarka, New Delhi","191","0 Hasanpur, I.P.Extension, Patparganj, Delhi","11/6/2016 - 11/6/2016, Every day, AM Peak",2729,2472,3012
"200","Dabri - Gurgaon Road, Pocket 2, Sector 1 Dwarka, Dwarka, New Delhi","193","Unnamed Road, Usmanpur, Shahdara, Delhi","11/6/2016 - 11/6/2016, Every day, AM Peak",2285,1963,2659
"200","Dabri - Gurgaon Road, Pocket 2, Sector 1 Dwarka, Dwarka, New Delhi","222","Sector E, Mahipalpur Village, Vasant Kunj, New Delhi","11/6/2016 - 11/6/2016, Every day, AM Peak",1190,829,1707
"200","Dabri - Gurgaon Road, Pocket 2, Sector 1 Dwarka, Dwarka, New Delhi","223","Urban Extension Road II, Indira Gandhi International Airport, New Delhi","11/6/2016 - 11/6/2016, Every day, AM Peak",1181,812,1716
"200","Dabri - Gurgaon Road, Pocket 2, Sector 1 Dwarka, Dwarka, New Delhi","224","Main Road, Bharthal, Sector 27 Dwarka, Bharthal, New Delhi","11/6/2016 - 11/6/2016, Every day, AM Peak",555,301,1020
"200","Dabri - Gurgaon Road, Pocket 2, Sector 1 Dwarka, Dwarka, New Delhi","229","200 Road Number 28, Nehru Nagar, Shivaji Place, Basai Dara pur, Tagore Garden Extension, New Delhi","11/6/2016 - 11/6/2016, Every day, AM Peak",1988,1135,3480
"200","Dabri - Gurgaon Road, Pocket 2, Sector 1 Dwarka, Dwarka, New Delhi","231","G-17/6, Block G, Rajouri Garden, New Delhi","11/6/2016 - 11/6/2016, Every day, AM Peak",1949,1119,3392
"200","Dabri - Gurgaon Road, Pocket 2, Sector 1 Dwarka, Dwarka, New Delhi","232","4-3, Mayapuri Industrial Area Phase II, Mayapuri, New Delhi","11/6/2016 - 11/6/2016, Every day, AM Peak",701,467,1050
"200","Dabri - Gurgaon Road, Pocket 2, Sector 1 Dwarka, Dwarka, New Delhi","233","nullSatguru Ram Singh Marg, Block B, Mayapuri Industrial Area Phase I, Mayapuri, New Delhi","11/6/2016 - 11/6/2016, Every day, AM Peak",1589,844,2989
"200","Dabri - Gurgaon Road, Pocket 2, Sector 1 Dwarka, Dwarka, New Delhi","234","113, Press Colony, Press Colony, Mayapuri, New Delhi","11/6/2016 - 11/6/2016, Every day, AM Peak",1461,832,2564
"200","Dabri - Gurgaon Road, Pocket 2, Sector 1 Dwarka, Dwarka, New Delhi","235","nullBharat Vihar Road, Block G, Raja Puri, Matiala, Delhi","11/6/2016 - 11/6/2016, Every day, AM Peak",306,206,452
"200","Dabri - Gurgaon Road, Pocket 2, Sector 1 Dwarka, Dwarka, New Delhi","244","Dhingra Park Trail, Punjabi Bagh Cooperative Housing Soceity, East Punjabi Bagh, Punjabi Bagh, Delhi","11/6/2016 - 11/6/2016, Every day, AM Peak",1909,1012,3599
"200","Dabri - Gurgaon Road, Pocket 2, Sector 1 Dwarka, Dwarka, New Delhi","246","nullShiv Mandir Marg, Block G, Lajpat Nagar I, Lajpat Nagar, New Delhi","11/6/2016 - 11/6/2016, Every day, AM Peak",1903,1640,2207
"200","Dabri - Gurgaon Road, Pocket 2, Sector 1 Dwarka, Dwarka, New Delhi","247","9/2082, Pocket 2, Block RZ, Palam Colony, New Delhi","11/6/2016 - 11/6/2016, Every day, AM Peak",277,135,567
"200","Dabri - Gurgaon Road, Pocket 2, Sector 1 Dwarka, Dwarka, New Delhi","248","Unnamed Road, Harijan Basti, Rajokri, New Delhi","11/6/2016 - 11/6/2016, Every day, AM Peak",1471,1043,2073
"200","Dabri - Gurgaon Road, Pocket 2, Sector 1 Dwarka, Dwarka, New Delhi","251","A25, Block R, Pocket A, Rajender Nagar Part 1, New Rajinder Nagar, New Delhi","11/6/2016 - 11/6/2016, Every day, AM Peak",1724,1424,2086
"200","Dabri - Gurgaon Road, Pocket 2, Sector 1 Dwarka, Dwarka, New Delhi","252","813, Sector 1, RK Puram, New Delhi","11/6/2016 - 11/6/2016, Every day, AM Peak",1246,949,1635
"200","Dabri - Gurgaon Road, Pocket 2, Sector 1 Dwarka, Dwarka, New Delhi","253","0 Chaudhary Harsukh Marg, B6, Block B6, Humayunpur, Safdarjung Enclave, New Delhi","11/6/2016 - 11/6/2016, Every day, AM Peak",1369,1078,1738
"200","Dabri - Gurgaon Road, Pocket 2, Sector 1 Dwarka, Dwarka, New Delhi","254","Squadron Leader Mohinder Kumar Jain Marg, Block B, New Delhi","11/6/2016 - 11/6/2016, Every day, AM Peak",1409,1122,1768
"200","Dabri - Gurgaon Road, Pocket 2, Sector 1 Dwarka, Dwarka, New Delhi","255","1700 Uday Chand Marg, Arya Basti, Zafar Nagar, Kotla Mubarakpur, South Extension I, New Delhi","11/6/2016 - 11/6/2016, Every day, AM Peak",1681,1378,2049
"200","Dabri - Gurgaon Road, Pocket 2, Sector 1 Dwarka, Dwarka, New Delhi","256","D-70, Mahavir Enclave I, Mahavir Enclave Part 2, Mahavir Enclave, New Delhi","11/6/2016 - 11/6/2016, Every day, AM Peak",217,85,548
"200","Dabri - Gurgaon Road, Pocket 2, Sector 1 Dwarka, Dwarka, New Delhi","259","Jogging Lane, Pocket B-C, Sector-A, Vasant Kunj, New Delhi","11/6/2016 - 11/6/2016, Every day, AM Peak",1922,1481,2493
"200","Dabri - Gurgaon Road, Pocket 2, Sector 1 Dwarka, Dwarka, New Delhi","263","200 Pirwali Gali, Block P, Block P, Patparganj, New Delhi","11/6/2016 - 11/6/2016, Every day, AM Peak",2643,2247,3108
"200","Dabri - Gurgaon Road, Pocket 2, Sector 1 Dwarka, Dwarka, New Delhi","264","Noida Link Road, Nehru Enclave, Shakarpur Khas, New Delhi","11/6/2016 - 11/6/2016, Every day, AM Peak",2711,2358,3115
"200","Dabri - Gurgaon Road, Pocket 2, Sector 1 Dwarka, Dwarka, New Delhi","275","125/16, Jogabai Extension, Zakir Nagar, Okhla, New Delhi","11/6/2016 - 11/6/2016, Every day, AM Peak",2150,1789,2582
"200","Dabri - Gurgaon Road, Pocket 2, Sector 1 Dwarka, Dwarka, New Delhi","279","Nightingale Road, Budella, Vikaspuri, Delhi","11/6/2016 - 11/6/2016, Every day, AM Peak",930,662,1305
"200","Dabri - Gurgaon Road, Pocket 2, Sector 1 Dwarka, Dwarka, New Delhi","280","nullHastsal Road, Block A2, JJ Colony, Uttam Nagar, Delhi","11/6/2016 - 11/6/2016, Every day, AM Peak",970,666,1411
"200","Dabri - Gurgaon Road, Pocket 2, Sector 1 Dwarka, Dwarka, New Delhi","281","D915, New Mahavir Nagar, Tilak Nagar, Delhi","11/6/2016 - 11/6/2016, Every day, AM Peak",894,629,1269
"200","Dabri - Gurgaon Road, Pocket 2, Sector 1 Dwarka, Dwarka, New Delhi","282","Velodrome Road, Gandhi Smriti, Raj Ghat, New Delhi","11/6/2016 - 11/6/2016, Every day, AM Peak",2044,1931,2163