"Origin Movement ID","Origin Display Name","Destination Movement ID","Destination Display Name","Date Range","Mean Travel Time (Seconds)","Range - Lower Bound Travel Time (Seconds)","Range - Upper Bound Travel Time (Seconds)"
"38","526, Sakdarpur, Shahdara, Delhi","34","5/3, East Nathu Colony, GTB Enclave, Dilshad Garden, Delhi","11/5/2016 - 11/5/2016, Every day, AM Peak",605,358,1019
"38","526, Sakdarpur, Shahdara, Delhi","36","A3-83, Block A, Nand Nagri, Village Mandoli, Delhi","11/5/2016 - 11/5/2016, Every day, AM Peak",149,65,341
"38","526, Sakdarpur, Shahdara, Delhi","40","Gali Saini Tent, Ram Nagar, Shahdara, Delhi","11/5/2016 - 11/5/2016, Every day, AM Peak",671,315,1426
"38","526, Sakdarpur, Shahdara, Delhi","48","Kardam Marg, Block B, Kabir Nagar, Shahdara, Delhi","11/5/2016 - 11/5/2016, Every day, AM Peak",174,114,264
"38","526, Sakdarpur, Shahdara, Delhi","50","Saraswati Marg, Babarpur Village, Babarpur, Delhi","11/5/2016 - 11/5/2016, Every day, AM Peak",371,195,702
"38","526, Sakdarpur, Shahdara, Delhi","61","Unnamed Road, National Zoological Park, Sundar Nagar, New Delhi","11/5/2016 - 11/5/2016, Every day, AM Peak",2599,2041,3308
"38","526, Sakdarpur, Shahdara, Delhi","116","9/5284, Shanti Mohalla, Seelampur, Shahdara, Delhi","11/5/2016 - 11/5/2016, Every day, AM Peak",1273,770,2102
"38","526, Sakdarpur, Shahdara, Delhi","118","0 Circular Road, Jawala Nagar, Shahdara, Delhi","11/5/2016 - 11/5/2016, Every day, AM Peak",1069,737,1550
"38","526, Sakdarpur, Shahdara, Delhi","119","81, Zulfe Bengal, Dilshad Garden, Delhi","11/5/2016 - 11/5/2016, Every day, AM Peak",997,625,1587
"38","526, Sakdarpur, Shahdara, Delhi","190","F-33, Block F, Preet Vihar, Delhi","11/5/2016 - 11/5/2016, Every day, AM Peak",2027,1413,2906
"38","526, Sakdarpur, Shahdara, Delhi","191","0 Hasanpur, I.P.Extension, Patparganj, Delhi","11/5/2016 - 11/5/2016, Every day, AM Peak",1835,1314,2561
"38","526, Sakdarpur, Shahdara, Delhi","192","0 Bhartendu Harish Chandra Marg, Ram Vihar, Anand Vihar, Delhi","11/5/2016 - 11/5/2016, Every day, AM Peak",1509,1017,2238
"38","526, Sakdarpur, Shahdara, Delhi","193","Unnamed Road, Usmanpur, Shahdara, Delhi","11/5/2016 - 11/5/2016, Every day, AM Peak",2431,1718,3439