"Origin Movement ID","Origin Display Name","Destination Movement ID","Destination Display Name","Date Range","Mean Travel Time (Seconds)","Range - Lower Bound Travel Time (Seconds)","Range - Upper Bound Travel Time (Seconds)"
"38","526, Sakdarpur, Shahdara, Delhi","9","Mahatma Jyothi Rao Phule Marg, Mahatma Jyoti Rao Phule Marg Area, New Delhi","11/8/2016 - 11/8/2016, Every day, AM Peak",2775,1913,4024
"38","526, Sakdarpur, Shahdara, Delhi","13","10, Aurangzeb Road, New Delhi","11/8/2016 - 11/8/2016, Every day, AM Peak",3025,2242,4080
"38","526, Sakdarpur, Shahdara, Delhi","34","5/3, East Nathu Colony, GTB Enclave, Dilshad Garden, Delhi","11/8/2016 - 11/8/2016, Every day, AM Peak",469,352,624
"38","526, Sakdarpur, Shahdara, Delhi","39","nullGali Number 16, West Jyoti Nagar, Ashok Nagar Mandoli, Ashok Nagar, Shahdara, Delhi","11/8/2016 - 11/8/2016, Every day, AM Peak",101,31,324
"38","526, Sakdarpur, Shahdara, Delhi","40","Gali Saini Tent, Ram Nagar, Shahdara, Delhi","11/8/2016 - 11/8/2016, Every day, AM Peak",427,271,670
"38","526, Sakdarpur, Shahdara, Delhi","41","Lala Raghubar Dayal Marg, Phase 4, Block B, Subhash Park, Shahdara, Delhi","11/8/2016 - 11/8/2016, Every day, AM Peak",761,600,963
"38","526, Sakdarpur, Shahdara, Delhi","42","Street Number 30/6, New Seelampur, Chauhan Banger, Shahdara, Delhi","11/8/2016 - 11/8/2016, Every day, AM Peak",1000,624,1600
"38","526, Sakdarpur, Shahdara, Delhi","43","A537, New Seelampur Phase II, New Seelampur, Shahdara, Delhi","11/8/2016 - 11/8/2016, Every day, AM Peak",1200,767,1875
"38","526, Sakdarpur, Shahdara, Delhi","44","100 Maujpur Main Road, Maujpur, Shahdara, Delhi","11/8/2016 - 11/8/2016, Every day, AM Peak",760,438,1318
"38","526, Sakdarpur, Shahdara, Delhi","48","Kardam Marg, Block B, Kabir Nagar, Shahdara, Delhi","11/8/2016 - 11/8/2016, Every day, AM Peak",176,89,345
"38","526, Sakdarpur, Shahdara, Delhi","50","Saraswati Marg, Babarpur Village, Babarpur, Delhi","11/8/2016 - 11/8/2016, Every day, AM Peak",276,113,672
"38","526, Sakdarpur, Shahdara, Delhi","61","Unnamed Road, National Zoological Park, Sundar Nagar, New Delhi","11/8/2016 - 11/8/2016, Every day, AM Peak",2857,1966,4150
"38","526, Sakdarpur, Shahdara, Delhi","114","9/434, Gandhi Nagar, Seelampur, Shahdara, Delhi","11/8/2016 - 11/8/2016, Every day, AM Peak",1650,1088,2502
"38","526, Sakdarpur, Shahdara, Delhi","116","9/5284, Shanti Mohalla, Seelampur, Shahdara, Delhi","11/8/2016 - 11/8/2016, Every day, AM Peak",1187,814,1729
"38","526, Sakdarpur, Shahdara, Delhi","119","81, Zulfe Bengal, Dilshad Garden, Delhi","11/8/2016 - 11/8/2016, Every day, AM Peak",1579,695,3582
"38","526, Sakdarpur, Shahdara, Delhi","132","1600 Lothian Road, Chabi Ganj, Kashmere Gate, New Delhi","11/8/2016 - 11/8/2016, Every day, AM Peak",2000,1303,3069
"38","526, Sakdarpur, Shahdara, Delhi","192","0 Bhartendu Harish Chandra Marg, Ram Vihar, Anand Vihar, Delhi","11/8/2016 - 11/8/2016, Every day, AM Peak",1934,938,3985
"38","526, Sakdarpur, Shahdara, Delhi","193","Unnamed Road, Usmanpur, Shahdara, Delhi","11/8/2016 - 11/8/2016, Every day, AM Peak",2007,1299,3100
"38","526, Sakdarpur, Shahdara, Delhi","266","Yamuna Marginal Bandh Marg, Block A, Shastri Park, Jagjit Nagar, New Delhi","11/8/2016 - 11/8/2016, Every day, AM Peak",1493,1012,2202
"38","526, Sakdarpur, Shahdara, Delhi","282","Velodrome Road, Gandhi Smriti, Raj Ghat, New Delhi","11/8/2016 - 11/8/2016, Every day, AM Peak",2297,1617,3262