"Origin Movement ID","Origin Display Name","Destination Movement ID","Destination Display Name","Date Range","Mean Travel Time (Seconds)","Range - Lower Bound Travel Time (Seconds)","Range - Upper Bound Travel Time (Seconds)"
"72","7/254, Dakshinpuri Extension, Block 7, Sector 6, Dakshinpuri, New Delhi","3","Unnamed Road, Mahipalpur, New Delhi","11/5/2016 - 11/5/2016, Every day, AM Peak",1803,1248,2603
"72","7/254, Dakshinpuri Extension, Block 7, Sector 6, Dakshinpuri, New Delhi","5","Old Palam Road, Delhi Cantonment, New Delhi","11/5/2016 - 11/5/2016, Every day, AM Peak",1939,1401,2682
"72","7/254, Dakshinpuri Extension, Block 7, Sector 6, Dakshinpuri, New Delhi","9","Mahatma Jyothi Rao Phule Marg, Mahatma Jyoti Rao Phule Marg Area, New Delhi","11/5/2016 - 11/5/2016, Every day, AM Peak",1257,1006,1569
"72","7/254, Dakshinpuri Extension, Block 7, Sector 6, Dakshinpuri, New Delhi","12","Jantar Mantar Road, Janpath, Connaught Place, New Delhi","11/5/2016 - 11/5/2016, Every day, AM Peak",1408,1238,1600
"72","7/254, Dakshinpuri Extension, Block 7, Sector 6, Dakshinpuri, New Delhi","13","10, Aurangzeb Road, New Delhi","11/5/2016 - 11/5/2016, Every day, AM Peak",980,785,1222
"72","7/254, Dakshinpuri Extension, Block 7, Sector 6, Dakshinpuri, New Delhi","14","Mahatma Gandhi Road, Kidwai Nagar West, Kidwai Nagar, New Delhi","11/5/2016 - 11/5/2016, Every day, AM Peak",1080,815,1429
"72","7/254, Dakshinpuri Extension, Block 7, Sector 6, Dakshinpuri, New Delhi","61","Unnamed Road, National Zoological Park, Sundar Nagar, New Delhi","11/5/2016 - 11/5/2016, Every day, AM Peak",1194,909,1566
"72","7/254, Dakshinpuri Extension, Block 7, Sector 6, Dakshinpuri, New Delhi","62","D/116, Jeewan Nagar, Sunlight Colony, New Delhi","11/5/2016 - 11/5/2016, Every day, AM Peak",1080,854,1364
"72","7/254, Dakshinpuri Extension, Block 7, Sector 6, Dakshinpuri, New Delhi","63","Jawaharlal Nehru Stadium Marg, CGO Complex, Pragati Vihar, New Delhi","11/5/2016 - 11/5/2016, Every day, AM Peak",898,707,1139
"72","7/254, Dakshinpuri Extension, Block 7, Sector 6, Dakshinpuri, New Delhi","64","6/37, Vikram Vihar, Lajpat Nagar IV, Lajpat Nagar, New Delhi","11/5/2016 - 11/5/2016, Every day, AM Peak",698,508,957
"72","7/254, Dakshinpuri Extension, Block 7, Sector 6, Dakshinpuri, New Delhi","65","Shaheed Jeet Singh Marg, NCERT Campus, Qutab Institutional Area, New Delhi","11/5/2016 - 11/5/2016, Every day, AM Peak",1106,767,1593
"72","7/254, Dakshinpuri Extension, Block 7, Sector 6, Dakshinpuri, New Delhi","66","nullBhagat Singh Market Marg, Block K, Malviya Nagar, New Delhi","11/5/2016 - 11/5/2016, Every day, AM Peak",761,531,1089
"72","7/254, Dakshinpuri Extension, Block 7, Sector 6, Dakshinpuri, New Delhi","67","63/33, Hudco Place, Andrews Ganj Extension, Andrews Ganj, New Delhi","11/5/2016 - 11/5/2016, Every day, AM Peak",665,483,914
"72","7/254, Dakshinpuri Extension, Block 7, Sector 6, Dakshinpuri, New Delhi","68","0 Paschimi Marg, Block E, Vasant Vihar, New Delhi","11/5/2016 - 11/5/2016, Every day, AM Peak",1455,1010,2094
"72","7/254, Dakshinpuri Extension, Block 7, Sector 6, Dakshinpuri, New Delhi","69","1129, Sector 2 R K Puram, Sector 2, RK Puram, New Delhi","11/5/2016 - 11/5/2016, Every day, AM Peak",1402,955,2057
"72","7/254, Dakshinpuri Extension, Block 7, Sector 6, Dakshinpuri, New Delhi","70","G288, Sector 3, Block G, Nanak Pura, South Moti Bagh, New Delhi","11/5/2016 - 11/5/2016, Every day, AM Peak",1657,1116,2459
"72","7/254, Dakshinpuri Extension, Block 7, Sector 6, Dakshinpuri, New Delhi","71","JNU Ring Road, Jawaharlal Nehru University, New Delhi","11/5/2016 - 11/5/2016, Every day, AM Peak",1505,979,2312
"72","7/254, Dakshinpuri Extension, Block 7, Sector 6, Dakshinpuri, New Delhi","73","0 Central Avenue, Block E, Sainik Farm, New Delhi","11/5/2016 - 11/5/2016, Every day, AM Peak",371,231,593
"72","7/254, Dakshinpuri Extension, Block 7, Sector 6, Dakshinpuri, New Delhi","74","F-269, Ambedkar Nagar, Block F, Sector 5, Dakshinpuri, New Delhi","11/5/2016 - 11/5/2016, Every day, AM Peak",301,145,623
"72","7/254, Dakshinpuri Extension, Block 7, Sector 6, Dakshinpuri, New Delhi","75","B-299, Ambedkar Nagar, Block B, Sector 5, Dakshinpuri, New Delhi","11/5/2016 - 11/5/2016, Every day, AM Peak",199,94,420
"72","7/254, Dakshinpuri Extension, Block 7, Sector 6, Dakshinpuri, New Delhi","76","124, SPG Quarters, Sector 4, Pushp Vihar, New Delhi","11/5/2016 - 11/5/2016, Every day, AM Peak",171,72,404
"72","7/254, Dakshinpuri Extension, Block 7, Sector 6, Dakshinpuri, New Delhi","77","0 Mehrauli - Badarpur Road, Tughlakabad Institutional Area, Vayusenabad, New Delhi","11/5/2016 - 11/5/2016, Every day, AM Peak",658,371,1166
"72","7/254, Dakshinpuri Extension, Block 7, Sector 6, Dakshinpuri, New Delhi","80","E-492, Block E, Greater Kailash II, Greater Kailash, New Delhi","11/5/2016 - 11/5/2016, Every day, AM Peak",279,139,557
"72","7/254, Dakshinpuri Extension, Block 7, Sector 6, Dakshinpuri, New Delhi","81","126, Block L 1, Alaknanda, New Delhi","11/5/2016 - 11/5/2016, Every day, AM Peak",541,402,726
"72","7/254, Dakshinpuri Extension, Block 7, Sector 6, Dakshinpuri, New Delhi","82","286, Asian Games Village Complex, Siri Fort, New Delhi","11/5/2016 - 11/5/2016, Every day, AM Peak",445,269,735
"72","7/254, Dakshinpuri Extension, Block 7, Sector 6, Dakshinpuri, New Delhi","83","C2, Block C, Kailash Colony, Greater Kailash, New Delhi","11/5/2016 - 11/5/2016, Every day, AM Peak",593,383,916
"72","7/254, Dakshinpuri Extension, Block 7, Sector 6, Dakshinpuri, New Delhi","84","nullMathura Road, Friends Colony West, Block A, New Friends Colony, New Delhi","11/5/2016 - 11/5/2016, Every day, AM Peak",933,733,1187
"72","7/254, Dakshinpuri Extension, Block 7, Sector 6, Dakshinpuri, New Delhi","85","Outer Ring Road, Block 13, Nehru Enclave East, Okhla Industrial Area, New Delhi","11/5/2016 - 11/5/2016, Every day, AM Peak",709,531,945
"72","7/254, Dakshinpuri Extension, Block 7, Sector 6, Dakshinpuri, New Delhi","90","C-86, Pocket C, Okhla Phase I, Okhla Industrial Area, New Delhi","11/5/2016 - 11/5/2016, Every day, AM Peak",1383,1021,1871
"72","7/254, Dakshinpuri Extension, Block 7, Sector 6, Dakshinpuri, New Delhi","106","IGNOU Residential Campus Road, Rocky Area, Stone Quarries, Maidan Garhi, New Delhi","11/5/2016 - 11/5/2016, Every day, AM Peak",741,532,1031
"72","7/254, Dakshinpuri Extension, Block 7, Sector 6, Dakshinpuri, New Delhi","107","1100 Zia UL Haq Road, Block A1, Chattarpur, Chhattarpur, New Delhi","11/5/2016 - 11/5/2016, Every day, AM Peak",1473,1165,1861
"72","7/254, Dakshinpuri Extension, Block 7, Sector 6, Dakshinpuri, New Delhi","108","Unnamed Road, Block G, Bhim Basti, Jaunapur, New Delhi","11/5/2016 - 11/5/2016, Every day, AM Peak",1906,1619,2242
"72","7/254, Dakshinpuri Extension, Block 7, Sector 6, Dakshinpuri, New Delhi","148","Unnamed Road, Patparganj, New Delhi","11/5/2016 - 11/5/2016, Every day, AM Peak",1561,1224,1990
"72","7/254, Dakshinpuri Extension, Block 7, Sector 6, Dakshinpuri, New Delhi","154","nullGali Number 6, Block B, Block D, Vinod Nagar North, Delhi","11/5/2016 - 11/5/2016, Every day, AM Peak",2025,1555,2636
"72","7/254, Dakshinpuri Extension, Block 7, Sector 6, Dakshinpuri, New Delhi","191","0 Hasanpur, I.P.Extension, Patparganj, Delhi","11/5/2016 - 11/5/2016, Every day, AM Peak",2095,1694,2589
"72","7/254, Dakshinpuri Extension, Block 7, Sector 6, Dakshinpuri, New Delhi","193","Unnamed Road, Usmanpur, Shahdara, Delhi","11/5/2016 - 11/5/2016, Every day, AM Peak",1461,1127,1892
"72","7/254, Dakshinpuri Extension, Block 7, Sector 6, Dakshinpuri, New Delhi","246","nullShiv Mandir Marg, Block G, Lajpat Nagar I, Lajpat Nagar, New Delhi","11/5/2016 - 11/5/2016, Every day, AM Peak",817,611,1091
"72","7/254, Dakshinpuri Extension, Block 7, Sector 6, Dakshinpuri, New Delhi","248","Unnamed Road, Harijan Basti, Rajokri, New Delhi","11/5/2016 - 11/5/2016, Every day, AM Peak",1912,1356,2694
"72","7/254, Dakshinpuri Extension, Block 7, Sector 6, Dakshinpuri, New Delhi","252","813, Sector 1, RK Puram, New Delhi","11/5/2016 - 11/5/2016, Every day, AM Peak",1356,911,2017
"72","7/254, Dakshinpuri Extension, Block 7, Sector 6, Dakshinpuri, New Delhi","253","0 Chaudhary Harsukh Marg, B6, Block B6, Humayunpur, Safdarjung Enclave, New Delhi","11/5/2016 - 11/5/2016, Every day, AM Peak",1092,862,1382
"72","7/254, Dakshinpuri Extension, Block 7, Sector 6, Dakshinpuri, New Delhi","254","Squadron Leader Mohinder Kumar Jain Marg, Block B, New Delhi","11/5/2016 - 11/5/2016, Every day, AM Peak",1162,762,1769
"72","7/254, Dakshinpuri Extension, Block 7, Sector 6, Dakshinpuri, New Delhi","259","Jogging Lane, Pocket B-C, Sector-A, Vasant Kunj, New Delhi","11/5/2016 - 11/5/2016, Every day, AM Peak",520,356,757
"72","7/254, Dakshinpuri Extension, Block 7, Sector 6, Dakshinpuri, New Delhi","263","200 Pirwali Gali, Block P, Block P, Patparganj, New Delhi","11/5/2016 - 11/5/2016, Every day, AM Peak",1808,1459,2239
"72","7/254, Dakshinpuri Extension, Block 7, Sector 6, Dakshinpuri, New Delhi","264","Noida Link Road, Nehru Enclave, Shakarpur Khas, New Delhi","11/5/2016 - 11/5/2016, Every day, AM Peak",1913,1546,2365
"72","7/254, Dakshinpuri Extension, Block 7, Sector 6, Dakshinpuri, New Delhi","272","Anuvrat Marg, Butterfly Park, Qila Rai Pithora, Mehrauli, New Delhi","11/5/2016 - 11/5/2016, Every day, AM Peak",980,685,1400