"Origin Movement ID","Origin Display Name","Destination Movement ID","Destination Display Name","Date Range","Mean Travel Time (Seconds)","Range - Lower Bound Travel Time (Seconds)","Range - Upper Bound Travel Time (Seconds)"
"176","B7-187, Pocket 7, Sector 3B, Rohini, Delhi","1","300 Ring Road, Block CB, Naraina Village, Naraina, New Delhi","11/4/2016 - 11/4/2016, Every day, AM Peak",2584,2160,3091
"176","B7-187, Pocket 7, Sector 3B, Rohini, Delhi","2","Unnamed Road, Delhi Cantonment, New Delhi","11/4/2016 - 11/4/2016, Every day, AM Peak",2828,2068,3866
"176","B7-187, Pocket 7, Sector 3B, Rohini, Delhi","3","Unnamed Road, Mahipalpur, New Delhi","11/4/2016 - 11/4/2016, Every day, AM Peak",3840,3168,4653
"176","B7-187, Pocket 7, Sector 3B, Rohini, Delhi","4","P-268/3, Rock View, Delhi Cantonment, Delhi","11/4/2016 - 11/4/2016, Every day, AM Peak",3554,2804,4504
"176","B7-187, Pocket 7, Sector 3B, Rohini, Delhi","5","Old Palam Road, Delhi Cantonment, New Delhi","11/4/2016 - 11/4/2016, Every day, AM Peak",3522,2711,4574
"176","B7-187, Pocket 7, Sector 3B, Rohini, Delhi","7","P 13, Baird Place, Delhi Cantonment, New Delhi","11/4/2016 - 11/4/2016, Every day, AM Peak",2611,1950,3494
"176","B7-187, Pocket 7, Sector 3B, Rohini, Delhi","8","Mall Road, Khyber Lines, Delhi Cantonment, New Delhi","11/4/2016 - 11/4/2016, Every day, AM Peak",3198,2453,4168
"176","B7-187, Pocket 7, Sector 3B, Rohini, Delhi","9","Mahatma Jyothi Rao Phule Marg, Mahatma Jyoti Rao Phule Marg Area, New Delhi","11/4/2016 - 11/4/2016, Every day, AM Peak",3881,3032,4966
"176","B7-187, Pocket 7, Sector 3B, Rohini, Delhi","10","0 Shaheed Bhagat Singh Marg, DIZ Staff Quarters, Connaught Place, New Delhi","11/4/2016 - 11/4/2016, Every day, AM Peak",3411,2718,4279
"176","B7-187, Pocket 7, Sector 3B, Rohini, Delhi","11","Mother Teresa Crescent, Talkatora Garden, Central Ridge Reserve Forest, New Delhi","11/4/2016 - 11/4/2016, Every day, AM Peak",3039,2528,3652
"176","B7-187, Pocket 7, Sector 3B, Rohini, Delhi","12","Jantar Mantar Road, Janpath, Connaught Place, New Delhi","11/4/2016 - 11/4/2016, Every day, AM Peak",3175,2641,3815
"176","B7-187, Pocket 7, Sector 3B, Rohini, Delhi","14","Mahatma Gandhi Road, Kidwai Nagar West, Kidwai Nagar, New Delhi","11/4/2016 - 11/4/2016, Every day, AM Peak",3914,3112,4921
"176","B7-187, Pocket 7, Sector 3B, Rohini, Delhi","16","Andre Malraux Marg, Ramnagar, Chanakyapuri, New Delhi","11/4/2016 - 11/4/2016, Every day, AM Peak",3443,2766,4285
"176","B7-187, Pocket 7, Sector 3B, Rohini, Delhi","24","268, Block B2, Shiv Nagar, Janakpuri, New Delhi","11/4/2016 - 11/4/2016, Every day, AM Peak",1260,916,1732
"176","B7-187, Pocket 7, Sector 3B, Rohini, Delhi","25","nullNehru Vihar Road, B Block, A Block, Nehru Vihar, Mukherjee Nagar, Delhi","11/4/2016 - 11/4/2016, Every day, AM Peak",1090,835,1422
"176","B7-187, Pocket 7, Sector 3B, Rohini, Delhi","26","A3-214, Asalatpur Village, Janakpuri, Delhi","11/4/2016 - 11/4/2016, Every day, AM Peak",1234,861,1767
"176","B7-187, Pocket 7, Sector 3B, Rohini, Delhi","27","0 Ram Mandir Marg, C5B Block, Janakpuri, New Delhi","11/4/2016 - 11/4/2016, Every day, AM Peak",1502,1113,2026
"176","B7-187, Pocket 7, Sector 3B, Rohini, Delhi","28","nullSchool Road, Block M, Uttam Nagar, Delhi","11/4/2016 - 11/4/2016, Every day, AM Peak",1660,1151,2392
"176","B7-187, Pocket 7, Sector 3B, Rohini, Delhi","29","Street Number 14, Block C, Sitapuri Part 1, Janakpuri, New Delhi","11/4/2016 - 11/4/2016, Every day, AM Peak",1630,1202,2208
"176","B7-187, Pocket 7, Sector 3B, Rohini, Delhi","31","Main Jhatikra Road, Paprawat, Delhi","11/4/2016 - 11/4/2016, Every day, AM Peak",2765,2420,3157
"176","B7-187, Pocket 7, Sector 3B, Rohini, Delhi","32","METRO MALL, Pocket 1, Sector 14 Dwarka, Dwarka, New Delhi","11/4/2016 - 11/4/2016, Every day, AM Peak",2816,2485,3190
"176","B7-187, Pocket 7, Sector 3B, Rohini, Delhi","58","Pushta Road, Block A, Rajiv Nagar, Sonia Vihar, Delhi","11/4/2016 - 11/4/2016, Every day, AM Peak",2907,2785,3033
"176","B7-187, Pocket 7, Sector 3B, Rohini, Delhi","60","nullGali Number 31, Sonia Vihar, New Delhi","11/4/2016 - 11/4/2016, Every day, AM Peak",2810,2693,2931
"176","B7-187, Pocket 7, Sector 3B, Rohini, Delhi","61","Unnamed Road, National Zoological Park, Sundar Nagar, New Delhi","11/4/2016 - 11/4/2016, Every day, AM Peak",3230,2353,4432
"176","B7-187, Pocket 7, Sector 3B, Rohini, Delhi","65","Shaheed Jeet Singh Marg, NCERT Campus, Qutab Institutional Area, New Delhi","11/4/2016 - 11/4/2016, Every day, AM Peak",4346,3416,5527
"176","B7-187, Pocket 7, Sector 3B, Rohini, Delhi","69","1129, Sector 2 R K Puram, Sector 2, RK Puram, New Delhi","11/4/2016 - 11/4/2016, Every day, AM Peak",4056,3188,5159
"176","B7-187, Pocket 7, Sector 3B, Rohini, Delhi","70","G288, Sector 3, Block G, Nanak Pura, South Moti Bagh, New Delhi","11/4/2016 - 11/4/2016, Every day, AM Peak",3417,2848,4099
"176","B7-187, Pocket 7, Sector 3B, Rohini, Delhi","71","JNU Ring Road, Jawaharlal Nehru University, New Delhi","11/4/2016 - 11/4/2016, Every day, AM Peak",3855,3261,4555
"176","B7-187, Pocket 7, Sector 3B, Rohini, Delhi","103","nullDasghara Road, Dasghara, New Delhi","11/4/2016 - 11/4/2016, Every day, AM Peak",2225,1821,2717
"176","B7-187, Pocket 7, Sector 3B, Rohini, Delhi","104","nullArya Samaj Marg, Block A1, Block EA, Inder Puri, New Delhi","11/4/2016 - 11/4/2016, Every day, AM Peak",2205,1830,2656
"176","B7-187, Pocket 7, Sector 3B, Rohini, Delhi","105","nullGoswami Girdhari Lal Marg, Industrial Area Phase I, Block C, Naraina Industrial Area Phase 1, Naraina, New Delhi","11/4/2016 - 11/4/2016, Every day, AM Peak",2799,2157,3631
"176","B7-187, Pocket 7, Sector 3B, Rohini, Delhi","121","22/55, West Punjabi Bagh, Punjabi Bagh, Delhi","11/4/2016 - 11/4/2016, Every day, AM Peak",1407,1053,1878
"176","B7-187, Pocket 7, Sector 3B, Rohini, Delhi","122","2600 Mandir Wali Gali, Ranjeet Nagar, Shadipur, Delhi","11/4/2016 - 11/4/2016, Every day, AM Peak",2002,1623,2468
"176","B7-187, Pocket 7, Sector 3B, Rohini, Delhi","123","Loknath Marg, Block M, Kirti Nagar, New Delhi","11/4/2016 - 11/4/2016, Every day, AM Peak",1611,1298,1999
"176","B7-187, Pocket 7, Sector 3B, Rohini, Delhi","124","30, 31, Block B, Mansarover Garden, New Delhi","11/4/2016 - 11/4/2016, Every day, AM Peak",2236,1676,2982
"176","B7-187, Pocket 7, Sector 3B, Rohini, Delhi","127","NDPL House, Lala Achintaram Marg, Block B, Gujranwala Town, Delhi","11/4/2016 - 11/4/2016, Every day, AM Peak",1282,1065,1542
"176","B7-187, Pocket 7, Sector 3B, Rohini, Delhi","129","Gali Number 8, Anand Parbat, New Delhi","11/4/2016 - 11/4/2016, Every day, AM Peak",2143,1633,2811
"176","B7-187, Pocket 7, Sector 3B, Rohini, Delhi","132","1600 Lothian Road, Chabi Ganj, Kashmere Gate, New Delhi","11/4/2016 - 11/4/2016, Every day, AM Peak",1609,1317,1965
"176","B7-187, Pocket 7, Sector 3B, Rohini, Delhi","133","0 Raj Niwas Marg, Ludlow Castle, Civil Lines, Delhi","11/4/2016 - 11/4/2016, Every day, AM Peak",1375,1102,1714
"176","B7-187, Pocket 7, Sector 3B, Rohini, Delhi","135","0 Uggarsen Market Road, Meenakshi Garden, Ashok Nagar, Delhi","11/4/2016 - 11/4/2016, Every day, AM Peak",1354,932,1965
"176","B7-187, Pocket 7, Sector 3B, Rohini, Delhi","136","nullKeshopur Road, New Chaukhandi, Paschim Vihar, Delhi","11/4/2016 - 11/4/2016, Every day, AM Peak",886,566,1384
"176","B7-187, Pocket 7, Sector 3B, Rohini, Delhi","137","nullRoad Number 235, Block H, Vikaspuri, Delhi","11/4/2016 - 11/4/2016, Every day, AM Peak",937,606,1448
"176","B7-187, Pocket 7, Sector 3B, Rohini, Delhi","139","nullBudh Bazar Road, Nawada, Nawada Majra Village, Nawada, Delhi","11/4/2016 - 11/4/2016, Every day, AM Peak",2151,1591,2907
"176","B7-187, Pocket 7, Sector 3B, Rohini, Delhi","140","A12/B, Sainik Nagar, Mansa Ram Park, Uttam Nagar, Delhi","11/4/2016 - 11/4/2016, Every day, AM Peak",2245,1687,2987
"176","B7-187, Pocket 7, Sector 3B, Rohini, Delhi","142","Gali Number 1, Dabri Village, Dabri, New Delhi","11/4/2016 - 11/4/2016, Every day, AM Peak",1641,1218,2210
"176","B7-187, Pocket 7, Sector 3B, Rohini, Delhi","143","nullRoad Number 221, Pocket 1, Sector 10 Dwarka, Dwarka, Delhi","11/4/2016 - 11/4/2016, Every day, AM Peak",2494,2078,2992
"176","B7-187, Pocket 7, Sector 3B, Rohini, Delhi","146","nullKotla Road, Pocket F2, Pocket 1, Sector 11F, Rohini, Delhi","11/4/2016 - 11/4/2016, Every day, AM Peak",881,670,1156
"176","B7-187, Pocket 7, Sector 3B, Rohini, Delhi","148","Unnamed Road, Patparganj, New Delhi","11/4/2016 - 11/4/2016, Every day, AM Peak",3132,2554,3840
"176","B7-187, Pocket 7, Sector 3B, Rohini, Delhi","155","Maharaja Agaersen Road, Block D, Pocket D, Phase 1, Ashok Vihar, Delhi","11/4/2016 - 11/4/2016, Every day, AM Peak",1416,966,2073
"176","B7-187, Pocket 7, Sector 3B, Rohini, Delhi","156","Doctor Satpal Sachdeva Marg, Keshav Puram, Tri Nagar, Delhi","11/4/2016 - 11/4/2016, Every day, AM Peak",1365,925,2014
"176","B7-187, Pocket 7, Sector 3B, Rohini, Delhi","159","300 Maharishi Balmiki Mandir Marg, Block H, Shakurpur Colony, Pitampura, Delhi","11/4/2016 - 11/4/2016, Every day, AM Peak",1128,766,1658
"176","B7-187, Pocket 7, Sector 3B, Rohini, Delhi","160","23, Shiva Enclave, Pitampura, Delhi","11/4/2016 - 11/4/2016, Every day, AM Peak",347,146,820
"176","B7-187, Pocket 7, Sector 3B, Rohini, Delhi","161","nullLawrence Road, Rampura Industrial Area, Tri Nagar, Delhi","11/4/2016 - 11/4/2016, Every day, AM Peak",1231,883,1715
"176","B7-187, Pocket 7, Sector 3B, Rohini, Delhi","163","0 Guru Harkishan Marg, Maulana Azad Society, Bhagwan Buddha Housing Corporation Society, Pitampura, Delhi","11/4/2016 - 11/4/2016, Every day, AM Peak",357,89,1425
"176","B7-187, Pocket 7, Sector 3B, Rohini, Delhi","164","Shakurbasti Pedestrian Foot Over Bridge, Shakur Basti Railway Colony, Railway Colony South, Pitampura, Delhi","11/4/2016 - 11/4/2016, Every day, AM Peak",951,650,1390
"176","B7-187, Pocket 7, Sector 3B, Rohini, Delhi","165","31, Cottage Enclave, Paschim Vihar, Delhi","11/4/2016 - 11/4/2016, Every day, AM Peak",616,350,1082
"176","B7-187, Pocket 7, Sector 3B, Rohini, Delhi","166","nullRBI Enclave Road, Ankur Enclave, Paschim Vihar, Delhi","11/4/2016 - 11/4/2016, Every day, AM Peak",708,447,1120
"176","B7-187, Pocket 7, Sector 3B, Rohini, Delhi","167","nullShaheed Udham Singh Marg, AE Block, Poorbi Shalimar Bag, Shalimar Bagh, Delhi","11/4/2016 - 11/4/2016, Every day, AM Peak",1332,869,2040
"176","B7-187, Pocket 7, Sector 3B, Rohini, Delhi","168","nullGyan Shakti Mandir Marg, Block BA, West Shalimar Bagh, Shalimar Bagh, Delhi","11/4/2016 - 11/4/2016, Every day, AM Peak",894,621,1285
"176","B7-187, Pocket 7, Sector 3B, Rohini, Delhi","169","G-9, Block F 1U, Ranikhet, Pitampura, Delhi","11/4/2016 - 11/4/2016, Every day, AM Peak",413,252,674
"176","B7-187, Pocket 7, Sector 3B, Rohini, Delhi","170","nullColony Road, Block QP, Poorvi Pitampura, Pitampura, Delhi","11/4/2016 - 11/4/2016, Every day, AM Peak",475,205,1098
"176","B7-187, Pocket 7, Sector 3B, Rohini, Delhi","171","nullG Block Road, Pocket 21, Sector 7G, Rohini, Delhi","11/4/2016 - 11/4/2016, Every day, AM Peak",356,132,956
"176","B7-187, Pocket 7, Sector 3B, Rohini, Delhi","172","nullShiva Road, Pocket 14, Sector 8D, Rohini, Delhi","11/4/2016 - 11/4/2016, Every day, AM Peak",296,142,616
"176","B7-187, Pocket 7, Sector 3B, Rohini, Delhi","173","Unnamed Road, Swarn Jayanti Park, Sector 10, Rohini, Delhi","11/4/2016 - 11/4/2016, Every day, AM Peak",579,376,891
"176","B7-187, Pocket 7, Sector 3B, Rohini, Delhi","175","235, Block E, Block E, Mangolpuri, Delhi","11/4/2016 - 11/4/2016, Every day, AM Peak",277,106,723
"176","B7-187, Pocket 7, Sector 3B, Rohini, Delhi","179","0 AB Road, Block RR, Mianwali Nagar, Paschim Vihar, Delhi","11/4/2016 - 11/4/2016, Every day, AM Peak",773,410,1455
"176","B7-187, Pocket 7, Sector 3B, Rohini, Delhi","180","GH-14/234, GH 14, Block GH 14, Paschim Vihar, Delhi","11/4/2016 - 11/4/2016, Every day, AM Peak",851,566,1278
"176","B7-187, Pocket 7, Sector 3B, Rohini, Delhi","186","14, Sector 21, Rohini, Delhi","11/4/2016 - 11/4/2016, Every day, AM Peak",658,461,937
"176","B7-187, Pocket 7, Sector 3B, Rohini, Delhi","187","60, Vijay Vihar Phase II, Pocket C, Sector 1, Rohini, Delhi","11/4/2016 - 11/4/2016, Every day, AM Peak",234,121,451
"176","B7-187, Pocket 7, Sector 3B, Rohini, Delhi","188","12/188, Shastri Nagar, Geeta Colony, New Delhi","11/4/2016 - 11/4/2016, Every day, AM Peak",2124,1849,2438
"176","B7-187, Pocket 7, Sector 3B, Rohini, Delhi","189","F22, Block F, Krishna Nagar, Delhi","11/4/2016 - 11/4/2016, Every day, AM Peak",2161,1795,2600
"176","B7-187, Pocket 7, Sector 3B, Rohini, Delhi","193","Unnamed Road, Usmanpur, Shahdara, Delhi","11/4/2016 - 11/4/2016, Every day, AM Peak",1982,1597,2459
"176","B7-187, Pocket 7, Sector 3B, Rohini, Delhi","196","nullSir Chotu Ram Marg, Pocket 4, Sector 6C, Rohini, Delhi","11/4/2016 - 11/4/2016, Every day, AM Peak",444,235,838
"176","B7-187, Pocket 7, Sector 3B, Rohini, Delhi","199","0 Shivaji Marg, New Moti Nagar, Najafgarh Road Industrial Area, Delhi","11/4/2016 - 11/4/2016, Every day, AM Peak",1582,1287,1943
"176","B7-187, Pocket 7, Sector 3B, Rohini, Delhi","200","Dabri - Gurgaon Road, Pocket 2, Sector 1 Dwarka, Dwarka, New Delhi","11/4/2016 - 11/4/2016, Every day, AM Peak",2048,1575,2662
"176","B7-187, Pocket 7, Sector 3B, Rohini, Delhi","204","0 East Patel Nagar Road, Block 10A, East Patel Nagar, Patel Nagar, New Delhi","11/4/2016 - 11/4/2016, Every day, AM Peak",2226,1814,2731
"176","B7-187, Pocket 7, Sector 3B, Rohini, Delhi","205","2100 Gali Number 14, Block B, Prem Nagar, Patel Nagar, New Delhi","11/4/2016 - 11/4/2016, Every day, AM Peak",1826,1490,2237
"176","B7-187, Pocket 7, Sector 3B, Rohini, Delhi","207","0 Maharana Pratap Road, Block 53, Karol Bagh, New Delhi","11/4/2016 - 11/4/2016, Every day, AM Peak",3135,2242,4383
"176","B7-187, Pocket 7, Sector 3B, Rohini, Delhi","208","Desh Bandhu Gupta Road, Block E, Jhandewalan Extension, Jhandewalan, New Delhi","11/4/2016 - 11/4/2016, Every day, AM Peak",3198,2438,4193
"176","B7-187, Pocket 7, Sector 3B, Rohini, Delhi","212","Bawana Road, Sector 30, Rohini, Delhi","11/4/2016 - 11/4/2016, Every day, AM Peak",1039,878,1229
"176","B7-187, Pocket 7, Sector 3B, Rohini, Delhi","215","Unnamed Road, Bagiabad, Jharoda Majra Burari, Delhi","11/4/2016 - 11/4/2016, Every day, AM Peak",913,707,1177
"176","B7-187, Pocket 7, Sector 3B, Rohini, Delhi","216","0 Main Canal Road, Harit Vihar, Mukandpur Part 2, Mukundpur, Delhi","11/4/2016 - 11/4/2016, Every day, AM Peak",822,611,1105
"176","B7-187, Pocket 7, Sector 3B, Rohini, Delhi","218","nullTandoor Wali Gali, Swami Shraddhanand Park, Bhalswa Dairy, Jahangirpura, Delhi","11/4/2016 - 11/4/2016, Every day, AM Peak",588,409,843
"176","B7-187, Pocket 7, Sector 3B, Rohini, Delhi","219","461, Block AG, Sanjay Gandhi Transport Nagar, Delhi","11/4/2016 - 11/4/2016, Every day, AM Peak",501,342,733
"176","B7-187, Pocket 7, Sector 3B, Rohini, Delhi","221","Srinagar - Kanyakumari Highway, Bhalswa Jahangirpuri, Jahangirpuri, Delhi","11/4/2016 - 11/4/2016, Every day, AM Peak",622,430,899
"176","B7-187, Pocket 7, Sector 3B, Rohini, Delhi","222","Sector E, Mahipalpur Village, Vasant Kunj, New Delhi","11/4/2016 - 11/4/2016, Every day, AM Peak",4257,3591,5046
"176","B7-187, Pocket 7, Sector 3B, Rohini, Delhi","223","Urban Extension Road II, Indira Gandhi International Airport, New Delhi","11/4/2016 - 11/4/2016, Every day, AM Peak",4263,3577,5080
"176","B7-187, Pocket 7, Sector 3B, Rohini, Delhi","224","Main Road, Bharthal, Sector 27 Dwarka, Bharthal, New Delhi","11/4/2016 - 11/4/2016, Every day, AM Peak",3288,2692,4015
"176","B7-187, Pocket 7, Sector 3B, Rohini, Delhi","225","0 Netaji Road, A Block, Block C, Adarsh Nagar, Delhi","11/4/2016 - 11/4/2016, Every day, AM Peak",1078,813,1427
"176","B7-187, Pocket 7, Sector 3B, Rohini, Delhi","226","Unnamed Road, Model Town, Delhi","11/4/2016 - 11/4/2016, Every day, AM Peak",1224,826,1813
"176","B7-187, Pocket 7, Sector 3B, Rohini, Delhi","227","300 Lok Marg, Dhaka Colony, Mukherjee Nagar, Delhi","11/4/2016 - 11/4/2016, Every day, AM Peak",1843,1334,2545
"176","B7-187, Pocket 7, Sector 3B, Rohini, Delhi","228","0 Lucknow Road, Banarsi Das Estate, Timarpur, Delhi","11/4/2016 - 11/4/2016, Every day, AM Peak",1272,982,1647
"176","B7-187, Pocket 7, Sector 3B, Rohini, Delhi","229","200 Road Number 28, Nehru Nagar, Shivaji Place, Basai Dara pur, Tagore Garden Extension, New Delhi","11/4/2016 - 11/4/2016, Every day, AM Peak",1584,1186,2114
"176","B7-187, Pocket 7, Sector 3B, Rohini, Delhi","231","G-17/6, Block G, Rajouri Garden, New Delhi","11/4/2016 - 11/4/2016, Every day, AM Peak",1813,1488,2208
"176","B7-187, Pocket 7, Sector 3B, Rohini, Delhi","232","4-3, Mayapuri Industrial Area Phase II, Mayapuri, New Delhi","11/4/2016 - 11/4/2016, Every day, AM Peak",2036,1460,2838
"176","B7-187, Pocket 7, Sector 3B, Rohini, Delhi","233","nullSatguru Ram Singh Marg, Block B, Mayapuri Industrial Area Phase I, Mayapuri, New Delhi","11/4/2016 - 11/4/2016, Every day, AM Peak",2870,2305,3573
"176","B7-187, Pocket 7, Sector 3B, Rohini, Delhi","234","113, Press Colony, Press Colony, Mayapuri, New Delhi","11/4/2016 - 11/4/2016, Every day, AM Peak",2567,2058,3201
"176","B7-187, Pocket 7, Sector 3B, Rohini, Delhi","236","nullRithala Road, Pocket A, Budh Vihar Phase I, Budh Vihar, Delhi","11/4/2016 - 11/4/2016, Every day, AM Peak",449,346,582
"176","B7-187, Pocket 7, Sector 3B, Rohini, Delhi","240","37, Sector 15, Pocket 6, Sector 15B, Rohini, Delhi","11/4/2016 - 11/4/2016, Every day, AM Peak",459,277,758
"176","B7-187, Pocket 7, Sector 3B, Rohini, Delhi","244","Dhingra Park Trail, Punjabi Bagh Cooperative Housing Soceity, East Punjabi Bagh, Punjabi Bagh, Delhi","11/4/2016 - 11/4/2016, Every day, AM Peak",1413,1062,1879
"176","B7-187, Pocket 7, Sector 3B, Rohini, Delhi","245","N-1/17, Block M, Mangolpuri, Delhi","11/4/2016 - 11/4/2016, Every day, AM Peak",214,79,576
"176","B7-187, Pocket 7, Sector 3B, Rohini, Delhi","247","9/2082, Pocket 2, Block RZ, Palam Colony, New Delhi","11/4/2016 - 11/4/2016, Every day, AM Peak",2330,1827,2971
"176","B7-187, Pocket 7, Sector 3B, Rohini, Delhi","248","Unnamed Road, Harijan Basti, Rajokri, New Delhi","11/4/2016 - 11/4/2016, Every day, AM Peak",4709,3828,5791
"176","B7-187, Pocket 7, Sector 3B, Rohini, Delhi","250","719B, Madipur JJ Colony, Block B, Janta Colony, Paschim Vihar, Delhi","11/4/2016 - 11/4/2016, Every day, AM Peak",874,779,980
"176","B7-187, Pocket 7, Sector 3B, Rohini, Delhi","251","A25, Block R, Pocket A, Rajender Nagar Part 1, New Rajinder Nagar, New Delhi","11/4/2016 - 11/4/2016, Every day, AM Peak",2610,2137,3186
"176","B7-187, Pocket 7, Sector 3B, Rohini, Delhi","252","813, Sector 1, RK Puram, New Delhi","11/4/2016 - 11/4/2016, Every day, AM Peak",3353,2690,4178
"176","B7-187, Pocket 7, Sector 3B, Rohini, Delhi","253","0 Chaudhary Harsukh Marg, B6, Block B6, Humayunpur, Safdarjung Enclave, New Delhi","11/4/2016 - 11/4/2016, Every day, AM Peak",4233,3572,5016
"176","B7-187, Pocket 7, Sector 3B, Rohini, Delhi","256","D-70, Mahavir Enclave I, Mahavir Enclave Part 2, Mahavir Enclave, New Delhi","11/4/2016 - 11/4/2016, Every day, AM Peak",1878,1441,2445
"176","B7-187, Pocket 7, Sector 3B, Rohini, Delhi","257","y 788, Block W, Mangolpur Khurd, Mangolpuri, नई दिल्ली","11/4/2016 - 11/4/2016, Every day, AM Peak",169,113,252
"176","B7-187, Pocket 7, Sector 3B, Rohini, Delhi","261","Nangli Ibrahimpur Road, Kadipur, Kushak Colony, Kadipur Village, Delhi","11/4/2016 - 11/4/2016, Every day, AM Peak",732,540,991
"176","B7-187, Pocket 7, Sector 3B, Rohini, Delhi","263","200 Pirwali Gali, Block P, Block P, Patparganj, New Delhi","11/4/2016 - 11/4/2016, Every day, AM Peak",2686,2275,3170
"176","B7-187, Pocket 7, Sector 3B, Rohini, Delhi","264","Noida Link Road, Nehru Enclave, Shakarpur Khas, New Delhi","11/4/2016 - 11/4/2016, Every day, AM Peak",2491,2155,2878
"176","B7-187, Pocket 7, Sector 3B, Rohini, Delhi","265","0 Lane Number 8, Krishan Kunj Extension Part 2, Block G, Vishwakarma Park, Laxmi Nagar, Delhi","11/4/2016 - 11/4/2016, Every day, AM Peak",2286,1949,2680
"176","B7-187, Pocket 7, Sector 3B, Rohini, Delhi","267","nullPanduk Shila Marg, Kaithwara Jagjivan Nagar, New Usmanpur, Shahdara, Delhi","11/4/2016 - 11/4/2016, Every day, AM Peak",1699,1478,1951
"176","B7-187, Pocket 7, Sector 3B, Rohini, Delhi","277","700 Outer Ring Road, Bhalswa Jahangir Village, Jahangirpuri, नई दिल्ली","11/4/2016 - 11/4/2016, Every day, AM Peak",642,458,899
"176","B7-187, Pocket 7, Sector 3B, Rohini, Delhi","279","Nightingale Road, Budella, Vikaspuri, Delhi","11/4/2016 - 11/4/2016, Every day, AM Peak",964,645,1440
"176","B7-187, Pocket 7, Sector 3B, Rohini, Delhi","280","nullHastsal Road, Block A2, JJ Colony, Uttam Nagar, Delhi","11/4/2016 - 11/4/2016, Every day, AM Peak",1680,1172,2406
"176","B7-187, Pocket 7, Sector 3B, Rohini, Delhi","281","D915, New Mahavir Nagar, Tilak Nagar, Delhi","11/4/2016 - 11/4/2016, Every day, AM Peak",1042,704,1542
"176","B7-187, Pocket 7, Sector 3B, Rohini, Delhi","282","Velodrome Road, Gandhi Smriti, Raj Ghat, New Delhi","11/4/2016 - 11/4/2016, Every day, AM Peak",2407,1804,3209
"176","B7-187, Pocket 7, Sector 3B, Rohini, Delhi","283","nullVijay Marg, Block B, Baljit Nagar, Patel Nagar, New Delhi","11/4/2016 - 11/4/2016, Every day, AM Peak",1807,1465,2228