"Origin Movement ID","Origin Display Name","Destination Movement ID","Destination Display Name","Date Range","Mean Travel Time (Seconds)","Range - Lower Bound Travel Time (Seconds)","Range - Upper Bound Travel Time (Seconds)"
"128","0 Shakti Mandir Marg, Block 10, Shakti Nagar, Delhi","3","Unnamed Road, Mahipalpur, New Delhi","11/8/2016 - 11/8/2016, Every day, AM Peak",2895,2341,3578
"128","0 Shakti Mandir Marg, Block 10, Shakti Nagar, Delhi","4","P-268/3, Rock View, Delhi Cantonment, Delhi","11/8/2016 - 11/8/2016, Every day, AM Peak",2989,2490,3586
"128","0 Shakti Mandir Marg, Block 10, Shakti Nagar, Delhi","5","Old Palam Road, Delhi Cantonment, New Delhi","11/8/2016 - 11/8/2016, Every day, AM Peak",3157,2675,3725
"128","0 Shakti Mandir Marg, Block 10, Shakti Nagar, Delhi","8","Mall Road, Khyber Lines, Delhi Cantonment, New Delhi","11/8/2016 - 11/8/2016, Every day, AM Peak",2310,1721,3100
"128","0 Shakti Mandir Marg, Block 10, Shakti Nagar, Delhi","9","Mahatma Jyothi Rao Phule Marg, Mahatma Jyoti Rao Phule Marg Area, New Delhi","11/8/2016 - 11/8/2016, Every day, AM Peak",2167,1707,2750
"128","0 Shakti Mandir Marg, Block 10, Shakti Nagar, Delhi","10","0 Shaheed Bhagat Singh Marg, DIZ Staff Quarters, Connaught Place, New Delhi","11/8/2016 - 11/8/2016, Every day, AM Peak",1515,1155,1986
"128","0 Shakti Mandir Marg, Block 10, Shakti Nagar, Delhi","11","Mother Teresa Crescent, Talkatora Garden, Central Ridge Reserve Forest, New Delhi","11/8/2016 - 11/8/2016, Every day, AM Peak",1621,1162,2261
"128","0 Shakti Mandir Marg, Block 10, Shakti Nagar, Delhi","12","Jantar Mantar Road, Janpath, Connaught Place, New Delhi","11/8/2016 - 11/8/2016, Every day, AM Peak",1711,1383,2115
"128","0 Shakti Mandir Marg, Block 10, Shakti Nagar, Delhi","13","10, Aurangzeb Road, New Delhi","11/8/2016 - 11/8/2016, Every day, AM Peak",2214,1717,2854
"128","0 Shakti Mandir Marg, Block 10, Shakti Nagar, Delhi","14","Mahatma Gandhi Road, Kidwai Nagar West, Kidwai Nagar, New Delhi","11/8/2016 - 11/8/2016, Every day, AM Peak",2391,1930,2961
"128","0 Shakti Mandir Marg, Block 10, Shakti Nagar, Delhi","16","Andre Malraux Marg, Ramnagar, Chanakyapuri, New Delhi","11/8/2016 - 11/8/2016, Every day, AM Peak",2105,1573,2816
"128","0 Shakti Mandir Marg, Block 10, Shakti Nagar, Delhi","17","0 Khanna Market Road, Aliganj, Lodi Colony, New Delhi","11/8/2016 - 11/8/2016, Every day, AM Peak",2131,1715,2646
"128","0 Shakti Mandir Marg, Block 10, Shakti Nagar, Delhi","18","Unnamed Road, Lal Qila, Chandni Chowk, New Delhi","11/8/2016 - 11/8/2016, Every day, AM Peak",1407,1088,1818
"128","0 Shakti Mandir Marg, Block 10, Shakti Nagar, Delhi","19","Mirdard Road, 64 Khamba, Maulana Azad Medical College Campus, New Delhi","11/8/2016 - 11/8/2016, Every day, AM Peak",2293,1799,2921
"128","0 Shakti Mandir Marg, Block 10, Shakti Nagar, Delhi","25","nullNehru Vihar Road, B Block, A Block, Nehru Vihar, Mukherjee Nagar, Delhi","11/8/2016 - 11/8/2016, Every day, AM Peak",1169,775,1761
"128","0 Shakti Mandir Marg, Block 10, Shakti Nagar, Delhi","61","Unnamed Road, National Zoological Park, Sundar Nagar, New Delhi","11/8/2016 - 11/8/2016, Every day, AM Peak",2285,1914,2726
"128","0 Shakti Mandir Marg, Block 10, Shakti Nagar, Delhi","63","Jawaharlal Nehru Stadium Marg, CGO Complex, Pragati Vihar, New Delhi","11/8/2016 - 11/8/2016, Every day, AM Peak",2661,2444,2896
"128","0 Shakti Mandir Marg, Block 10, Shakti Nagar, Delhi","64","6/37, Vikram Vihar, Lajpat Nagar IV, Lajpat Nagar, New Delhi","11/8/2016 - 11/8/2016, Every day, AM Peak",2802,2618,2998
"128","0 Shakti Mandir Marg, Block 10, Shakti Nagar, Delhi","65","Shaheed Jeet Singh Marg, NCERT Campus, Qutab Institutional Area, New Delhi","11/8/2016 - 11/8/2016, Every day, AM Peak",2958,2374,3685
"128","0 Shakti Mandir Marg, Block 10, Shakti Nagar, Delhi","67","63/33, Hudco Place, Andrews Ganj Extension, Andrews Ganj, New Delhi","11/8/2016 - 11/8/2016, Every day, AM Peak",2842,2624,3077
"128","0 Shakti Mandir Marg, Block 10, Shakti Nagar, Delhi","70","G288, Sector 3, Block G, Nanak Pura, South Moti Bagh, New Delhi","11/8/2016 - 11/8/2016, Every day, AM Peak",2155,1635,2838
"128","0 Shakti Mandir Marg, Block 10, Shakti Nagar, Delhi","80","E-492, Block E, Greater Kailash II, Greater Kailash, New Delhi","11/8/2016 - 11/8/2016, Every day, AM Peak",3535,3288,3799
"128","0 Shakti Mandir Marg, Block 10, Shakti Nagar, Delhi","82","286, Asian Games Village Complex, Siri Fort, New Delhi","11/8/2016 - 11/8/2016, Every day, AM Peak",3159,2801,3562
"128","0 Shakti Mandir Marg, Block 10, Shakti Nagar, Delhi","83","C2, Block C, Kailash Colony, Greater Kailash, New Delhi","11/8/2016 - 11/8/2016, Every day, AM Peak",3004,2793,3230
"128","0 Shakti Mandir Marg, Block 10, Shakti Nagar, Delhi","100","Maharishi Balmiki Marg, Police Colony, Sarai Khalil, Sadar Bazaar, New Delhi","11/8/2016 - 11/8/2016, Every day, AM Peak",937,696,1260
"128","0 Shakti Mandir Marg, Block 10, Shakti Nagar, Delhi","101","4900 Ramdwara Road, Chuna Mandi, Aram Bagh, Paharganj, New Delhi","11/8/2016 - 11/8/2016, Every day, AM Peak",1311,1011,1698
"128","0 Shakti Mandir Marg, Block 10, Shakti Nagar, Delhi","103","nullDasghara Road, Dasghara, New Delhi","11/8/2016 - 11/8/2016, Every day, AM Peak",1639,1244,2158
"128","0 Shakti Mandir Marg, Block 10, Shakti Nagar, Delhi","121","22/55, West Punjabi Bagh, Punjabi Bagh, Delhi","11/8/2016 - 11/8/2016, Every day, AM Peak",1752,1333,2302
"128","0 Shakti Mandir Marg, Block 10, Shakti Nagar, Delhi","123","Loknath Marg, Block M, Kirti Nagar, New Delhi","11/8/2016 - 11/8/2016, Every day, AM Peak",1185,868,1617
"128","0 Shakti Mandir Marg, Block 10, Shakti Nagar, Delhi","124","30, 31, Block B, Mansarover Garden, New Delhi","11/8/2016 - 11/8/2016, Every day, AM Peak",2063,1233,3450
"128","0 Shakti Mandir Marg, Block 10, Shakti Nagar, Delhi","126","nullSwami Narayan Underpass Road, Block E, Sangam Park, Ashok Vihar, Delhi","11/8/2016 - 11/8/2016, Every day, AM Peak",636,437,923
"128","0 Shakti Mandir Marg, Block 10, Shakti Nagar, Delhi","127","NDPL House, Lala Achintaram Marg, Block B, Gujranwala Town, Delhi","11/8/2016 - 11/8/2016, Every day, AM Peak",635,387,1040
"128","0 Shakti Mandir Marg, Block 10, Shakti Nagar, Delhi","129","Gali Number 8, Anand Parbat, New Delhi","11/8/2016 - 11/8/2016, Every day, AM Peak",483,276,843
"128","0 Shakti Mandir Marg, Block 10, Shakti Nagar, Delhi","130","Bhagat Singh Marg, Kashmiri Bagh, Chandra Shekhar Azad Colony, Sarai Rohilla, New Delhi","11/8/2016 - 11/8/2016, Every day, AM Peak",242,106,550
"128","0 Shakti Mandir Marg, Block 10, Shakti Nagar, Delhi","131","4400 Gali Bahuji, Pahari Dhiraj, Sadar Bazaar, Delhi","11/8/2016 - 11/8/2016, Every day, AM Peak",552,353,861
"128","0 Shakti Mandir Marg, Block 10, Shakti Nagar, Delhi","132","1600 Lothian Road, Chabi Ganj, Kashmere Gate, New Delhi","11/8/2016 - 11/8/2016, Every day, AM Peak",1045,708,1541
"128","0 Shakti Mandir Marg, Block 10, Shakti Nagar, Delhi","133","0 Raj Niwas Marg, Ludlow Castle, Civil Lines, Delhi","11/8/2016 - 11/8/2016, Every day, AM Peak",726,426,1234
"128","0 Shakti Mandir Marg, Block 10, Shakti Nagar, Delhi","134","Hotel de Romana, Kasturba Hospital Marg, Kalan Mahal, Old Delhi, New Delhi","11/8/2016 - 11/8/2016, Every day, AM Peak",1708,1489,1958
"128","0 Shakti Mandir Marg, Block 10, Shakti Nagar, Delhi","148","Unnamed Road, Patparganj, New Delhi","11/8/2016 - 11/8/2016, Every day, AM Peak",2255,1733,2933
"128","0 Shakti Mandir Marg, Block 10, Shakti Nagar, Delhi","155","Maharaja Agaersen Road, Block D, Pocket D, Phase 1, Ashok Vihar, Delhi","11/8/2016 - 11/8/2016, Every day, AM Peak",1094,652,1833
"128","0 Shakti Mandir Marg, Block 10, Shakti Nagar, Delhi","156","Doctor Satpal Sachdeva Marg, Keshav Puram, Tri Nagar, Delhi","11/8/2016 - 11/8/2016, Every day, AM Peak",817,401,1660
"128","0 Shakti Mandir Marg, Block 10, Shakti Nagar, Delhi","157","CH Devender Singh Tewatia Marg, Ashok Vihar II, Pocket B 1, Phase 3, Ashok Vihar, Delhi","11/8/2016 - 11/8/2016, Every day, AM Peak",330,164,661
"128","0 Shakti Mandir Marg, Block 10, Shakti Nagar, Delhi","158","484, Block E, Nimri Colony, Ashok Vihar, Delhi","11/8/2016 - 11/8/2016, Every day, AM Peak",456,174,1194
"128","0 Shakti Mandir Marg, Block 10, Shakti Nagar, Delhi","159","300 Maharishi Balmiki Mandir Marg, Block H, Shakurpur Colony, Pitampura, Delhi","11/8/2016 - 11/8/2016, Every day, AM Peak",1269,995,1617
"128","0 Shakti Mandir Marg, Block 10, Shakti Nagar, Delhi","161","nullLawrence Road, Rampura Industrial Area, Tri Nagar, Delhi","11/8/2016 - 11/8/2016, Every day, AM Peak",1534,1071,2197
"128","0 Shakti Mandir Marg, Block 10, Shakti Nagar, Delhi","162","2400 Pt Govind Ram Shastri Marg, Ganeshpura, Tri Nagar, Delhi","11/8/2016 - 11/8/2016, Every day, AM Peak",949,644,1396
"128","0 Shakti Mandir Marg, Block 10, Shakti Nagar, Delhi","170","nullColony Road, Block QP, Poorvi Pitampura, Pitampura, Delhi","11/8/2016 - 11/8/2016, Every day, AM Peak",1313,999,1725
"128","0 Shakti Mandir Marg, Block 10, Shakti Nagar, Delhi","188","12/188, Shastri Nagar, Geeta Colony, New Delhi","11/8/2016 - 11/8/2016, Every day, AM Peak",1570,1227,2007
"128","0 Shakti Mandir Marg, Block 10, Shakti Nagar, Delhi","189","F22, Block F, Krishna Nagar, Delhi","11/8/2016 - 11/8/2016, Every day, AM Peak",1414,1122,1781
"128","0 Shakti Mandir Marg, Block 10, Shakti Nagar, Delhi","193","Unnamed Road, Usmanpur, Shahdara, Delhi","11/8/2016 - 11/8/2016, Every day, AM Peak",1468,999,2155
"128","0 Shakti Mandir Marg, Block 10, Shakti Nagar, Delhi","199","0 Shivaji Marg, New Moti Nagar, Najafgarh Road Industrial Area, Delhi","11/8/2016 - 11/8/2016, Every day, AM Peak",989,706,1384
"128","0 Shakti Mandir Marg, Block 10, Shakti Nagar, Delhi","204","0 East Patel Nagar Road, Block 10A, East Patel Nagar, Patel Nagar, New Delhi","11/8/2016 - 11/8/2016, Every day, AM Peak",821,426,1580
"128","0 Shakti Mandir Marg, Block 10, Shakti Nagar, Delhi","206","0 Arya Samaj Road, Block 12B, Dev Nagar, Karol Bagh, New Delhi","11/8/2016 - 11/8/2016, Every day, AM Peak",883,588,1325
"128","0 Shakti Mandir Marg, Block 10, Shakti Nagar, Delhi","207","0 Maharana Pratap Road, Block 53, Karol Bagh, New Delhi","11/8/2016 - 11/8/2016, Every day, AM Peak",749,491,1142
"128","0 Shakti Mandir Marg, Block 10, Shakti Nagar, Delhi","208","Desh Bandhu Gupta Road, Block E, Jhandewalan Extension, Jhandewalan, New Delhi","11/8/2016 - 11/8/2016, Every day, AM Peak",1062,779,1446
"128","0 Shakti Mandir Marg, Block 10, Shakti Nagar, Delhi","209","nullMaharaja Agarsen Marg, Block A, CC Colony, Kalyan Vihar, नई दिल्ली","11/8/2016 - 11/8/2016, Every day, AM Peak",272,113,649
"128","0 Shakti Mandir Marg, Block 10, Shakti Nagar, Delhi","214","Doctor Bhim Rao Ambedkar Marg, Block H, Malka Ganj, Delhi","11/8/2016 - 11/8/2016, Every day, AM Peak",378,188,757
"128","0 Shakti Mandir Marg, Block 10, Shakti Nagar, Delhi","222","Sector E, Mahipalpur Village, Vasant Kunj, New Delhi","11/8/2016 - 11/8/2016, Every day, AM Peak",3744,3100,4521
"128","0 Shakti Mandir Marg, Block 10, Shakti Nagar, Delhi","223","Urban Extension Road II, Indira Gandhi International Airport, New Delhi","11/8/2016 - 11/8/2016, Every day, AM Peak",3975,3332,4741
"128","0 Shakti Mandir Marg, Block 10, Shakti Nagar, Delhi","225","0 Netaji Road, A Block, Block C, Adarsh Nagar, Delhi","11/8/2016 - 11/8/2016, Every day, AM Peak",1274,853,1900
"128","0 Shakti Mandir Marg, Block 10, Shakti Nagar, Delhi","227","300 Lok Marg, Dhaka Colony, Mukherjee Nagar, Delhi","11/8/2016 - 11/8/2016, Every day, AM Peak",401,156,1026
"128","0 Shakti Mandir Marg, Block 10, Shakti Nagar, Delhi","228","0 Lucknow Road, Banarsi Das Estate, Timarpur, Delhi","11/8/2016 - 11/8/2016, Every day, AM Peak",387,133,1125
"128","0 Shakti Mandir Marg, Block 10, Shakti Nagar, Delhi","229","200 Road Number 28, Nehru Nagar, Shivaji Place, Basai Dara pur, Tagore Garden Extension, New Delhi","11/8/2016 - 11/8/2016, Every day, AM Peak",1865,1195,2909
"128","0 Shakti Mandir Marg, Block 10, Shakti Nagar, Delhi","231","G-17/6, Block G, Rajouri Garden, New Delhi","11/8/2016 - 11/8/2016, Every day, AM Peak",1759,1143,2704
"128","0 Shakti Mandir Marg, Block 10, Shakti Nagar, Delhi","244","Dhingra Park Trail, Punjabi Bagh Cooperative Housing Soceity, East Punjabi Bagh, Punjabi Bagh, Delhi","11/8/2016 - 11/8/2016, Every day, AM Peak",1575,1123,2208
"128","0 Shakti Mandir Marg, Block 10, Shakti Nagar, Delhi","246","nullShiv Mandir Marg, Block G, Lajpat Nagar I, Lajpat Nagar, New Delhi","11/8/2016 - 11/8/2016, Every day, AM Peak",2785,2542,3050
"128","0 Shakti Mandir Marg, Block 10, Shakti Nagar, Delhi","248","Unnamed Road, Harijan Basti, Rajokri, New Delhi","11/8/2016 - 11/8/2016, Every day, AM Peak",4074,3382,4907
"128","0 Shakti Mandir Marg, Block 10, Shakti Nagar, Delhi","251","A25, Block R, Pocket A, Rajender Nagar Part 1, New Rajinder Nagar, New Delhi","11/8/2016 - 11/8/2016, Every day, AM Peak",1308,915,1868
"128","0 Shakti Mandir Marg, Block 10, Shakti Nagar, Delhi","253","0 Chaudhary Harsukh Marg, B6, Block B6, Humayunpur, Safdarjung Enclave, New Delhi","11/8/2016 - 11/8/2016, Every day, AM Peak",2409,1972,2941
"128","0 Shakti Mandir Marg, Block 10, Shakti Nagar, Delhi","254","Squadron Leader Mohinder Kumar Jain Marg, Block B, New Delhi","11/8/2016 - 11/8/2016, Every day, AM Peak",2834,2239,3585
"128","0 Shakti Mandir Marg, Block 10, Shakti Nagar, Delhi","255","1700 Uday Chand Marg, Arya Basti, Zafar Nagar, Kotla Mubarakpur, South Extension I, New Delhi","11/8/2016 - 11/8/2016, Every day, AM Peak",2224,1790,2761
"128","0 Shakti Mandir Marg, Block 10, Shakti Nagar, Delhi","263","200 Pirwali Gali, Block P, Block P, Patparganj, New Delhi","11/8/2016 - 11/8/2016, Every day, AM Peak",2096,1591,2761
"128","0 Shakti Mandir Marg, Block 10, Shakti Nagar, Delhi","264","Noida Link Road, Nehru Enclave, Shakarpur Khas, New Delhi","11/8/2016 - 11/8/2016, Every day, AM Peak",1995,1475,2697
"128","0 Shakti Mandir Marg, Block 10, Shakti Nagar, Delhi","265","0 Lane Number 8, Krishan Kunj Extension Part 2, Block G, Vishwakarma Park, Laxmi Nagar, Delhi","11/8/2016 - 11/8/2016, Every day, AM Peak",1857,1358,2537
"128","0 Shakti Mandir Marg, Block 10, Shakti Nagar, Delhi","267","nullPanduk Shila Marg, Kaithwara Jagjivan Nagar, New Usmanpur, Shahdara, Delhi","11/8/2016 - 11/8/2016, Every day, AM Peak",1082,765,1529
"128","0 Shakti Mandir Marg, Block 10, Shakti Nagar, Delhi","282","Velodrome Road, Gandhi Smriti, Raj Ghat, New Delhi","11/8/2016 - 11/8/2016, Every day, AM Peak",1914,1505,2433
"128","0 Shakti Mandir Marg, Block 10, Shakti Nagar, Delhi","287","L47, Block L, Shastri Nagar, Delhi","11/8/2016 - 11/8/2016, Every day, AM Peak",272,123,597