"Origin Movement ID","Origin Display Name","Destination Movement ID","Destination Display Name","Date Range","Mean Travel Time (Seconds)","Range - Lower Bound Travel Time (Seconds)","Range - Upper Bound Travel Time (Seconds)"
"169","G-9, Block F 1U, Ranikhet, Pitampura, Delhi","1","300 Ring Road, Block CB, Naraina Village, Naraina, New Delhi","11/6/2016 - 11/6/2016, Every day, AM Peak",1210,895,1635
"169","G-9, Block F 1U, Ranikhet, Pitampura, Delhi","2","Unnamed Road, Delhi Cantonment, New Delhi","11/6/2016 - 11/6/2016, Every day, AM Peak",1304,1039,1635
"169","G-9, Block F 1U, Ranikhet, Pitampura, Delhi","3","Unnamed Road, Mahipalpur, New Delhi","11/6/2016 - 11/6/2016, Every day, AM Peak",1821,1456,2276
"169","G-9, Block F 1U, Ranikhet, Pitampura, Delhi","4","P-268/3, Rock View, Delhi Cantonment, Delhi","11/6/2016 - 11/6/2016, Every day, AM Peak",1721,1439,2057
"169","G-9, Block F 1U, Ranikhet, Pitampura, Delhi","5","Old Palam Road, Delhi Cantonment, New Delhi","11/6/2016 - 11/6/2016, Every day, AM Peak",2113,1633,2733
"169","G-9, Block F 1U, Ranikhet, Pitampura, Delhi","8","Mall Road, Khyber Lines, Delhi Cantonment, New Delhi","11/6/2016 - 11/6/2016, Every day, AM Peak",1528,1208,1932
"169","G-9, Block F 1U, Ranikhet, Pitampura, Delhi","10","0 Shaheed Bhagat Singh Marg, DIZ Staff Quarters, Connaught Place, New Delhi","11/6/2016 - 11/6/2016, Every day, AM Peak",1938,1609,2333
"169","G-9, Block F 1U, Ranikhet, Pitampura, Delhi","11","Mother Teresa Crescent, Talkatora Garden, Central Ridge Reserve Forest, New Delhi","11/6/2016 - 11/6/2016, Every day, AM Peak",1603,1317,1949
"169","G-9, Block F 1U, Ranikhet, Pitampura, Delhi","14","Mahatma Gandhi Road, Kidwai Nagar West, Kidwai Nagar, New Delhi","11/6/2016 - 11/6/2016, Every day, AM Peak",2131,1671,2716
"169","G-9, Block F 1U, Ranikhet, Pitampura, Delhi","16","Andre Malraux Marg, Ramnagar, Chanakyapuri, New Delhi","11/6/2016 - 11/6/2016, Every day, AM Peak",1645,1258,2150
"169","G-9, Block F 1U, Ranikhet, Pitampura, Delhi","24","268, Block B2, Shiv Nagar, Janakpuri, New Delhi","11/6/2016 - 11/6/2016, Every day, AM Peak",892,711,1118
"169","G-9, Block F 1U, Ranikhet, Pitampura, Delhi","25","nullNehru Vihar Road, B Block, A Block, Nehru Vihar, Mukherjee Nagar, Delhi","11/6/2016 - 11/6/2016, Every day, AM Peak",608,514,718
"169","G-9, Block F 1U, Ranikhet, Pitampura, Delhi","26","A3-214, Asalatpur Village, Janakpuri, Delhi","11/6/2016 - 11/6/2016, Every day, AM Peak",1053,713,1553
"169","G-9, Block F 1U, Ranikhet, Pitampura, Delhi","27","0 Ram Mandir Marg, C5B Block, Janakpuri, New Delhi","11/6/2016 - 11/6/2016, Every day, AM Peak",984,885,1093
"169","G-9, Block F 1U, Ranikhet, Pitampura, Delhi","28","nullSchool Road, Block M, Uttam Nagar, Delhi","11/6/2016 - 11/6/2016, Every day, AM Peak",1913,1075,3403
"169","G-9, Block F 1U, Ranikhet, Pitampura, Delhi","29","Street Number 14, Block C, Sitapuri Part 1, Janakpuri, New Delhi","11/6/2016 - 11/6/2016, Every day, AM Peak",1582,936,2673
"169","G-9, Block F 1U, Ranikhet, Pitampura, Delhi","32","METRO MALL, Pocket 1, Sector 14 Dwarka, Dwarka, New Delhi","11/6/2016 - 11/6/2016, Every day, AM Peak",2076,1572,2741
"169","G-9, Block F 1U, Ranikhet, Pitampura, Delhi","61","Unnamed Road, National Zoological Park, Sundar Nagar, New Delhi","11/6/2016 - 11/6/2016, Every day, AM Peak",1958,1544,2481
"169","G-9, Block F 1U, Ranikhet, Pitampura, Delhi","70","G288, Sector 3, Block G, Nanak Pura, South Moti Bagh, New Delhi","11/6/2016 - 11/6/2016, Every day, AM Peak",1618,1229,2129
"169","G-9, Block F 1U, Ranikhet, Pitampura, Delhi","100","Maharishi Balmiki Marg, Police Colony, Sarai Khalil, Sadar Bazaar, New Delhi","11/6/2016 - 11/6/2016, Every day, AM Peak",1836,1388,2428
"169","G-9, Block F 1U, Ranikhet, Pitampura, Delhi","101","4900 Ramdwara Road, Chuna Mandi, Aram Bagh, Paharganj, New Delhi","11/6/2016 - 11/6/2016, Every day, AM Peak",1986,1523,2589
"169","G-9, Block F 1U, Ranikhet, Pitampura, Delhi","103","nullDasghara Road, Dasghara, New Delhi","11/6/2016 - 11/6/2016, Every day, AM Peak",1006,815,1241
"169","G-9, Block F 1U, Ranikhet, Pitampura, Delhi","105","nullGoswami Girdhari Lal Marg, Industrial Area Phase I, Block C, Naraina Industrial Area Phase 1, Naraina, New Delhi","11/6/2016 - 11/6/2016, Every day, AM Peak",1143,877,1489
"169","G-9, Block F 1U, Ranikhet, Pitampura, Delhi","121","22/55, West Punjabi Bagh, Punjabi Bagh, Delhi","11/6/2016 - 11/6/2016, Every day, AM Peak",753,569,995
"169","G-9, Block F 1U, Ranikhet, Pitampura, Delhi","122","2600 Mandir Wali Gali, Ranjeet Nagar, Shadipur, Delhi","11/6/2016 - 11/6/2016, Every day, AM Peak",1014,829,1239
"169","G-9, Block F 1U, Ranikhet, Pitampura, Delhi","123","Loknath Marg, Block M, Kirti Nagar, New Delhi","11/6/2016 - 11/6/2016, Every day, AM Peak",794,659,956
"169","G-9, Block F 1U, Ranikhet, Pitampura, Delhi","124","30, 31, Block B, Mansarover Garden, New Delhi","11/6/2016 - 11/6/2016, Every day, AM Peak",1009,754,1349
"169","G-9, Block F 1U, Ranikhet, Pitampura, Delhi","127","NDPL House, Lala Achintaram Marg, Block B, Gujranwala Town, Delhi","11/6/2016 - 11/6/2016, Every day, AM Peak",1241,866,1777
"169","G-9, Block F 1U, Ranikhet, Pitampura, Delhi","129","Gali Number 8, Anand Parbat, New Delhi","11/6/2016 - 11/6/2016, Every day, AM Peak",1147,843,1560
"169","G-9, Block F 1U, Ranikhet, Pitampura, Delhi","132","1600 Lothian Road, Chabi Ganj, Kashmere Gate, New Delhi","11/6/2016 - 11/6/2016, Every day, AM Peak",1125,873,1449
"169","G-9, Block F 1U, Ranikhet, Pitampura, Delhi","133","0 Raj Niwas Marg, Ludlow Castle, Civil Lines, Delhi","11/6/2016 - 11/6/2016, Every day, AM Peak",938,669,1314
"169","G-9, Block F 1U, Ranikhet, Pitampura, Delhi","136","nullKeshopur Road, New Chaukhandi, Paschim Vihar, Delhi","11/6/2016 - 11/6/2016, Every day, AM Peak",710,537,937
"169","G-9, Block F 1U, Ranikhet, Pitampura, Delhi","137","nullRoad Number 235, Block H, Vikaspuri, Delhi","11/6/2016 - 11/6/2016, Every day, AM Peak",801,558,1148
"169","G-9, Block F 1U, Ranikhet, Pitampura, Delhi","139","nullBudh Bazar Road, Nawada, Nawada Majra Village, Nawada, Delhi","11/6/2016 - 11/6/2016, Every day, AM Peak",1904,1362,2660
"169","G-9, Block F 1U, Ranikhet, Pitampura, Delhi","140","A12/B, Sainik Nagar, Mansa Ram Park, Uttam Nagar, Delhi","11/6/2016 - 11/6/2016, Every day, AM Peak",1848,1304,2618
"169","G-9, Block F 1U, Ranikhet, Pitampura, Delhi","142","Gali Number 1, Dabri Village, Dabri, New Delhi","11/6/2016 - 11/6/2016, Every day, AM Peak",1145,970,1350
"169","G-9, Block F 1U, Ranikhet, Pitampura, Delhi","143","nullRoad Number 221, Pocket 1, Sector 10 Dwarka, Dwarka, Delhi","11/6/2016 - 11/6/2016, Every day, AM Peak",1862,1428,2427
"169","G-9, Block F 1U, Ranikhet, Pitampura, Delhi","146","nullKotla Road, Pocket F2, Pocket 1, Sector 11F, Rohini, Delhi","11/6/2016 - 11/6/2016, Every day, AM Peak",523,398,687
"169","G-9, Block F 1U, Ranikhet, Pitampura, Delhi","148","Unnamed Road, Patparganj, New Delhi","11/6/2016 - 11/6/2016, Every day, AM Peak",1919,1658,2220
"169","G-9, Block F 1U, Ranikhet, Pitampura, Delhi","155","Maharaja Agaersen Road, Block D, Pocket D, Phase 1, Ashok Vihar, Delhi","11/6/2016 - 11/6/2016, Every day, AM Peak",952,431,2099
"169","G-9, Block F 1U, Ranikhet, Pitampura, Delhi","156","Doctor Satpal Sachdeva Marg, Keshav Puram, Tri Nagar, Delhi","11/6/2016 - 11/6/2016, Every day, AM Peak",540,337,864
"169","G-9, Block F 1U, Ranikhet, Pitampura, Delhi","159","300 Maharishi Balmiki Mandir Marg, Block H, Shakurpur Colony, Pitampura, Delhi","11/6/2016 - 11/6/2016, Every day, AM Peak",542,304,963
"169","G-9, Block F 1U, Ranikhet, Pitampura, Delhi","160","23, Shiva Enclave, Pitampura, Delhi","11/6/2016 - 11/6/2016, Every day, AM Peak",225,114,442
"169","G-9, Block F 1U, Ranikhet, Pitampura, Delhi","161","nullLawrence Road, Rampura Industrial Area, Tri Nagar, Delhi","11/6/2016 - 11/6/2016, Every day, AM Peak",627,428,918
"169","G-9, Block F 1U, Ranikhet, Pitampura, Delhi","162","2400 Pt Govind Ram Shastri Marg, Ganeshpura, Tri Nagar, Delhi","11/6/2016 - 11/6/2016, Every day, AM Peak",880,566,1366
"169","G-9, Block F 1U, Ranikhet, Pitampura, Delhi","163","0 Guru Harkishan Marg, Maulana Azad Society, Bhagwan Buddha Housing Corporation Society, Pitampura, Delhi","11/6/2016 - 11/6/2016, Every day, AM Peak",311,214,451
"169","G-9, Block F 1U, Ranikhet, Pitampura, Delhi","164","Shakurbasti Pedestrian Foot Over Bridge, Shakur Basti Railway Colony, Railway Colony South, Pitampura, Delhi","11/6/2016 - 11/6/2016, Every day, AM Peak",651,483,877
"169","G-9, Block F 1U, Ranikhet, Pitampura, Delhi","165","31, Cottage Enclave, Paschim Vihar, Delhi","11/6/2016 - 11/6/2016, Every day, AM Peak",456,329,630
"169","G-9, Block F 1U, Ranikhet, Pitampura, Delhi","166","nullRBI Enclave Road, Ankur Enclave, Paschim Vihar, Delhi","11/6/2016 - 11/6/2016, Every day, AM Peak",601,357,1009
"169","G-9, Block F 1U, Ranikhet, Pitampura, Delhi","167","nullShaheed Udham Singh Marg, AE Block, Poorbi Shalimar Bag, Shalimar Bagh, Delhi","11/6/2016 - 11/6/2016, Every day, AM Peak",806,481,1348
"169","G-9, Block F 1U, Ranikhet, Pitampura, Delhi","168","nullGyan Shakti Mandir Marg, Block BA, West Shalimar Bagh, Shalimar Bagh, Delhi","11/6/2016 - 11/6/2016, Every day, AM Peak",315,189,522
"169","G-9, Block F 1U, Ranikhet, Pitampura, Delhi","170","nullColony Road, Block QP, Poorvi Pitampura, Pitampura, Delhi","11/6/2016 - 11/6/2016, Every day, AM Peak",220,117,411
"169","G-9, Block F 1U, Ranikhet, Pitampura, Delhi","171","nullG Block Road, Pocket 21, Sector 7G, Rohini, Delhi","11/6/2016 - 11/6/2016, Every day, AM Peak",466,276,784
"169","G-9, Block F 1U, Ranikhet, Pitampura, Delhi","172","nullShiva Road, Pocket 14, Sector 8D, Rohini, Delhi","11/6/2016 - 11/6/2016, Every day, AM Peak",152,71,321
"169","G-9, Block F 1U, Ranikhet, Pitampura, Delhi","173","Unnamed Road, Swarn Jayanti Park, Sector 10, Rohini, Delhi","11/6/2016 - 11/6/2016, Every day, AM Peak",356,228,555
"169","G-9, Block F 1U, Ranikhet, Pitampura, Delhi","175","235, Block E, Block E, Mangolpuri, Delhi","11/6/2016 - 11/6/2016, Every day, AM Peak",394,290,533
"169","G-9, Block F 1U, Ranikhet, Pitampura, Delhi","176","B7-187, Pocket 7, Sector 3B, Rohini, Delhi","11/6/2016 - 11/6/2016, Every day, AM Peak",438,262,731
"169","G-9, Block F 1U, Ranikhet, Pitampura, Delhi","178","I334, Saini Mohalla, Shiv Vihar, Nangloi, Delhi","11/6/2016 - 11/6/2016, Every day, AM Peak",2068,930,4597
"169","G-9, Block F 1U, Ranikhet, Pitampura, Delhi","179","0 AB Road, Block RR, Mianwali Nagar, Paschim Vihar, Delhi","11/6/2016 - 11/6/2016, Every day, AM Peak",1508,651,3490
"169","G-9, Block F 1U, Ranikhet, Pitampura, Delhi","186","14, Sector 21, Rohini, Delhi","11/6/2016 - 11/6/2016, Every day, AM Peak",1170,923,1482
"169","G-9, Block F 1U, Ranikhet, Pitampura, Delhi","188","12/188, Shastri Nagar, Geeta Colony, New Delhi","11/6/2016 - 11/6/2016, Every day, AM Peak",1363,1259,1474
"169","G-9, Block F 1U, Ranikhet, Pitampura, Delhi","189","F22, Block F, Krishna Nagar, Delhi","11/6/2016 - 11/6/2016, Every day, AM Peak",1326,1224,1435
"169","G-9, Block F 1U, Ranikhet, Pitampura, Delhi","191","0 Hasanpur, I.P.Extension, Patparganj, Delhi","11/6/2016 - 11/6/2016, Every day, AM Peak",2262,1869,2736
"169","G-9, Block F 1U, Ranikhet, Pitampura, Delhi","193","Unnamed Road, Usmanpur, Shahdara, Delhi","11/6/2016 - 11/6/2016, Every day, AM Peak",1370,1035,1812
"169","G-9, Block F 1U, Ranikhet, Pitampura, Delhi","196","nullSir Chotu Ram Marg, Pocket 4, Sector 6C, Rohini, Delhi","11/6/2016 - 11/6/2016, Every day, AM Peak",589,451,768
"169","G-9, Block F 1U, Ranikhet, Pitampura, Delhi","199","0 Shivaji Marg, New Moti Nagar, Najafgarh Road Industrial Area, Delhi","11/6/2016 - 11/6/2016, Every day, AM Peak",772,681,874
"169","G-9, Block F 1U, Ranikhet, Pitampura, Delhi","200","Dabri - Gurgaon Road, Pocket 2, Sector 1 Dwarka, Dwarka, New Delhi","11/6/2016 - 11/6/2016, Every day, AM Peak",1668,1159,2400
"169","G-9, Block F 1U, Ranikhet, Pitampura, Delhi","204","0 East Patel Nagar Road, Block 10A, East Patel Nagar, Patel Nagar, New Delhi","11/6/2016 - 11/6/2016, Every day, AM Peak",1166,957,1420
"169","G-9, Block F 1U, Ranikhet, Pitampura, Delhi","205","2100 Gali Number 14, Block B, Prem Nagar, Patel Nagar, New Delhi","11/6/2016 - 11/6/2016, Every day, AM Peak",890,772,1025
"169","G-9, Block F 1U, Ranikhet, Pitampura, Delhi","207","0 Maharana Pratap Road, Block 53, Karol Bagh, New Delhi","11/6/2016 - 11/6/2016, Every day, AM Peak",1379,1066,1783
"169","G-9, Block F 1U, Ranikhet, Pitampura, Delhi","208","Desh Bandhu Gupta Road, Block E, Jhandewalan Extension, Jhandewalan, New Delhi","11/6/2016 - 11/6/2016, Every day, AM Peak",1775,1337,2355
"169","G-9, Block F 1U, Ranikhet, Pitampura, Delhi","211","Holambi Main Road, Iradat Nagar, Delhi","11/6/2016 - 11/6/2016, Every day, AM Peak",740,631,866
"169","G-9, Block F 1U, Ranikhet, Pitampura, Delhi","215","Unnamed Road, Bagiabad, Jharoda Majra Burari, Delhi","11/6/2016 - 11/6/2016, Every day, AM Peak",509,384,673
"169","G-9, Block F 1U, Ranikhet, Pitampura, Delhi","216","0 Main Canal Road, Harit Vihar, Mukandpur Part 2, Mukundpur, Delhi","11/6/2016 - 11/6/2016, Every day, AM Peak",362,306,427
"169","G-9, Block F 1U, Ranikhet, Pitampura, Delhi","218","nullTandoor Wali Gali, Swami Shraddhanand Park, Bhalswa Dairy, Jahangirpura, Delhi","11/6/2016 - 11/6/2016, Every day, AM Peak",215,147,314
"169","G-9, Block F 1U, Ranikhet, Pitampura, Delhi","219","461, Block AG, Sanjay Gandhi Transport Nagar, Delhi","11/6/2016 - 11/6/2016, Every day, AM Peak",117,63,216
"169","G-9, Block F 1U, Ranikhet, Pitampura, Delhi","221","Srinagar - Kanyakumari Highway, Bhalswa Jahangirpuri, Jahangirpuri, Delhi","11/6/2016 - 11/6/2016, Every day, AM Peak",268,121,592
"169","G-9, Block F 1U, Ranikhet, Pitampura, Delhi","222","Sector E, Mahipalpur Village, Vasant Kunj, New Delhi","11/6/2016 - 11/6/2016, Every day, AM Peak",2234,1675,2978
"169","G-9, Block F 1U, Ranikhet, Pitampura, Delhi","223","Urban Extension Road II, Indira Gandhi International Airport, New Delhi","11/6/2016 - 11/6/2016, Every day, AM Peak",2442,1908,3124
"169","G-9, Block F 1U, Ranikhet, Pitampura, Delhi","225","0 Netaji Road, A Block, Block C, Adarsh Nagar, Delhi","11/6/2016 - 11/6/2016, Every day, AM Peak",1012,603,1697
"169","G-9, Block F 1U, Ranikhet, Pitampura, Delhi","226","Unnamed Road, Model Town, Delhi","11/6/2016 - 11/6/2016, Every day, AM Peak",566,380,842
"169","G-9, Block F 1U, Ranikhet, Pitampura, Delhi","227","300 Lok Marg, Dhaka Colony, Mukherjee Nagar, Delhi","11/6/2016 - 11/6/2016, Every day, AM Peak",1397,922,2114
"169","G-9, Block F 1U, Ranikhet, Pitampura, Delhi","228","0 Lucknow Road, Banarsi Das Estate, Timarpur, Delhi","11/6/2016 - 11/6/2016, Every day, AM Peak",807,570,1140
"169","G-9, Block F 1U, Ranikhet, Pitampura, Delhi","229","200 Road Number 28, Nehru Nagar, Shivaji Place, Basai Dara pur, Tagore Garden Extension, New Delhi","11/6/2016 - 11/6/2016, Every day, AM Peak",863,646,1152
"169","G-9, Block F 1U, Ranikhet, Pitampura, Delhi","231","G-17/6, Block G, Rajouri Garden, New Delhi","11/6/2016 - 11/6/2016, Every day, AM Peak",943,743,1195
"169","G-9, Block F 1U, Ranikhet, Pitampura, Delhi","233","nullSatguru Ram Singh Marg, Block B, Mayapuri Industrial Area Phase I, Mayapuri, New Delhi","11/6/2016 - 11/6/2016, Every day, AM Peak",1166,851,1597
"169","G-9, Block F 1U, Ranikhet, Pitampura, Delhi","240","37, Sector 15, Pocket 6, Sector 15B, Rohini, Delhi","11/6/2016 - 11/6/2016, Every day, AM Peak",102,22,465
"169","G-9, Block F 1U, Ranikhet, Pitampura, Delhi","241","Foot Road, Libas Pur Village, Siraspur, Delhi","11/6/2016 - 11/6/2016, Every day, AM Peak",432,348,536
"169","G-9, Block F 1U, Ranikhet, Pitampura, Delhi","244","Dhingra Park Trail, Punjabi Bagh Cooperative Housing Soceity, East Punjabi Bagh, Punjabi Bagh, Delhi","11/6/2016 - 11/6/2016, Every day, AM Peak",693,514,933
"169","G-9, Block F 1U, Ranikhet, Pitampura, Delhi","245","N-1/17, Block M, Mangolpuri, Delhi","11/6/2016 - 11/6/2016, Every day, AM Peak",640,495,827
"169","G-9, Block F 1U, Ranikhet, Pitampura, Delhi","247","9/2082, Pocket 2, Block RZ, Palam Colony, New Delhi","11/6/2016 - 11/6/2016, Every day, AM Peak",2454,1614,3730
"169","G-9, Block F 1U, Ranikhet, Pitampura, Delhi","248","Unnamed Road, Harijan Basti, Rajokri, New Delhi","11/6/2016 - 11/6/2016, Every day, AM Peak",2436,1818,3263
"169","G-9, Block F 1U, Ranikhet, Pitampura, Delhi","251","A25, Block R, Pocket A, Rajender Nagar Part 1, New Rajinder Nagar, New Delhi","11/6/2016 - 11/6/2016, Every day, AM Peak",1447,1123,1863
"169","G-9, Block F 1U, Ranikhet, Pitampura, Delhi","252","813, Sector 1, RK Puram, New Delhi","11/6/2016 - 11/6/2016, Every day, AM Peak",2080,1560,2771
"169","G-9, Block F 1U, Ranikhet, Pitampura, Delhi","253","0 Chaudhary Harsukh Marg, B6, Block B6, Humayunpur, Safdarjung Enclave, New Delhi","11/6/2016 - 11/6/2016, Every day, AM Peak",2022,1662,2458
"169","G-9, Block F 1U, Ranikhet, Pitampura, Delhi","256","D-70, Mahavir Enclave I, Mahavir Enclave Part 2, Mahavir Enclave, New Delhi","11/6/2016 - 11/6/2016, Every day, AM Peak",1324,1090,1607
"169","G-9, Block F 1U, Ranikhet, Pitampura, Delhi","261","Nangli Ibrahimpur Road, Kadipur, Kushak Colony, Kadipur Village, Delhi","11/6/2016 - 11/6/2016, Every day, AM Peak",338,243,469
"169","G-9, Block F 1U, Ranikhet, Pitampura, Delhi","263","200 Pirwali Gali, Block P, Block P, Patparganj, New Delhi","11/6/2016 - 11/6/2016, Every day, AM Peak",1733,1569,1913
"169","G-9, Block F 1U, Ranikhet, Pitampura, Delhi","264","Noida Link Road, Nehru Enclave, Shakarpur Khas, New Delhi","11/6/2016 - 11/6/2016, Every day, AM Peak",1631,1496,1777
"169","G-9, Block F 1U, Ranikhet, Pitampura, Delhi","265","0 Lane Number 8, Krishan Kunj Extension Part 2, Block G, Vishwakarma Park, Laxmi Nagar, Delhi","11/6/2016 - 11/6/2016, Every day, AM Peak",1465,1347,1592
"169","G-9, Block F 1U, Ranikhet, Pitampura, Delhi","277","700 Outer Ring Road, Bhalswa Jahangir Village, Jahangirpuri, नई दिल्ली","11/6/2016 - 11/6/2016, Every day, AM Peak",235,187,294
"169","G-9, Block F 1U, Ranikhet, Pitampura, Delhi","279","Nightingale Road, Budella, Vikaspuri, Delhi","11/6/2016 - 11/6/2016, Every day, AM Peak",851,605,1196
"169","G-9, Block F 1U, Ranikhet, Pitampura, Delhi","280","nullHastsal Road, Block A2, JJ Colony, Uttam Nagar, Delhi","11/6/2016 - 11/6/2016, Every day, AM Peak",2041,1120,3718
"169","G-9, Block F 1U, Ranikhet, Pitampura, Delhi","281","D915, New Mahavir Nagar, Tilak Nagar, Delhi","11/6/2016 - 11/6/2016, Every day, AM Peak",907,621,1323
"169","G-9, Block F 1U, Ranikhet, Pitampura, Delhi","282","Velodrome Road, Gandhi Smriti, Raj Ghat, New Delhi","11/6/2016 - 11/6/2016, Every day, AM Peak",1666,1334,2080
"169","G-9, Block F 1U, Ranikhet, Pitampura, Delhi","283","nullVijay Marg, Block B, Baljit Nagar, Patel Nagar, New Delhi","11/6/2016 - 11/6/2016, Every day, AM Peak",871,745,1018
"169","G-9, Block F 1U, Ranikhet, Pitampura, Delhi","284","8/2, Rajendra Park, Nangloi Extension, Kamruddin Nagar, Delhi","11/6/2016 - 11/6/2016, Every day, AM Peak",2172,1017,4634
"169","G-9, Block F 1U, Ranikhet, Pitampura, Delhi","287","L47, Block L, Shastri Nagar, Delhi","11/6/2016 - 11/6/2016, Every day, AM Peak",1065,734,1543