"Origin Movement ID","Origin Display Name","Destination Movement ID","Destination Display Name","Date Range","Mean Travel Time (Seconds)","Range - Lower Bound Travel Time (Seconds)","Range - Upper Bound Travel Time (Seconds)"
"200","Dabri - Gurgaon Road, Pocket 2, Sector 1 Dwarka, Dwarka, New Delhi","2","Unnamed Road, Delhi Cantonment, New Delhi","9/1/2016 - 9/1/2016, Every day, AM Peak",1788,1361,2347
"200","Dabri - Gurgaon Road, Pocket 2, Sector 1 Dwarka, Dwarka, New Delhi","3","Unnamed Road, Mahipalpur, New Delhi","9/1/2016 - 9/1/2016, Every day, AM Peak",1731,1288,2325
"200","Dabri - Gurgaon Road, Pocket 2, Sector 1 Dwarka, Dwarka, New Delhi","4","P-268/3, Rock View, Delhi Cantonment, Delhi","9/1/2016 - 9/1/2016, Every day, AM Peak",1355,982,1868
"200","Dabri - Gurgaon Road, Pocket 2, Sector 1 Dwarka, Dwarka, New Delhi","5","Old Palam Road, Delhi Cantonment, New Delhi","9/1/2016 - 9/1/2016, Every day, AM Peak",1114,731,1696
"200","Dabri - Gurgaon Road, Pocket 2, Sector 1 Dwarka, Dwarka, New Delhi","6","Unnamed Road, CVD Line, Delhi Cantonment, New Delhi","9/1/2016 - 9/1/2016, Every day, AM Peak",1567,1200,2045
"200","Dabri - Gurgaon Road, Pocket 2, Sector 1 Dwarka, Dwarka, New Delhi","7","P 13, Baird Place, Delhi Cantonment, New Delhi","9/1/2016 - 9/1/2016, Every day, AM Peak",1532,1181,1986
"200","Dabri - Gurgaon Road, Pocket 2, Sector 1 Dwarka, Dwarka, New Delhi","8","Mall Road, Khyber Lines, Delhi Cantonment, New Delhi","9/1/2016 - 9/1/2016, Every day, AM Peak",1916,1477,2484
"200","Dabri - Gurgaon Road, Pocket 2, Sector 1 Dwarka, Dwarka, New Delhi","9","Mahatma Jyothi Rao Phule Marg, Mahatma Jyoti Rao Phule Marg Area, New Delhi","9/1/2016 - 9/1/2016, Every day, AM Peak",3347,2888,3878
"200","Dabri - Gurgaon Road, Pocket 2, Sector 1 Dwarka, Dwarka, New Delhi","10","0 Shaheed Bhagat Singh Marg, DIZ Staff Quarters, Connaught Place, New Delhi","9/1/2016 - 9/1/2016, Every day, AM Peak",2845,2409,3358
"200","Dabri - Gurgaon Road, Pocket 2, Sector 1 Dwarka, Dwarka, New Delhi","11","Mother Teresa Crescent, Talkatora Garden, Central Ridge Reserve Forest, New Delhi","9/1/2016 - 9/1/2016, Every day, AM Peak",2353,1944,2846
"200","Dabri - Gurgaon Road, Pocket 2, Sector 1 Dwarka, Dwarka, New Delhi","12","Jantar Mantar Road, Janpath, Connaught Place, New Delhi","9/1/2016 - 9/1/2016, Every day, AM Peak",3234,2524,4142
"200","Dabri - Gurgaon Road, Pocket 2, Sector 1 Dwarka, Dwarka, New Delhi","13","10, Aurangzeb Road, New Delhi","9/1/2016 - 9/1/2016, Every day, AM Peak",2833,2385,3364
"200","Dabri - Gurgaon Road, Pocket 2, Sector 1 Dwarka, Dwarka, New Delhi","14","Mahatma Gandhi Road, Kidwai Nagar West, Kidwai Nagar, New Delhi","9/1/2016 - 9/1/2016, Every day, AM Peak",2627,2125,3246
"200","Dabri - Gurgaon Road, Pocket 2, Sector 1 Dwarka, Dwarka, New Delhi","16","Andre Malraux Marg, Ramnagar, Chanakyapuri, New Delhi","9/1/2016 - 9/1/2016, Every day, AM Peak",2356,1946,2851
"200","Dabri - Gurgaon Road, Pocket 2, Sector 1 Dwarka, Dwarka, New Delhi","17","0 Khanna Market Road, Aliganj, Lodi Colony, New Delhi","9/1/2016 - 9/1/2016, Every day, AM Peak",2870,2347,3508
"200","Dabri - Gurgaon Road, Pocket 2, Sector 1 Dwarka, Dwarka, New Delhi","24","268, Block B2, Shiv Nagar, Janakpuri, New Delhi","9/1/2016 - 9/1/2016, Every day, AM Peak",1120,786,1594
"200","Dabri - Gurgaon Road, Pocket 2, Sector 1 Dwarka, Dwarka, New Delhi","26","A3-214, Asalatpur Village, Janakpuri, Delhi","9/1/2016 - 9/1/2016, Every day, AM Peak",851,648,1117
"200","Dabri - Gurgaon Road, Pocket 2, Sector 1 Dwarka, Dwarka, New Delhi","27","0 Ram Mandir Marg, C5B Block, Janakpuri, New Delhi","9/1/2016 - 9/1/2016, Every day, AM Peak",831,587,1174
"200","Dabri - Gurgaon Road, Pocket 2, Sector 1 Dwarka, Dwarka, New Delhi","28","nullSchool Road, Block M, Uttam Nagar, Delhi","9/1/2016 - 9/1/2016, Every day, AM Peak",907,671,1225
"200","Dabri - Gurgaon Road, Pocket 2, Sector 1 Dwarka, Dwarka, New Delhi","29","Street Number 14, Block C, Sitapuri Part 1, Janakpuri, New Delhi","9/1/2016 - 9/1/2016, Every day, AM Peak",475,292,771
"200","Dabri - Gurgaon Road, Pocket 2, Sector 1 Dwarka, Dwarka, New Delhi","30","Unnamed Road, Asalatpur Khadar, Delhi","9/1/2016 - 9/1/2016, Every day, AM Peak",1771,1552,2020
"200","Dabri - Gurgaon Road, Pocket 2, Sector 1 Dwarka, Dwarka, New Delhi","31","Main Jhatikra Road, Paprawat, Delhi","9/1/2016 - 9/1/2016, Every day, AM Peak",893,637,1251
"200","Dabri - Gurgaon Road, Pocket 2, Sector 1 Dwarka, Dwarka, New Delhi","32","METRO MALL, Pocket 1, Sector 14 Dwarka, Dwarka, New Delhi","9/1/2016 - 9/1/2016, Every day, AM Peak",788,549,1130
"200","Dabri - Gurgaon Road, Pocket 2, Sector 1 Dwarka, Dwarka, New Delhi","61","Unnamed Road, National Zoological Park, Sundar Nagar, New Delhi","9/1/2016 - 9/1/2016, Every day, AM Peak",3512,2865,4304
"200","Dabri - Gurgaon Road, Pocket 2, Sector 1 Dwarka, Dwarka, New Delhi","62","D/116, Jeewan Nagar, Sunlight Colony, New Delhi","9/1/2016 - 9/1/2016, Every day, AM Peak",3276,2754,3895
"200","Dabri - Gurgaon Road, Pocket 2, Sector 1 Dwarka, Dwarka, New Delhi","63","Jawaharlal Nehru Stadium Marg, CGO Complex, Pragati Vihar, New Delhi","9/1/2016 - 9/1/2016, Every day, AM Peak",3107,2689,3589
"200","Dabri - Gurgaon Road, Pocket 2, Sector 1 Dwarka, Dwarka, New Delhi","64","6/37, Vikram Vihar, Lajpat Nagar IV, Lajpat Nagar, New Delhi","9/1/2016 - 9/1/2016, Every day, AM Peak",3300,2751,3957
"200","Dabri - Gurgaon Road, Pocket 2, Sector 1 Dwarka, Dwarka, New Delhi","65","Shaheed Jeet Singh Marg, NCERT Campus, Qutab Institutional Area, New Delhi","9/1/2016 - 9/1/2016, Every day, AM Peak",2662,2112,3354
"200","Dabri - Gurgaon Road, Pocket 2, Sector 1 Dwarka, Dwarka, New Delhi","66","nullBhagat Singh Market Marg, Block K, Malviya Nagar, New Delhi","9/1/2016 - 9/1/2016, Every day, AM Peak",3628,3340,3940
"200","Dabri - Gurgaon Road, Pocket 2, Sector 1 Dwarka, Dwarka, New Delhi","67","63/33, Hudco Place, Andrews Ganj Extension, Andrews Ganj, New Delhi","9/1/2016 - 9/1/2016, Every day, AM Peak",3114,2620,3700
"200","Dabri - Gurgaon Road, Pocket 2, Sector 1 Dwarka, Dwarka, New Delhi","68","0 Paschimi Marg, Block E, Vasant Vihar, New Delhi","9/1/2016 - 9/1/2016, Every day, AM Peak",2171,1630,2890
"200","Dabri - Gurgaon Road, Pocket 2, Sector 1 Dwarka, Dwarka, New Delhi","69","1129, Sector 2 R K Puram, Sector 2, RK Puram, New Delhi","9/1/2016 - 9/1/2016, Every day, AM Peak",2366,1890,2960
"200","Dabri - Gurgaon Road, Pocket 2, Sector 1 Dwarka, Dwarka, New Delhi","70","G288, Sector 3, Block G, Nanak Pura, South Moti Bagh, New Delhi","9/1/2016 - 9/1/2016, Every day, AM Peak",2031,1617,2550
"200","Dabri - Gurgaon Road, Pocket 2, Sector 1 Dwarka, Dwarka, New Delhi","71","JNU Ring Road, Jawaharlal Nehru University, New Delhi","9/1/2016 - 9/1/2016, Every day, AM Peak",2367,1847,3032
"200","Dabri - Gurgaon Road, Pocket 2, Sector 1 Dwarka, Dwarka, New Delhi","80","E-492, Block E, Greater Kailash II, Greater Kailash, New Delhi","9/1/2016 - 9/1/2016, Every day, AM Peak",2849,1991,4074
"200","Dabri - Gurgaon Road, Pocket 2, Sector 1 Dwarka, Dwarka, New Delhi","81","126, Block L 1, Alaknanda, New Delhi","9/1/2016 - 9/1/2016, Every day, AM Peak",3629,2734,4816
"200","Dabri - Gurgaon Road, Pocket 2, Sector 1 Dwarka, Dwarka, New Delhi","82","286, Asian Games Village Complex, Siri Fort, New Delhi","9/1/2016 - 9/1/2016, Every day, AM Peak",2997,2382,3769
"200","Dabri - Gurgaon Road, Pocket 2, Sector 1 Dwarka, Dwarka, New Delhi","83","C2, Block C, Kailash Colony, Greater Kailash, New Delhi","9/1/2016 - 9/1/2016, Every day, AM Peak",3367,2713,4178
"200","Dabri - Gurgaon Road, Pocket 2, Sector 1 Dwarka, Dwarka, New Delhi","84","nullMathura Road, Friends Colony West, Block A, New Friends Colony, New Delhi","9/1/2016 - 9/1/2016, Every day, AM Peak",3260,2622,4052
"200","Dabri - Gurgaon Road, Pocket 2, Sector 1 Dwarka, Dwarka, New Delhi","85","Outer Ring Road, Block 13, Nehru Enclave East, Okhla Industrial Area, New Delhi","9/1/2016 - 9/1/2016, Every day, AM Peak",3568,2770,4595
"200","Dabri - Gurgaon Road, Pocket 2, Sector 1 Dwarka, Dwarka, New Delhi","91","nullTum Road, Sanjay Colony II, Sanjay Colony, Okhla Phase II, Okhla Industrial Area, New Delhi","9/1/2016 - 9/1/2016, Every day, AM Peak",4283,3204,5724
"200","Dabri - Gurgaon Road, Pocket 2, Sector 1 Dwarka, Dwarka, New Delhi","103","nullDasghara Road, Dasghara, New Delhi","9/1/2016 - 9/1/2016, Every day, AM Peak",2378,1849,3057
"200","Dabri - Gurgaon Road, Pocket 2, Sector 1 Dwarka, Dwarka, New Delhi","105","nullGoswami Girdhari Lal Marg, Industrial Area Phase I, Block C, Naraina Industrial Area Phase 1, Naraina, New Delhi","9/1/2016 - 9/1/2016, Every day, AM Peak",2282,1535,3391
"200","Dabri - Gurgaon Road, Pocket 2, Sector 1 Dwarka, Dwarka, New Delhi","121","22/55, West Punjabi Bagh, Punjabi Bagh, Delhi","9/1/2016 - 9/1/2016, Every day, AM Peak",2222,1699,2905
"200","Dabri - Gurgaon Road, Pocket 2, Sector 1 Dwarka, Dwarka, New Delhi","123","Loknath Marg, Block M, Kirti Nagar, New Delhi","9/1/2016 - 9/1/2016, Every day, AM Peak",2128,1630,2777
"200","Dabri - Gurgaon Road, Pocket 2, Sector 1 Dwarka, Dwarka, New Delhi","124","30, 31, Block B, Mansarover Garden, New Delhi","9/1/2016 - 9/1/2016, Every day, AM Peak",1881,1359,2601
"200","Dabri - Gurgaon Road, Pocket 2, Sector 1 Dwarka, Dwarka, New Delhi","129","Gali Number 8, Anand Parbat, New Delhi","9/1/2016 - 9/1/2016, Every day, AM Peak",2451,1933,3106
"200","Dabri - Gurgaon Road, Pocket 2, Sector 1 Dwarka, Dwarka, New Delhi","135","0 Uggarsen Market Road, Meenakshi Garden, Ashok Nagar, Delhi","9/1/2016 - 9/1/2016, Every day, AM Peak",1618,1235,2118
"200","Dabri - Gurgaon Road, Pocket 2, Sector 1 Dwarka, Dwarka, New Delhi","136","nullKeshopur Road, New Chaukhandi, Paschim Vihar, Delhi","9/1/2016 - 9/1/2016, Every day, AM Peak",1667,1269,2188
"200","Dabri - Gurgaon Road, Pocket 2, Sector 1 Dwarka, Dwarka, New Delhi","137","nullRoad Number 235, Block H, Vikaspuri, Delhi","9/1/2016 - 9/1/2016, Every day, AM Peak",1419,1109,1814
"200","Dabri - Gurgaon Road, Pocket 2, Sector 1 Dwarka, Dwarka, New Delhi","141","nullBindapur Matiala Road, Nand Ram Park, Bhagat Enclave, Bindapur, Delhi","9/1/2016 - 9/1/2016, Every day, AM Peak",885,403,1939
"200","Dabri - Gurgaon Road, Pocket 2, Sector 1 Dwarka, Dwarka, New Delhi","142","Gali Number 1, Dabri Village, Dabri, New Delhi","9/1/2016 - 9/1/2016, Every day, AM Peak",568,366,881
"200","Dabri - Gurgaon Road, Pocket 2, Sector 1 Dwarka, Dwarka, New Delhi","143","nullRoad Number 221, Pocket 1, Sector 10 Dwarka, Dwarka, Delhi","9/1/2016 - 9/1/2016, Every day, AM Peak",475,223,1010
"200","Dabri - Gurgaon Road, Pocket 2, Sector 1 Dwarka, Dwarka, New Delhi","148","Unnamed Road, Patparganj, New Delhi","9/1/2016 - 9/1/2016, Every day, AM Peak",3785,3108,4608
"200","Dabri - Gurgaon Road, Pocket 2, Sector 1 Dwarka, Dwarka, New Delhi","159","300 Maharishi Balmiki Mandir Marg, Block H, Shakurpur Colony, Pitampura, Delhi","9/1/2016 - 9/1/2016, Every day, AM Peak",2302,1882,2815
"200","Dabri - Gurgaon Road, Pocket 2, Sector 1 Dwarka, Dwarka, New Delhi","160","23, Shiva Enclave, Pitampura, Delhi","9/1/2016 - 9/1/2016, Every day, AM Peak",2009,1638,2463
"200","Dabri - Gurgaon Road, Pocket 2, Sector 1 Dwarka, Dwarka, New Delhi","161","nullLawrence Road, Rampura Industrial Area, Tri Nagar, Delhi","9/1/2016 - 9/1/2016, Every day, AM Peak",2248,1839,2747
"200","Dabri - Gurgaon Road, Pocket 2, Sector 1 Dwarka, Dwarka, New Delhi","163","0 Guru Harkishan Marg, Maulana Azad Society, Bhagwan Buddha Housing Corporation Society, Pitampura, Delhi","9/1/2016 - 9/1/2016, Every day, AM Peak",1894,1527,2347
"200","Dabri - Gurgaon Road, Pocket 2, Sector 1 Dwarka, Dwarka, New Delhi","164","Shakurbasti Pedestrian Foot Over Bridge, Shakur Basti Railway Colony, Railway Colony South, Pitampura, Delhi","9/1/2016 - 9/1/2016, Every day, AM Peak",2144,1771,2594
"200","Dabri - Gurgaon Road, Pocket 2, Sector 1 Dwarka, Dwarka, New Delhi","165","31, Cottage Enclave, Paschim Vihar, Delhi","9/1/2016 - 9/1/2016, Every day, AM Peak",1666,1316,2108
"200","Dabri - Gurgaon Road, Pocket 2, Sector 1 Dwarka, Dwarka, New Delhi","166","nullRBI Enclave Road, Ankur Enclave, Paschim Vihar, Delhi","9/1/2016 - 9/1/2016, Every day, AM Peak",1630,1256,2114
"200","Dabri - Gurgaon Road, Pocket 2, Sector 1 Dwarka, Dwarka, New Delhi","169","G-9, Block F 1U, Ranikhet, Pitampura, Delhi","9/1/2016 - 9/1/2016, Every day, AM Peak",2132,1823,2492
"200","Dabri - Gurgaon Road, Pocket 2, Sector 1 Dwarka, Dwarka, New Delhi","170","nullColony Road, Block QP, Poorvi Pitampura, Pitampura, Delhi","9/1/2016 - 9/1/2016, Every day, AM Peak",2213,1742,2810
"200","Dabri - Gurgaon Road, Pocket 2, Sector 1 Dwarka, Dwarka, New Delhi","172","nullShiva Road, Pocket 14, Sector 8D, Rohini, Delhi","9/1/2016 - 9/1/2016, Every day, AM Peak",2033,1693,2441
"200","Dabri - Gurgaon Road, Pocket 2, Sector 1 Dwarka, Dwarka, New Delhi","175","235, Block E, Block E, Mangolpuri, Delhi","9/1/2016 - 9/1/2016, Every day, AM Peak",1704,1407,2063
"200","Dabri - Gurgaon Road, Pocket 2, Sector 1 Dwarka, Dwarka, New Delhi","176","B7-187, Pocket 7, Sector 3B, Rohini, Delhi","9/1/2016 - 9/1/2016, Every day, AM Peak",1831,1513,2214
"200","Dabri - Gurgaon Road, Pocket 2, Sector 1 Dwarka, Dwarka, New Delhi","179","0 AB Road, Block RR, Mianwali Nagar, Paschim Vihar, Delhi","9/1/2016 - 9/1/2016, Every day, AM Peak",1764,1355,2295
"200","Dabri - Gurgaon Road, Pocket 2, Sector 1 Dwarka, Dwarka, New Delhi","180","GH-14/234, GH 14, Block GH 14, Paschim Vihar, Delhi","9/1/2016 - 9/1/2016, Every day, AM Peak",1791,1378,2326
"200","Dabri - Gurgaon Road, Pocket 2, Sector 1 Dwarka, Dwarka, New Delhi","193","Unnamed Road, Usmanpur, Shahdara, Delhi","9/1/2016 - 9/1/2016, Every day, AM Peak",3634,2968,4449
"200","Dabri - Gurgaon Road, Pocket 2, Sector 1 Dwarka, Dwarka, New Delhi","199","0 Shivaji Marg, New Moti Nagar, Najafgarh Road Industrial Area, Delhi","9/1/2016 - 9/1/2016, Every day, AM Peak",2221,1786,2761
"200","Dabri - Gurgaon Road, Pocket 2, Sector 1 Dwarka, Dwarka, New Delhi","222","Sector E, Mahipalpur Village, Vasant Kunj, New Delhi","9/1/2016 - 9/1/2016, Every day, AM Peak",2252,1611,3146
"200","Dabri - Gurgaon Road, Pocket 2, Sector 1 Dwarka, Dwarka, New Delhi","223","Urban Extension Road II, Indira Gandhi International Airport, New Delhi","9/1/2016 - 9/1/2016, Every day, AM Peak",2338,1475,3705
"200","Dabri - Gurgaon Road, Pocket 2, Sector 1 Dwarka, Dwarka, New Delhi","224","Main Road, Bharthal, Sector 27 Dwarka, Bharthal, New Delhi","9/1/2016 - 9/1/2016, Every day, AM Peak",1360,685,2698
"200","Dabri - Gurgaon Road, Pocket 2, Sector 1 Dwarka, Dwarka, New Delhi","229","200 Road Number 28, Nehru Nagar, Shivaji Place, Basai Dara pur, Tagore Garden Extension, New Delhi","9/1/2016 - 9/1/2016, Every day, AM Peak",1982,1513,2595
"200","Dabri - Gurgaon Road, Pocket 2, Sector 1 Dwarka, Dwarka, New Delhi","231","G-17/6, Block G, Rajouri Garden, New Delhi","9/1/2016 - 9/1/2016, Every day, AM Peak",1680,1367,2063
"200","Dabri - Gurgaon Road, Pocket 2, Sector 1 Dwarka, Dwarka, New Delhi","232","4-3, Mayapuri Industrial Area Phase II, Mayapuri, New Delhi","9/1/2016 - 9/1/2016, Every day, AM Peak",1069,782,1459
"200","Dabri - Gurgaon Road, Pocket 2, Sector 1 Dwarka, Dwarka, New Delhi","233","nullSatguru Ram Singh Marg, Block B, Mayapuri Industrial Area Phase I, Mayapuri, New Delhi","9/1/2016 - 9/1/2016, Every day, AM Peak",1498,1080,2076
"200","Dabri - Gurgaon Road, Pocket 2, Sector 1 Dwarka, Dwarka, New Delhi","234","113, Press Colony, Press Colony, Mayapuri, New Delhi","9/1/2016 - 9/1/2016, Every day, AM Peak",1505,1149,1970
"200","Dabri - Gurgaon Road, Pocket 2, Sector 1 Dwarka, Dwarka, New Delhi","235","nullBharat Vihar Road, Block G, Raja Puri, Matiala, Delhi","9/1/2016 - 9/1/2016, Every day, AM Peak",383,197,744
"200","Dabri - Gurgaon Road, Pocket 2, Sector 1 Dwarka, Dwarka, New Delhi","240","37, Sector 15, Pocket 6, Sector 15B, Rohini, Delhi","9/1/2016 - 9/1/2016, Every day, AM Peak",2195,1939,2483
"200","Dabri - Gurgaon Road, Pocket 2, Sector 1 Dwarka, Dwarka, New Delhi","244","Dhingra Park Trail, Punjabi Bagh Cooperative Housing Soceity, East Punjabi Bagh, Punjabi Bagh, Delhi","9/1/2016 - 9/1/2016, Every day, AM Peak",2283,1876,2777
"200","Dabri - Gurgaon Road, Pocket 2, Sector 1 Dwarka, Dwarka, New Delhi","246","nullShiv Mandir Marg, Block G, Lajpat Nagar I, Lajpat Nagar, New Delhi","9/1/2016 - 9/1/2016, Every day, AM Peak",3155,2646,3761
"200","Dabri - Gurgaon Road, Pocket 2, Sector 1 Dwarka, Dwarka, New Delhi","247","9/2082, Pocket 2, Block RZ, Palam Colony, New Delhi","9/1/2016 - 9/1/2016, Every day, AM Peak",520,215,1256
"200","Dabri - Gurgaon Road, Pocket 2, Sector 1 Dwarka, Dwarka, New Delhi","248","Unnamed Road, Harijan Basti, Rajokri, New Delhi","9/1/2016 - 9/1/2016, Every day, AM Peak",3254,2160,4901
"200","Dabri - Gurgaon Road, Pocket 2, Sector 1 Dwarka, Dwarka, New Delhi","251","A25, Block R, Pocket A, Rajender Nagar Part 1, New Rajinder Nagar, New Delhi","9/1/2016 - 9/1/2016, Every day, AM Peak",2931,2383,3604
"200","Dabri - Gurgaon Road, Pocket 2, Sector 1 Dwarka, Dwarka, New Delhi","252","813, Sector 1, RK Puram, New Delhi","9/1/2016 - 9/1/2016, Every day, AM Peak",2281,1830,2841
"200","Dabri - Gurgaon Road, Pocket 2, Sector 1 Dwarka, Dwarka, New Delhi","253","0 Chaudhary Harsukh Marg, B6, Block B6, Humayunpur, Safdarjung Enclave, New Delhi","9/1/2016 - 9/1/2016, Every day, AM Peak",2553,2019,3228
"200","Dabri - Gurgaon Road, Pocket 2, Sector 1 Dwarka, Dwarka, New Delhi","254","Squadron Leader Mohinder Kumar Jain Marg, Block B, New Delhi","9/1/2016 - 9/1/2016, Every day, AM Peak",2727,2129,3491
"200","Dabri - Gurgaon Road, Pocket 2, Sector 1 Dwarka, Dwarka, New Delhi","255","1700 Uday Chand Marg, Arya Basti, Zafar Nagar, Kotla Mubarakpur, South Extension I, New Delhi","9/1/2016 - 9/1/2016, Every day, AM Peak",2853,2310,3522
"200","Dabri - Gurgaon Road, Pocket 2, Sector 1 Dwarka, Dwarka, New Delhi","256","D-70, Mahavir Enclave I, Mahavir Enclave Part 2, Mahavir Enclave, New Delhi","9/1/2016 - 9/1/2016, Every day, AM Peak",372,172,802
"200","Dabri - Gurgaon Road, Pocket 2, Sector 1 Dwarka, Dwarka, New Delhi","258","Sant Sujan Singh Marg, JJ Colony, Block N, Tagore Garden, Tagore Garden Extension, New Delhi","9/1/2016 - 9/1/2016, Every day, AM Peak",1790,1434,2233
"200","Dabri - Gurgaon Road, Pocket 2, Sector 1 Dwarka, Dwarka, New Delhi","259","Jogging Lane, Pocket B-C, Sector-A, Vasant Kunj, New Delhi","9/1/2016 - 9/1/2016, Every day, AM Peak",3269,2579,4143
"200","Dabri - Gurgaon Road, Pocket 2, Sector 1 Dwarka, Dwarka, New Delhi","263","200 Pirwali Gali, Block P, Block P, Patparganj, New Delhi","9/1/2016 - 9/1/2016, Every day, AM Peak",4329,3523,5318
"200","Dabri - Gurgaon Road, Pocket 2, Sector 1 Dwarka, Dwarka, New Delhi","264","Noida Link Road, Nehru Enclave, Shakarpur Khas, New Delhi","9/1/2016 - 9/1/2016, Every day, AM Peak",4116,3339,5073
"200","Dabri - Gurgaon Road, Pocket 2, Sector 1 Dwarka, Dwarka, New Delhi","275","125/16, Jogabai Extension, Zakir Nagar, Okhla, New Delhi","9/1/2016 - 9/1/2016, Every day, AM Peak",3374,2775,4101
"200","Dabri - Gurgaon Road, Pocket 2, Sector 1 Dwarka, Dwarka, New Delhi","279","Nightingale Road, Budella, Vikaspuri, Delhi","9/1/2016 - 9/1/2016, Every day, AM Peak",1306,1040,1638
"200","Dabri - Gurgaon Road, Pocket 2, Sector 1 Dwarka, Dwarka, New Delhi","280","nullHastsal Road, Block A2, JJ Colony, Uttam Nagar, Delhi","9/1/2016 - 9/1/2016, Every day, AM Peak",1684,1075,2636
"200","Dabri - Gurgaon Road, Pocket 2, Sector 1 Dwarka, Dwarka, New Delhi","281","D915, New Mahavir Nagar, Tilak Nagar, Delhi","9/1/2016 - 9/1/2016, Every day, AM Peak",1221,950,1567