"Origin Movement ID","Origin Display Name","Destination Movement ID","Destination Display Name","Date Range","Mean Travel Time (Seconds)","Range - Lower Bound Travel Time (Seconds)","Range - Upper Bound Travel Time (Seconds)"
"72","7/254, Dakshinpuri Extension, Block 7, Sector 6, Dakshinpuri, New Delhi","9","Mahatma Jyothi Rao Phule Marg, Mahatma Jyoti Rao Phule Marg Area, New Delhi","9/2/2016 - 9/2/2016, Every day, AM Peak",1881,1247,2836
"72","7/254, Dakshinpuri Extension, Block 7, Sector 6, Dakshinpuri, New Delhi","13","10, Aurangzeb Road, New Delhi","9/2/2016 - 9/2/2016, Every day, AM Peak",1642,1131,2382
"72","7/254, Dakshinpuri Extension, Block 7, Sector 6, Dakshinpuri, New Delhi","61","Unnamed Road, National Zoological Park, Sundar Nagar, New Delhi","9/2/2016 - 9/2/2016, Every day, AM Peak",1822,1377,2409
"72","7/254, Dakshinpuri Extension, Block 7, Sector 6, Dakshinpuri, New Delhi","62","D/116, Jeewan Nagar, Sunlight Colony, New Delhi","9/2/2016 - 9/2/2016, Every day, AM Peak",1448,1188,1763
"72","7/254, Dakshinpuri Extension, Block 7, Sector 6, Dakshinpuri, New Delhi","63","Jawaharlal Nehru Stadium Marg, CGO Complex, Pragati Vihar, New Delhi","9/2/2016 - 9/2/2016, Every day, AM Peak",1457,1003,2116
"72","7/254, Dakshinpuri Extension, Block 7, Sector 6, Dakshinpuri, New Delhi","64","6/37, Vikram Vihar, Lajpat Nagar IV, Lajpat Nagar, New Delhi","9/2/2016 - 9/2/2016, Every day, AM Peak",1161,780,1726
"72","7/254, Dakshinpuri Extension, Block 7, Sector 6, Dakshinpuri, New Delhi","65","Shaheed Jeet Singh Marg, NCERT Campus, Qutab Institutional Area, New Delhi","9/2/2016 - 9/2/2016, Every day, AM Peak",1131,704,1816
"72","7/254, Dakshinpuri Extension, Block 7, Sector 6, Dakshinpuri, New Delhi","66","nullBhagat Singh Market Marg, Block K, Malviya Nagar, New Delhi","9/2/2016 - 9/2/2016, Every day, AM Peak",1155,845,1578
"72","7/254, Dakshinpuri Extension, Block 7, Sector 6, Dakshinpuri, New Delhi","67","63/33, Hudco Place, Andrews Ganj Extension, Andrews Ganj, New Delhi","9/2/2016 - 9/2/2016, Every day, AM Peak",1052,742,1490
"72","7/254, Dakshinpuri Extension, Block 7, Sector 6, Dakshinpuri, New Delhi","68","0 Paschimi Marg, Block E, Vasant Vihar, New Delhi","9/2/2016 - 9/2/2016, Every day, AM Peak",1631,1159,2294
"72","7/254, Dakshinpuri Extension, Block 7, Sector 6, Dakshinpuri, New Delhi","69","1129, Sector 2 R K Puram, Sector 2, RK Puram, New Delhi","9/2/2016 - 9/2/2016, Every day, AM Peak",931,684,1265
"72","7/254, Dakshinpuri Extension, Block 7, Sector 6, Dakshinpuri, New Delhi","70","G288, Sector 3, Block G, Nanak Pura, South Moti Bagh, New Delhi","9/2/2016 - 9/2/2016, Every day, AM Peak",1741,1320,2295
"72","7/254, Dakshinpuri Extension, Block 7, Sector 6, Dakshinpuri, New Delhi","71","JNU Ring Road, Jawaharlal Nehru University, New Delhi","9/2/2016 - 9/2/2016, Every day, AM Peak",1265,799,2002
"72","7/254, Dakshinpuri Extension, Block 7, Sector 6, Dakshinpuri, New Delhi","73","0 Central Avenue, Block E, Sainik Farm, New Delhi","9/2/2016 - 9/2/2016, Every day, AM Peak",447,260,767
"72","7/254, Dakshinpuri Extension, Block 7, Sector 6, Dakshinpuri, New Delhi","74","F-269, Ambedkar Nagar, Block F, Sector 5, Dakshinpuri, New Delhi","9/2/2016 - 9/2/2016, Every day, AM Peak",303,147,621
"72","7/254, Dakshinpuri Extension, Block 7, Sector 6, Dakshinpuri, New Delhi","75","B-299, Ambedkar Nagar, Block B, Sector 5, Dakshinpuri, New Delhi","9/2/2016 - 9/2/2016, Every day, AM Peak",173,90,331
"72","7/254, Dakshinpuri Extension, Block 7, Sector 6, Dakshinpuri, New Delhi","76","124, SPG Quarters, Sector 4, Pushp Vihar, New Delhi","9/2/2016 - 9/2/2016, Every day, AM Peak",219,88,542
"72","7/254, Dakshinpuri Extension, Block 7, Sector 6, Dakshinpuri, New Delhi","77","0 Mehrauli - Badarpur Road, Tughlakabad Institutional Area, Vayusenabad, New Delhi","9/2/2016 - 9/2/2016, Every day, AM Peak",599,203,1762
"72","7/254, Dakshinpuri Extension, Block 7, Sector 6, Dakshinpuri, New Delhi","80","E-492, Block E, Greater Kailash II, Greater Kailash, New Delhi","9/2/2016 - 9/2/2016, Every day, AM Peak",344,179,657
"72","7/254, Dakshinpuri Extension, Block 7, Sector 6, Dakshinpuri, New Delhi","81","126, Block L 1, Alaknanda, New Delhi","9/2/2016 - 9/2/2016, Every day, AM Peak",1009,612,1661
"72","7/254, Dakshinpuri Extension, Block 7, Sector 6, Dakshinpuri, New Delhi","82","286, Asian Games Village Complex, Siri Fort, New Delhi","9/2/2016 - 9/2/2016, Every day, AM Peak",660,393,1106
"72","7/254, Dakshinpuri Extension, Block 7, Sector 6, Dakshinpuri, New Delhi","83","C2, Block C, Kailash Colony, Greater Kailash, New Delhi","9/2/2016 - 9/2/2016, Every day, AM Peak",859,539,1367
"72","7/254, Dakshinpuri Extension, Block 7, Sector 6, Dakshinpuri, New Delhi","84","nullMathura Road, Friends Colony West, Block A, New Friends Colony, New Delhi","9/2/2016 - 9/2/2016, Every day, AM Peak",1288,1028,1613
"72","7/254, Dakshinpuri Extension, Block 7, Sector 6, Dakshinpuri, New Delhi","85","Outer Ring Road, Block 13, Nehru Enclave East, Okhla Industrial Area, New Delhi","9/2/2016 - 9/2/2016, Every day, AM Peak",951,703,1284
"72","7/254, Dakshinpuri Extension, Block 7, Sector 6, Dakshinpuri, New Delhi","87","0 Maharaja Agarsen Marg, Subash Khand, Giri Nagar, Kalkaji, New Delhi","9/2/2016 - 9/2/2016, Every day, AM Peak",1020,792,1312
"72","7/254, Dakshinpuri Extension, Block 7, Sector 6, Dakshinpuri, New Delhi","106","IGNOU Residential Campus Road, Rocky Area, Stone Quarries, Maidan Garhi, New Delhi","9/2/2016 - 9/2/2016, Every day, AM Peak",842,549,1290
"72","7/254, Dakshinpuri Extension, Block 7, Sector 6, Dakshinpuri, New Delhi","107","1100 Zia UL Haq Road, Block A1, Chattarpur, Chhattarpur, New Delhi","9/2/2016 - 9/2/2016, Every day, AM Peak",1733,1282,2341
"72","7/254, Dakshinpuri Extension, Block 7, Sector 6, Dakshinpuri, New Delhi","108","Unnamed Road, Block G, Bhim Basti, Jaunapur, New Delhi","9/2/2016 - 9/2/2016, Every day, AM Peak",2539,2047,3149
"72","7/254, Dakshinpuri Extension, Block 7, Sector 6, Dakshinpuri, New Delhi","148","Unnamed Road, Patparganj, New Delhi","9/2/2016 - 9/2/2016, Every day, AM Peak",1878,1552,2271
"72","7/254, Dakshinpuri Extension, Block 7, Sector 6, Dakshinpuri, New Delhi","193","Unnamed Road, Usmanpur, Shahdara, Delhi","9/2/2016 - 9/2/2016, Every day, AM Peak",1816,1452,2271
"72","7/254, Dakshinpuri Extension, Block 7, Sector 6, Dakshinpuri, New Delhi","246","nullShiv Mandir Marg, Block G, Lajpat Nagar I, Lajpat Nagar, New Delhi","9/2/2016 - 9/2/2016, Every day, AM Peak",1229,892,1692
"72","7/254, Dakshinpuri Extension, Block 7, Sector 6, Dakshinpuri, New Delhi","248","Unnamed Road, Harijan Basti, Rajokri, New Delhi","9/2/2016 - 9/2/2016, Every day, AM Peak",1971,1454,2670
"72","7/254, Dakshinpuri Extension, Block 7, Sector 6, Dakshinpuri, New Delhi","252","813, Sector 1, RK Puram, New Delhi","9/2/2016 - 9/2/2016, Every day, AM Peak",1272,795,2034
"72","7/254, Dakshinpuri Extension, Block 7, Sector 6, Dakshinpuri, New Delhi","253","0 Chaudhary Harsukh Marg, B6, Block B6, Humayunpur, Safdarjung Enclave, New Delhi","9/2/2016 - 9/2/2016, Every day, AM Peak",1698,948,3039
"72","7/254, Dakshinpuri Extension, Block 7, Sector 6, Dakshinpuri, New Delhi","254","Squadron Leader Mohinder Kumar Jain Marg, Block B, New Delhi","9/2/2016 - 9/2/2016, Every day, AM Peak",1202,706,2045
"72","7/254, Dakshinpuri Extension, Block 7, Sector 6, Dakshinpuri, New Delhi","259","Jogging Lane, Pocket B-C, Sector-A, Vasant Kunj, New Delhi","9/2/2016 - 9/2/2016, Every day, AM Peak",681,374,1237
"72","7/254, Dakshinpuri Extension, Block 7, Sector 6, Dakshinpuri, New Delhi","264","Noida Link Road, Nehru Enclave, Shakarpur Khas, New Delhi","9/2/2016 - 9/2/2016, Every day, AM Peak",2116,1733,2582
"72","7/254, Dakshinpuri Extension, Block 7, Sector 6, Dakshinpuri, New Delhi","272","Anuvrat Marg, Butterfly Park, Qila Rai Pithora, Mehrauli, New Delhi","9/2/2016 - 9/2/2016, Every day, AM Peak",1128,750,1695
"72","7/254, Dakshinpuri Extension, Block 7, Sector 6, Dakshinpuri, New Delhi","282","Velodrome Road, Gandhi Smriti, Raj Ghat, New Delhi","9/2/2016 - 9/2/2016, Every day, AM Peak",2406,1796,3221