"Origin Movement ID","Origin Display Name","Destination Movement ID","Destination Display Name","Date Range","Mean Travel Time (Seconds)","Range - Lower Bound Travel Time (Seconds)","Range - Upper Bound Travel Time (Seconds)"
"46","256, Block C 2, Bhajanpura, Tukhmirpur, Delhi","9","Mahatma Jyothi Rao Phule Marg, Mahatma Jyoti Rao Phule Marg Area, New Delhi","9/2/2016 - 9/2/2016, Every day, AM Peak",2773,2216,3469
"46","256, Block C 2, Bhajanpura, Tukhmirpur, Delhi","13","10, Aurangzeb Road, New Delhi","9/2/2016 - 9/2/2016, Every day, AM Peak",3004,2451,3680
"46","256, Block C 2, Bhajanpura, Tukhmirpur, Delhi","40","Gali Saini Tent, Ram Nagar, Shahdara, Delhi","9/2/2016 - 9/2/2016, Every day, AM Peak",1325,1129,1553
"46","256, Block C 2, Bhajanpura, Tukhmirpur, Delhi","41","Lala Raghubar Dayal Marg, Phase 4, Block B, Subhash Park, Shahdara, Delhi","9/2/2016 - 9/2/2016, Every day, AM Peak",1217,1013,1460
"46","256, Block C 2, Bhajanpura, Tukhmirpur, Delhi","42","Street Number 30/6, New Seelampur, Chauhan Banger, Shahdara, Delhi","9/2/2016 - 9/2/2016, Every day, AM Peak",971,829,1137
"46","256, Block C 2, Bhajanpura, Tukhmirpur, Delhi","43","A537, New Seelampur Phase II, New Seelampur, Shahdara, Delhi","9/2/2016 - 9/2/2016, Every day, AM Peak",1128,960,1324
"46","256, Block C 2, Bhajanpura, Tukhmirpur, Delhi","44","100 Maujpur Main Road, Maujpur, Shahdara, Delhi","9/2/2016 - 9/2/2016, Every day, AM Peak",626,362,1082
"46","256, Block C 2, Bhajanpura, Tukhmirpur, Delhi","47","Street Number 10, Block C, North Ghonda, Shahdara, Delhi","9/2/2016 - 9/2/2016, Every day, AM Peak",322,154,671
"46","256, Block C 2, Bhajanpura, Tukhmirpur, Delhi","48","Kardam Marg, Block B, Kabir Nagar, Shahdara, Delhi","9/2/2016 - 9/2/2016, Every day, AM Peak",407,98,1676
"46","256, Block C 2, Bhajanpura, Tukhmirpur, Delhi","49","1/10068, New Jaffrabad, Shahdara, Delhi","9/2/2016 - 9/2/2016, Every day, AM Peak",925,797,1072
"46","256, Block C 2, Bhajanpura, Tukhmirpur, Delhi","52","202, Block D, Ganga Vihar, Gokalpuri, Delhi","9/2/2016 - 9/2/2016, Every day, AM Peak",404,263,619
"46","256, Block C 2, Bhajanpura, Tukhmirpur, Delhi","61","Unnamed Road, National Zoological Park, Sundar Nagar, New Delhi","9/2/2016 - 9/2/2016, Every day, AM Peak",2686,2170,3323
"46","256, Block C 2, Bhajanpura, Tukhmirpur, Delhi","114","9/434, Gandhi Nagar, Seelampur, Shahdara, Delhi","9/2/2016 - 9/2/2016, Every day, AM Peak",1614,1388,1876
"46","256, Block C 2, Bhajanpura, Tukhmirpur, Delhi","115","0 Street Number 3, Azad Nagar, Azad Nagar East, Seelampur, Krishna Nagar, Delhi","9/2/2016 - 9/2/2016, Every day, AM Peak",1452,1231,1711
"46","256, Block C 2, Bhajanpura, Tukhmirpur, Delhi","116","9/5284, Shanti Mohalla, Seelampur, Shahdara, Delhi","9/2/2016 - 9/2/2016, Every day, AM Peak",1282,1106,1485
"46","256, Block C 2, Bhajanpura, Tukhmirpur, Delhi","132","1600 Lothian Road, Chabi Ganj, Kashmere Gate, New Delhi","9/2/2016 - 9/2/2016, Every day, AM Peak",2026,1600,2565
"46","256, Block C 2, Bhajanpura, Tukhmirpur, Delhi","189","F22, Block F, Krishna Nagar, Delhi","9/2/2016 - 9/2/2016, Every day, AM Peak",1664,1473,1878
"46","256, Block C 2, Bhajanpura, Tukhmirpur, Delhi","190","F-33, Block F, Preet Vihar, Delhi","9/2/2016 - 9/2/2016, Every day, AM Peak",2161,1838,2540
"46","256, Block C 2, Bhajanpura, Tukhmirpur, Delhi","193","Unnamed Road, Usmanpur, Shahdara, Delhi","9/2/2016 - 9/2/2016, Every day, AM Peak",1661,965,2858
"46","256, Block C 2, Bhajanpura, Tukhmirpur, Delhi","228","0 Lucknow Road, Banarsi Das Estate, Timarpur, Delhi","9/2/2016 - 9/2/2016, Every day, AM Peak",1665,1301,2130
"46","256, Block C 2, Bhajanpura, Tukhmirpur, Delhi","242","nullGali Number 2, Jagjeet Nagar, Shahdara, Delhi","9/2/2016 - 9/2/2016, Every day, AM Peak",1113,806,1536
"46","256, Block C 2, Bhajanpura, Tukhmirpur, Delhi","249","46, M.S Park, Vishwas Nagar, Shahdara, Delhi","9/2/2016 - 9/2/2016, Every day, AM Peak",1680,1414,1995
"46","256, Block C 2, Bhajanpura, Tukhmirpur, Delhi","266","Yamuna Marginal Bandh Marg, Block A, Shastri Park, Jagjit Nagar, New Delhi","9/2/2016 - 9/2/2016, Every day, AM Peak",1651,1293,2106
"46","256, Block C 2, Bhajanpura, Tukhmirpur, Delhi","267","nullPanduk Shila Marg, Kaithwara Jagjivan Nagar, New Usmanpur, Shahdara, Delhi","9/2/2016 - 9/2/2016, Every day, AM Peak",1500,1167,1928
"46","256, Block C 2, Bhajanpura, Tukhmirpur, Delhi","268","null5th Pustha Road, Block B, Bhajanpura, Shahdara, Delhi","9/2/2016 - 9/2/2016, Every day, AM Peak",545,267,1109
"46","256, Block C 2, Bhajanpura, Tukhmirpur, Delhi","282","Velodrome Road, Gandhi Smriti, Raj Ghat, New Delhi","9/2/2016 - 9/2/2016, Every day, AM Peak",2402,1945,2965