"Origin Movement ID","Origin Display Name","Destination Movement ID","Destination Display Name","Date Range","Mean Travel Time (Seconds)","Range - Lower Bound Travel Time (Seconds)","Range - Upper Bound Travel Time (Seconds)"
"128","0 Shakti Mandir Marg, Block 10, Shakti Nagar, Delhi","3","Unnamed Road, Mahipalpur, New Delhi","11/2/2016 - 11/2/2016, Every day, AM Peak",2728,2206,3373
"128","0 Shakti Mandir Marg, Block 10, Shakti Nagar, Delhi","4","P-268/3, Rock View, Delhi Cantonment, Delhi","11/2/2016 - 11/2/2016, Every day, AM Peak",2861,2380,3438
"128","0 Shakti Mandir Marg, Block 10, Shakti Nagar, Delhi","5","Old Palam Road, Delhi Cantonment, New Delhi","11/2/2016 - 11/2/2016, Every day, AM Peak",3000,2540,3542
"128","0 Shakti Mandir Marg, Block 10, Shakti Nagar, Delhi","8","Mall Road, Khyber Lines, Delhi Cantonment, New Delhi","11/2/2016 - 11/2/2016, Every day, AM Peak",2089,1693,2576
"128","0 Shakti Mandir Marg, Block 10, Shakti Nagar, Delhi","9","Mahatma Jyothi Rao Phule Marg, Mahatma Jyoti Rao Phule Marg Area, New Delhi","11/2/2016 - 11/2/2016, Every day, AM Peak",2052,1530,2752
"128","0 Shakti Mandir Marg, Block 10, Shakti Nagar, Delhi","10","0 Shaheed Bhagat Singh Marg, DIZ Staff Quarters, Connaught Place, New Delhi","11/2/2016 - 11/2/2016, Every day, AM Peak",1402,1109,1772
"128","0 Shakti Mandir Marg, Block 10, Shakti Nagar, Delhi","11","Mother Teresa Crescent, Talkatora Garden, Central Ridge Reserve Forest, New Delhi","11/2/2016 - 11/2/2016, Every day, AM Peak",1530,1219,1918
"128","0 Shakti Mandir Marg, Block 10, Shakti Nagar, Delhi","12","Jantar Mantar Road, Janpath, Connaught Place, New Delhi","11/2/2016 - 11/2/2016, Every day, AM Peak",1700,1371,2107
"128","0 Shakti Mandir Marg, Block 10, Shakti Nagar, Delhi","13","10, Aurangzeb Road, New Delhi","11/2/2016 - 11/2/2016, Every day, AM Peak",2096,1619,2712
"128","0 Shakti Mandir Marg, Block 10, Shakti Nagar, Delhi","14","Mahatma Gandhi Road, Kidwai Nagar West, Kidwai Nagar, New Delhi","11/2/2016 - 11/2/2016, Every day, AM Peak",2306,1951,2724
"128","0 Shakti Mandir Marg, Block 10, Shakti Nagar, Delhi","16","Andre Malraux Marg, Ramnagar, Chanakyapuri, New Delhi","11/2/2016 - 11/2/2016, Every day, AM Peak",1958,1639,2337
"128","0 Shakti Mandir Marg, Block 10, Shakti Nagar, Delhi","17","0 Khanna Market Road, Aliganj, Lodi Colony, New Delhi","11/2/2016 - 11/2/2016, Every day, AM Peak",2117,1761,2543
"128","0 Shakti Mandir Marg, Block 10, Shakti Nagar, Delhi","18","Unnamed Road, Lal Qila, Chandni Chowk, New Delhi","11/2/2016 - 11/2/2016, Every day, AM Peak",1565,1207,2027
"128","0 Shakti Mandir Marg, Block 10, Shakti Nagar, Delhi","61","Unnamed Road, National Zoological Park, Sundar Nagar, New Delhi","11/2/2016 - 11/2/2016, Every day, AM Peak",2534,2054,3125
"128","0 Shakti Mandir Marg, Block 10, Shakti Nagar, Delhi","63","Jawaharlal Nehru Stadium Marg, CGO Complex, Pragati Vihar, New Delhi","11/2/2016 - 11/2/2016, Every day, AM Peak",2999,2378,3781
"128","0 Shakti Mandir Marg, Block 10, Shakti Nagar, Delhi","64","6/37, Vikram Vihar, Lajpat Nagar IV, Lajpat Nagar, New Delhi","11/2/2016 - 11/2/2016, Every day, AM Peak",3374,2639,4312
"128","0 Shakti Mandir Marg, Block 10, Shakti Nagar, Delhi","65","Shaheed Jeet Singh Marg, NCERT Campus, Qutab Institutional Area, New Delhi","11/2/2016 - 11/2/2016, Every day, AM Peak",3454,2437,4894
"128","0 Shakti Mandir Marg, Block 10, Shakti Nagar, Delhi","67","63/33, Hudco Place, Andrews Ganj Extension, Andrews Ganj, New Delhi","11/2/2016 - 11/2/2016, Every day, AM Peak",3147,2466,4014
"128","0 Shakti Mandir Marg, Block 10, Shakti Nagar, Delhi","70","G288, Sector 3, Block G, Nanak Pura, South Moti Bagh, New Delhi","11/2/2016 - 11/2/2016, Every day, AM Peak",2161,1676,2786
"128","0 Shakti Mandir Marg, Block 10, Shakti Nagar, Delhi","100","Maharishi Balmiki Marg, Police Colony, Sarai Khalil, Sadar Bazaar, New Delhi","11/2/2016 - 11/2/2016, Every day, AM Peak",981,680,1414
"128","0 Shakti Mandir Marg, Block 10, Shakti Nagar, Delhi","101","4900 Ramdwara Road, Chuna Mandi, Aram Bagh, Paharganj, New Delhi","11/2/2016 - 11/2/2016, Every day, AM Peak",1223,932,1604
"128","0 Shakti Mandir Marg, Block 10, Shakti Nagar, Delhi","103","nullDasghara Road, Dasghara, New Delhi","11/2/2016 - 11/2/2016, Every day, AM Peak",1604,1284,2002
"128","0 Shakti Mandir Marg, Block 10, Shakti Nagar, Delhi","121","22/55, West Punjabi Bagh, Punjabi Bagh, Delhi","11/2/2016 - 11/2/2016, Every day, AM Peak",1575,998,2484
"128","0 Shakti Mandir Marg, Block 10, Shakti Nagar, Delhi","123","Loknath Marg, Block M, Kirti Nagar, New Delhi","11/2/2016 - 11/2/2016, Every day, AM Peak",1042,809,1341
"128","0 Shakti Mandir Marg, Block 10, Shakti Nagar, Delhi","124","30, 31, Block B, Mansarover Garden, New Delhi","11/2/2016 - 11/2/2016, Every day, AM Peak",1562,1052,2318
"128","0 Shakti Mandir Marg, Block 10, Shakti Nagar, Delhi","126","nullSwami Narayan Underpass Road, Block E, Sangam Park, Ashok Vihar, Delhi","11/2/2016 - 11/2/2016, Every day, AM Peak",642,418,983
"128","0 Shakti Mandir Marg, Block 10, Shakti Nagar, Delhi","127","NDPL House, Lala Achintaram Marg, Block B, Gujranwala Town, Delhi","11/2/2016 - 11/2/2016, Every day, AM Peak",812,566,1163
"128","0 Shakti Mandir Marg, Block 10, Shakti Nagar, Delhi","129","Gali Number 8, Anand Parbat, New Delhi","11/2/2016 - 11/2/2016, Every day, AM Peak",491,263,914
"128","0 Shakti Mandir Marg, Block 10, Shakti Nagar, Delhi","130","Bhagat Singh Marg, Kashmiri Bagh, Chandra Shekhar Azad Colony, Sarai Rohilla, New Delhi","11/2/2016 - 11/2/2016, Every day, AM Peak",322,132,782
"128","0 Shakti Mandir Marg, Block 10, Shakti Nagar, Delhi","131","4400 Gali Bahuji, Pahari Dhiraj, Sadar Bazaar, Delhi","11/2/2016 - 11/2/2016, Every day, AM Peak",677,396,1155
"128","0 Shakti Mandir Marg, Block 10, Shakti Nagar, Delhi","132","1600 Lothian Road, Chabi Ganj, Kashmere Gate, New Delhi","11/2/2016 - 11/2/2016, Every day, AM Peak",1221,818,1820
"128","0 Shakti Mandir Marg, Block 10, Shakti Nagar, Delhi","133","0 Raj Niwas Marg, Ludlow Castle, Civil Lines, Delhi","11/2/2016 - 11/2/2016, Every day, AM Peak",845,498,1430
"128","0 Shakti Mandir Marg, Block 10, Shakti Nagar, Delhi","155","Maharaja Agaersen Road, Block D, Pocket D, Phase 1, Ashok Vihar, Delhi","11/2/2016 - 11/2/2016, Every day, AM Peak",795,452,1396
"128","0 Shakti Mandir Marg, Block 10, Shakti Nagar, Delhi","156","Doctor Satpal Sachdeva Marg, Keshav Puram, Tri Nagar, Delhi","11/2/2016 - 11/2/2016, Every day, AM Peak",727,395,1335
"128","0 Shakti Mandir Marg, Block 10, Shakti Nagar, Delhi","157","CH Devender Singh Tewatia Marg, Ashok Vihar II, Pocket B 1, Phase 3, Ashok Vihar, Delhi","11/2/2016 - 11/2/2016, Every day, AM Peak",328,144,743
"128","0 Shakti Mandir Marg, Block 10, Shakti Nagar, Delhi","158","484, Block E, Nimri Colony, Ashok Vihar, Delhi","11/2/2016 - 11/2/2016, Every day, AM Peak",471,244,905
"128","0 Shakti Mandir Marg, Block 10, Shakti Nagar, Delhi","159","300 Maharishi Balmiki Mandir Marg, Block H, Shakurpur Colony, Pitampura, Delhi","11/2/2016 - 11/2/2016, Every day, AM Peak",1059,695,1612
"128","0 Shakti Mandir Marg, Block 10, Shakti Nagar, Delhi","162","2400 Pt Govind Ram Shastri Marg, Ganeshpura, Tri Nagar, Delhi","11/2/2016 - 11/2/2016, Every day, AM Peak",794,506,1245
"128","0 Shakti Mandir Marg, Block 10, Shakti Nagar, Delhi","167","nullShaheed Udham Singh Marg, AE Block, Poorbi Shalimar Bag, Shalimar Bagh, Delhi","11/2/2016 - 11/2/2016, Every day, AM Peak",828,593,1154
"128","0 Shakti Mandir Marg, Block 10, Shakti Nagar, Delhi","170","nullColony Road, Block QP, Poorvi Pitampura, Pitampura, Delhi","11/2/2016 - 11/2/2016, Every day, AM Peak",1169,828,1649
"128","0 Shakti Mandir Marg, Block 10, Shakti Nagar, Delhi","188","12/188, Shastri Nagar, Geeta Colony, New Delhi","11/2/2016 - 11/2/2016, Every day, AM Peak",2056,1522,2777
"128","0 Shakti Mandir Marg, Block 10, Shakti Nagar, Delhi","189","F22, Block F, Krishna Nagar, Delhi","11/2/2016 - 11/2/2016, Every day, AM Peak",1950,1436,2646
"128","0 Shakti Mandir Marg, Block 10, Shakti Nagar, Delhi","193","Unnamed Road, Usmanpur, Shahdara, Delhi","11/2/2016 - 11/2/2016, Every day, AM Peak",1646,1092,2479
"128","0 Shakti Mandir Marg, Block 10, Shakti Nagar, Delhi","199","0 Shivaji Marg, New Moti Nagar, Najafgarh Road Industrial Area, Delhi","11/2/2016 - 11/2/2016, Every day, AM Peak",862,610,1216
"128","0 Shakti Mandir Marg, Block 10, Shakti Nagar, Delhi","204","0 East Patel Nagar Road, Block 10A, East Patel Nagar, Patel Nagar, New Delhi","11/2/2016 - 11/2/2016, Every day, AM Peak",802,489,1313
"128","0 Shakti Mandir Marg, Block 10, Shakti Nagar, Delhi","207","0 Maharana Pratap Road, Block 53, Karol Bagh, New Delhi","11/2/2016 - 11/2/2016, Every day, AM Peak",815,506,1311
"128","0 Shakti Mandir Marg, Block 10, Shakti Nagar, Delhi","208","Desh Bandhu Gupta Road, Block E, Jhandewalan Extension, Jhandewalan, New Delhi","11/2/2016 - 11/2/2016, Every day, AM Peak",1125,819,1543
"128","0 Shakti Mandir Marg, Block 10, Shakti Nagar, Delhi","209","nullMaharaja Agarsen Marg, Block A, CC Colony, Kalyan Vihar, नई दिल्ली","11/2/2016 - 11/2/2016, Every day, AM Peak",281,119,663
"128","0 Shakti Mandir Marg, Block 10, Shakti Nagar, Delhi","214","Doctor Bhim Rao Ambedkar Marg, Block H, Malka Ganj, Delhi","11/2/2016 - 11/2/2016, Every day, AM Peak",430,213,864
"128","0 Shakti Mandir Marg, Block 10, Shakti Nagar, Delhi","222","Sector E, Mahipalpur Village, Vasant Kunj, New Delhi","11/2/2016 - 11/2/2016, Every day, AM Peak",3444,2916,4066
"128","0 Shakti Mandir Marg, Block 10, Shakti Nagar, Delhi","223","Urban Extension Road II, Indira Gandhi International Airport, New Delhi","11/2/2016 - 11/2/2016, Every day, AM Peak",3627,3051,4311
"128","0 Shakti Mandir Marg, Block 10, Shakti Nagar, Delhi","227","300 Lok Marg, Dhaka Colony, Mukherjee Nagar, Delhi","11/2/2016 - 11/2/2016, Every day, AM Peak",418,185,941
"128","0 Shakti Mandir Marg, Block 10, Shakti Nagar, Delhi","228","0 Lucknow Road, Banarsi Das Estate, Timarpur, Delhi","11/2/2016 - 11/2/2016, Every day, AM Peak",422,183,968
"128","0 Shakti Mandir Marg, Block 10, Shakti Nagar, Delhi","229","200 Road Number 28, Nehru Nagar, Shivaji Place, Basai Dara pur, Tagore Garden Extension, New Delhi","11/2/2016 - 11/2/2016, Every day, AM Peak",1596,1074,2369
"128","0 Shakti Mandir Marg, Block 10, Shakti Nagar, Delhi","231","G-17/6, Block G, Rajouri Garden, New Delhi","11/2/2016 - 11/2/2016, Every day, AM Peak",1597,1147,2221
"128","0 Shakti Mandir Marg, Block 10, Shakti Nagar, Delhi","246","nullShiv Mandir Marg, Block G, Lajpat Nagar I, Lajpat Nagar, New Delhi","11/2/2016 - 11/2/2016, Every day, AM Peak",3225,2491,4173
"128","0 Shakti Mandir Marg, Block 10, Shakti Nagar, Delhi","248","Unnamed Road, Harijan Basti, Rajokri, New Delhi","11/2/2016 - 11/2/2016, Every day, AM Peak",3739,3151,4435
"128","0 Shakti Mandir Marg, Block 10, Shakti Nagar, Delhi","251","A25, Block R, Pocket A, Rajender Nagar Part 1, New Rajinder Nagar, New Delhi","11/2/2016 - 11/2/2016, Every day, AM Peak",1371,1040,1805
"128","0 Shakti Mandir Marg, Block 10, Shakti Nagar, Delhi","253","0 Chaudhary Harsukh Marg, B6, Block B6, Humayunpur, Safdarjung Enclave, New Delhi","11/2/2016 - 11/2/2016, Every day, AM Peak",3018,2067,4405
"128","0 Shakti Mandir Marg, Block 10, Shakti Nagar, Delhi","254","Squadron Leader Mohinder Kumar Jain Marg, Block B, New Delhi","11/2/2016 - 11/2/2016, Every day, AM Peak",3154,2194,4533
"128","0 Shakti Mandir Marg, Block 10, Shakti Nagar, Delhi","255","1700 Uday Chand Marg, Arya Basti, Zafar Nagar, Kotla Mubarakpur, South Extension I, New Delhi","11/2/2016 - 11/2/2016, Every day, AM Peak",2207,1851,2631
"128","0 Shakti Mandir Marg, Block 10, Shakti Nagar, Delhi","263","200 Pirwali Gali, Block P, Block P, Patparganj, New Delhi","11/2/2016 - 11/2/2016, Every day, AM Peak",2551,1970,3302
"128","0 Shakti Mandir Marg, Block 10, Shakti Nagar, Delhi","264","Noida Link Road, Nehru Enclave, Shakarpur Khas, New Delhi","11/2/2016 - 11/2/2016, Every day, AM Peak",2421,1850,3167
"128","0 Shakti Mandir Marg, Block 10, Shakti Nagar, Delhi","265","0 Lane Number 8, Krishan Kunj Extension Part 2, Block G, Vishwakarma Park, Laxmi Nagar, Delhi","11/2/2016 - 11/2/2016, Every day, AM Peak",2164,1614,2899
"128","0 Shakti Mandir Marg, Block 10, Shakti Nagar, Delhi","267","nullPanduk Shila Marg, Kaithwara Jagjivan Nagar, New Usmanpur, Shahdara, Delhi","11/2/2016 - 11/2/2016, Every day, AM Peak",1130,937,1362
"128","0 Shakti Mandir Marg, Block 10, Shakti Nagar, Delhi","282","Velodrome Road, Gandhi Smriti, Raj Ghat, New Delhi","11/2/2016 - 11/2/2016, Every day, AM Peak",1972,1522,2553
"128","0 Shakti Mandir Marg, Block 10, Shakti Nagar, Delhi","287","L47, Block L, Shastri Nagar, Delhi","11/2/2016 - 11/2/2016, Every day, AM Peak",306,126,739