"Origin Movement ID","Origin Display Name","Destination Movement ID","Destination Display Name","Date Range","Mean Travel Time (Seconds)","Range - Lower Bound Travel Time (Seconds)","Range - Upper Bound Travel Time (Seconds)"
"128","0 Shakti Mandir Marg, Block 10, Shakti Nagar, Delhi","3","Unnamed Road, Mahipalpur, New Delhi","11/3/2016 - 11/3/2016, Every day, AM Peak",2674,2260,3163
"128","0 Shakti Mandir Marg, Block 10, Shakti Nagar, Delhi","4","P-268/3, Rock View, Delhi Cantonment, Delhi","11/3/2016 - 11/3/2016, Every day, AM Peak",2799,2408,3252
"128","0 Shakti Mandir Marg, Block 10, Shakti Nagar, Delhi","5","Old Palam Road, Delhi Cantonment, New Delhi","11/3/2016 - 11/3/2016, Every day, AM Peak",2876,2448,3378
"128","0 Shakti Mandir Marg, Block 10, Shakti Nagar, Delhi","8","Mall Road, Khyber Lines, Delhi Cantonment, New Delhi","11/3/2016 - 11/3/2016, Every day, AM Peak",2351,1808,3056
"128","0 Shakti Mandir Marg, Block 10, Shakti Nagar, Delhi","9","Mahatma Jyothi Rao Phule Marg, Mahatma Jyoti Rao Phule Marg Area, New Delhi","11/3/2016 - 11/3/2016, Every day, AM Peak",1850,1335,2562
"128","0 Shakti Mandir Marg, Block 10, Shakti Nagar, Delhi","10","0 Shaheed Bhagat Singh Marg, DIZ Staff Quarters, Connaught Place, New Delhi","11/3/2016 - 11/3/2016, Every day, AM Peak",1359,1027,1796
"128","0 Shakti Mandir Marg, Block 10, Shakti Nagar, Delhi","11","Mother Teresa Crescent, Talkatora Garden, Central Ridge Reserve Forest, New Delhi","11/3/2016 - 11/3/2016, Every day, AM Peak",1588,1176,2143
"128","0 Shakti Mandir Marg, Block 10, Shakti Nagar, Delhi","12","Jantar Mantar Road, Janpath, Connaught Place, New Delhi","11/3/2016 - 11/3/2016, Every day, AM Peak",1631,1283,2072
"128","0 Shakti Mandir Marg, Block 10, Shakti Nagar, Delhi","13","10, Aurangzeb Road, New Delhi","11/3/2016 - 11/3/2016, Every day, AM Peak",2074,1602,2683
"128","0 Shakti Mandir Marg, Block 10, Shakti Nagar, Delhi","14","Mahatma Gandhi Road, Kidwai Nagar West, Kidwai Nagar, New Delhi","11/3/2016 - 11/3/2016, Every day, AM Peak",2647,2023,3462
"128","0 Shakti Mandir Marg, Block 10, Shakti Nagar, Delhi","16","Andre Malraux Marg, Ramnagar, Chanakyapuri, New Delhi","11/3/2016 - 11/3/2016, Every day, AM Peak",2174,1669,2830
"128","0 Shakti Mandir Marg, Block 10, Shakti Nagar, Delhi","17","0 Khanna Market Road, Aliganj, Lodi Colony, New Delhi","11/3/2016 - 11/3/2016, Every day, AM Peak",2330,1931,2810
"128","0 Shakti Mandir Marg, Block 10, Shakti Nagar, Delhi","18","Unnamed Road, Lal Qila, Chandni Chowk, New Delhi","11/3/2016 - 11/3/2016, Every day, AM Peak",1194,1062,1341
"128","0 Shakti Mandir Marg, Block 10, Shakti Nagar, Delhi","61","Unnamed Road, National Zoological Park, Sundar Nagar, New Delhi","11/3/2016 - 11/3/2016, Every day, AM Peak",2260,1745,2926
"128","0 Shakti Mandir Marg, Block 10, Shakti Nagar, Delhi","63","Jawaharlal Nehru Stadium Marg, CGO Complex, Pragati Vihar, New Delhi","11/3/2016 - 11/3/2016, Every day, AM Peak",2564,2062,3188
"128","0 Shakti Mandir Marg, Block 10, Shakti Nagar, Delhi","67","63/33, Hudco Place, Andrews Ganj Extension, Andrews Ganj, New Delhi","11/3/2016 - 11/3/2016, Every day, AM Peak",2662,2198,3223
"128","0 Shakti Mandir Marg, Block 10, Shakti Nagar, Delhi","70","G288, Sector 3, Block G, Nanak Pura, South Moti Bagh, New Delhi","11/3/2016 - 11/3/2016, Every day, AM Peak",2294,1732,3037
"128","0 Shakti Mandir Marg, Block 10, Shakti Nagar, Delhi","100","Maharishi Balmiki Marg, Police Colony, Sarai Khalil, Sadar Bazaar, New Delhi","11/3/2016 - 11/3/2016, Every day, AM Peak",937,677,1295
"128","0 Shakti Mandir Marg, Block 10, Shakti Nagar, Delhi","101","4900 Ramdwara Road, Chuna Mandi, Aram Bagh, Paharganj, New Delhi","11/3/2016 - 11/3/2016, Every day, AM Peak",1201,898,1605
"128","0 Shakti Mandir Marg, Block 10, Shakti Nagar, Delhi","103","nullDasghara Road, Dasghara, New Delhi","11/3/2016 - 11/3/2016, Every day, AM Peak",1788,1405,2274
"128","0 Shakti Mandir Marg, Block 10, Shakti Nagar, Delhi","123","Loknath Marg, Block M, Kirti Nagar, New Delhi","11/3/2016 - 11/3/2016, Every day, AM Peak",1240,872,1763
"128","0 Shakti Mandir Marg, Block 10, Shakti Nagar, Delhi","124","30, 31, Block B, Mansarover Garden, New Delhi","11/3/2016 - 11/3/2016, Every day, AM Peak",2026,1393,2946
"128","0 Shakti Mandir Marg, Block 10, Shakti Nagar, Delhi","126","nullSwami Narayan Underpass Road, Block E, Sangam Park, Ashok Vihar, Delhi","11/3/2016 - 11/3/2016, Every day, AM Peak",648,423,992
"128","0 Shakti Mandir Marg, Block 10, Shakti Nagar, Delhi","127","NDPL House, Lala Achintaram Marg, Block B, Gujranwala Town, Delhi","11/3/2016 - 11/3/2016, Every day, AM Peak",770,466,1272
"128","0 Shakti Mandir Marg, Block 10, Shakti Nagar, Delhi","129","Gali Number 8, Anand Parbat, New Delhi","11/3/2016 - 11/3/2016, Every day, AM Peak",515,306,865
"128","0 Shakti Mandir Marg, Block 10, Shakti Nagar, Delhi","130","Bhagat Singh Marg, Kashmiri Bagh, Chandra Shekhar Azad Colony, Sarai Rohilla, New Delhi","11/3/2016 - 11/3/2016, Every day, AM Peak",264,99,698
"128","0 Shakti Mandir Marg, Block 10, Shakti Nagar, Delhi","131","4400 Gali Bahuji, Pahari Dhiraj, Sadar Bazaar, Delhi","11/3/2016 - 11/3/2016, Every day, AM Peak",634,405,992
"128","0 Shakti Mandir Marg, Block 10, Shakti Nagar, Delhi","132","1600 Lothian Road, Chabi Ganj, Kashmere Gate, New Delhi","11/3/2016 - 11/3/2016, Every day, AM Peak",1151,832,1590
"128","0 Shakti Mandir Marg, Block 10, Shakti Nagar, Delhi","133","0 Raj Niwas Marg, Ludlow Castle, Civil Lines, Delhi","11/3/2016 - 11/3/2016, Every day, AM Peak",770,508,1165
"128","0 Shakti Mandir Marg, Block 10, Shakti Nagar, Delhi","135","0 Uggarsen Market Road, Meenakshi Garden, Ashok Nagar, Delhi","11/3/2016 - 11/3/2016, Every day, AM Peak",2135,1768,2576
"128","0 Shakti Mandir Marg, Block 10, Shakti Nagar, Delhi","148","Unnamed Road, Patparganj, New Delhi","11/3/2016 - 11/3/2016, Every day, AM Peak",2354,2012,2753
"128","0 Shakti Mandir Marg, Block 10, Shakti Nagar, Delhi","155","Maharaja Agaersen Road, Block D, Pocket D, Phase 1, Ashok Vihar, Delhi","11/3/2016 - 11/3/2016, Every day, AM Peak",793,345,1821
"128","0 Shakti Mandir Marg, Block 10, Shakti Nagar, Delhi","156","Doctor Satpal Sachdeva Marg, Keshav Puram, Tri Nagar, Delhi","11/3/2016 - 11/3/2016, Every day, AM Peak",779,438,1383
"128","0 Shakti Mandir Marg, Block 10, Shakti Nagar, Delhi","157","CH Devender Singh Tewatia Marg, Ashok Vihar II, Pocket B 1, Phase 3, Ashok Vihar, Delhi","11/3/2016 - 11/3/2016, Every day, AM Peak",314,174,564
"128","0 Shakti Mandir Marg, Block 10, Shakti Nagar, Delhi","158","484, Block E, Nimri Colony, Ashok Vihar, Delhi","11/3/2016 - 11/3/2016, Every day, AM Peak",485,205,1145
"128","0 Shakti Mandir Marg, Block 10, Shakti Nagar, Delhi","159","300 Maharishi Balmiki Mandir Marg, Block H, Shakurpur Colony, Pitampura, Delhi","11/3/2016 - 11/3/2016, Every day, AM Peak",1269,962,1672
"128","0 Shakti Mandir Marg, Block 10, Shakti Nagar, Delhi","170","nullColony Road, Block QP, Poorvi Pitampura, Pitampura, Delhi","11/3/2016 - 11/3/2016, Every day, AM Peak",1270,965,1670
"128","0 Shakti Mandir Marg, Block 10, Shakti Nagar, Delhi","188","12/188, Shastri Nagar, Geeta Colony, New Delhi","11/3/2016 - 11/3/2016, Every day, AM Peak",1850,1447,2364
"128","0 Shakti Mandir Marg, Block 10, Shakti Nagar, Delhi","189","F22, Block F, Krishna Nagar, Delhi","11/3/2016 - 11/3/2016, Every day, AM Peak",1740,1371,2207
"128","0 Shakti Mandir Marg, Block 10, Shakti Nagar, Delhi","191","0 Hasanpur, I.P.Extension, Patparganj, Delhi","11/3/2016 - 11/3/2016, Every day, AM Peak",2761,2172,3509
"128","0 Shakti Mandir Marg, Block 10, Shakti Nagar, Delhi","193","Unnamed Road, Usmanpur, Shahdara, Delhi","11/3/2016 - 11/3/2016, Every day, AM Peak",1574,1160,2135
"128","0 Shakti Mandir Marg, Block 10, Shakti Nagar, Delhi","199","0 Shivaji Marg, New Moti Nagar, Najafgarh Road Industrial Area, Delhi","11/3/2016 - 11/3/2016, Every day, AM Peak",906,629,1303
"128","0 Shakti Mandir Marg, Block 10, Shakti Nagar, Delhi","204","0 East Patel Nagar Road, Block 10A, East Patel Nagar, Patel Nagar, New Delhi","11/3/2016 - 11/3/2016, Every day, AM Peak",880,528,1466
"128","0 Shakti Mandir Marg, Block 10, Shakti Nagar, Delhi","206","0 Arya Samaj Road, Block 12B, Dev Nagar, Karol Bagh, New Delhi","11/3/2016 - 11/3/2016, Every day, AM Peak",869,643,1173
"128","0 Shakti Mandir Marg, Block 10, Shakti Nagar, Delhi","207","0 Maharana Pratap Road, Block 53, Karol Bagh, New Delhi","11/3/2016 - 11/3/2016, Every day, AM Peak",804,522,1237
"128","0 Shakti Mandir Marg, Block 10, Shakti Nagar, Delhi","208","Desh Bandhu Gupta Road, Block E, Jhandewalan Extension, Jhandewalan, New Delhi","11/3/2016 - 11/3/2016, Every day, AM Peak",1100,803,1505
"128","0 Shakti Mandir Marg, Block 10, Shakti Nagar, Delhi","209","nullMaharaja Agarsen Marg, Block A, CC Colony, Kalyan Vihar, नई दिल्ली","11/3/2016 - 11/3/2016, Every day, AM Peak",281,143,548
"128","0 Shakti Mandir Marg, Block 10, Shakti Nagar, Delhi","214","Doctor Bhim Rao Ambedkar Marg, Block H, Malka Ganj, Delhi","11/3/2016 - 11/3/2016, Every day, AM Peak",368,197,685
"128","0 Shakti Mandir Marg, Block 10, Shakti Nagar, Delhi","222","Sector E, Mahipalpur Village, Vasant Kunj, New Delhi","11/3/2016 - 11/3/2016, Every day, AM Peak",3384,2881,3973
"128","0 Shakti Mandir Marg, Block 10, Shakti Nagar, Delhi","223","Urban Extension Road II, Indira Gandhi International Airport, New Delhi","11/3/2016 - 11/3/2016, Every day, AM Peak",3634,3121,4230
"128","0 Shakti Mandir Marg, Block 10, Shakti Nagar, Delhi","227","300 Lok Marg, Dhaka Colony, Mukherjee Nagar, Delhi","11/3/2016 - 11/3/2016, Every day, AM Peak",480,223,1033
"128","0 Shakti Mandir Marg, Block 10, Shakti Nagar, Delhi","228","0 Lucknow Road, Banarsi Das Estate, Timarpur, Delhi","11/3/2016 - 11/3/2016, Every day, AM Peak",417,175,991
"128","0 Shakti Mandir Marg, Block 10, Shakti Nagar, Delhi","229","200 Road Number 28, Nehru Nagar, Shivaji Place, Basai Dara pur, Tagore Garden Extension, New Delhi","11/3/2016 - 11/3/2016, Every day, AM Peak",1816,1199,2749
"128","0 Shakti Mandir Marg, Block 10, Shakti Nagar, Delhi","231","G-17/6, Block G, Rajouri Garden, New Delhi","11/3/2016 - 11/3/2016, Every day, AM Peak",1998,1447,2758
"128","0 Shakti Mandir Marg, Block 10, Shakti Nagar, Delhi","244","Dhingra Park Trail, Punjabi Bagh Cooperative Housing Soceity, East Punjabi Bagh, Punjabi Bagh, Delhi","11/3/2016 - 11/3/2016, Every day, AM Peak",860,666,1109
"128","0 Shakti Mandir Marg, Block 10, Shakti Nagar, Delhi","246","nullShiv Mandir Marg, Block G, Lajpat Nagar I, Lajpat Nagar, New Delhi","11/3/2016 - 11/3/2016, Every day, AM Peak",2648,2190,3200
"128","0 Shakti Mandir Marg, Block 10, Shakti Nagar, Delhi","248","Unnamed Road, Harijan Basti, Rajokri, New Delhi","11/3/2016 - 11/3/2016, Every day, AM Peak",3701,3167,4324
"128","0 Shakti Mandir Marg, Block 10, Shakti Nagar, Delhi","251","A25, Block R, Pocket A, Rajender Nagar Part 1, New Rajinder Nagar, New Delhi","11/3/2016 - 11/3/2016, Every day, AM Peak",1389,1015,1900
"128","0 Shakti Mandir Marg, Block 10, Shakti Nagar, Delhi","252","813, Sector 1, RK Puram, New Delhi","11/3/2016 - 11/3/2016, Every day, AM Peak",3293,2304,4704
"128","0 Shakti Mandir Marg, Block 10, Shakti Nagar, Delhi","253","0 Chaudhary Harsukh Marg, B6, Block B6, Humayunpur, Safdarjung Enclave, New Delhi","11/3/2016 - 11/3/2016, Every day, AM Peak",2849,2480,3272
"128","0 Shakti Mandir Marg, Block 10, Shakti Nagar, Delhi","255","1700 Uday Chand Marg, Arya Basti, Zafar Nagar, Kotla Mubarakpur, South Extension I, New Delhi","11/3/2016 - 11/3/2016, Every day, AM Peak",2414,2007,2903
"128","0 Shakti Mandir Marg, Block 10, Shakti Nagar, Delhi","263","200 Pirwali Gali, Block P, Block P, Patparganj, New Delhi","11/3/2016 - 11/3/2016, Every day, AM Peak",2181,1822,2610
"128","0 Shakti Mandir Marg, Block 10, Shakti Nagar, Delhi","264","Noida Link Road, Nehru Enclave, Shakarpur Khas, New Delhi","11/3/2016 - 11/3/2016, Every day, AM Peak",2033,1694,2439
"128","0 Shakti Mandir Marg, Block 10, Shakti Nagar, Delhi","265","0 Lane Number 8, Krishan Kunj Extension Part 2, Block G, Vishwakarma Park, Laxmi Nagar, Delhi","11/3/2016 - 11/3/2016, Every day, AM Peak",1929,1556,2391
"128","0 Shakti Mandir Marg, Block 10, Shakti Nagar, Delhi","282","Velodrome Road, Gandhi Smriti, Raj Ghat, New Delhi","11/3/2016 - 11/3/2016, Every day, AM Peak",1713,1350,2172
"128","0 Shakti Mandir Marg, Block 10, Shakti Nagar, Delhi","287","L47, Block L, Shastri Nagar, Delhi","11/3/2016 - 11/3/2016, Every day, AM Peak",323,131,796