"Origin Movement ID","Origin Display Name","Destination Movement ID","Destination Display Name","Date Range","Mean Travel Time (Seconds)","Range - Lower Bound Travel Time (Seconds)","Range - Upper Bound Travel Time (Seconds)"
"240","37, Sector 15, Pocket 6, Sector 15B, Rohini, Delhi","1","300 Ring Road, Block CB, Naraina Village, Naraina, New Delhi","11/1/2016 - 11/1/2016, Every day, AM Peak",1820,1295,2556
"240","37, Sector 15, Pocket 6, Sector 15B, Rohini, Delhi","2","Unnamed Road, Delhi Cantonment, New Delhi","11/1/2016 - 11/1/2016, Every day, AM Peak",1926,1370,2706
"240","37, Sector 15, Pocket 6, Sector 15B, Rohini, Delhi","3","Unnamed Road, Mahipalpur, New Delhi","11/1/2016 - 11/1/2016, Every day, AM Peak",2966,1939,4535
"240","37, Sector 15, Pocket 6, Sector 15B, Rohini, Delhi","4","P-268/3, Rock View, Delhi Cantonment, Delhi","11/1/2016 - 11/1/2016, Every day, AM Peak",2873,1899,4345
"240","37, Sector 15, Pocket 6, Sector 15B, Rohini, Delhi","5","Old Palam Road, Delhi Cantonment, New Delhi","11/1/2016 - 11/1/2016, Every day, AM Peak",2795,2028,3850
"240","37, Sector 15, Pocket 6, Sector 15B, Rohini, Delhi","8","Mall Road, Khyber Lines, Delhi Cantonment, New Delhi","11/1/2016 - 11/1/2016, Every day, AM Peak",2243,1540,3266
"240","37, Sector 15, Pocket 6, Sector 15B, Rohini, Delhi","9","Mahatma Jyothi Rao Phule Marg, Mahatma Jyoti Rao Phule Marg Area, New Delhi","11/1/2016 - 11/1/2016, Every day, AM Peak",2926,2098,4079
"240","37, Sector 15, Pocket 6, Sector 15B, Rohini, Delhi","11","Mother Teresa Crescent, Talkatora Garden, Central Ridge Reserve Forest, New Delhi","11/1/2016 - 11/1/2016, Every day, AM Peak",2676,1712,4182
"240","37, Sector 15, Pocket 6, Sector 15B, Rohini, Delhi","12","Jantar Mantar Road, Janpath, Connaught Place, New Delhi","11/1/2016 - 11/1/2016, Every day, AM Peak",2679,2313,3102
"240","37, Sector 15, Pocket 6, Sector 15B, Rohini, Delhi","13","10, Aurangzeb Road, New Delhi","11/1/2016 - 11/1/2016, Every day, AM Peak",3269,2351,4544
"240","37, Sector 15, Pocket 6, Sector 15B, Rohini, Delhi","14","Mahatma Gandhi Road, Kidwai Nagar West, Kidwai Nagar, New Delhi","11/1/2016 - 11/1/2016, Every day, AM Peak",2653,1965,3580
"240","37, Sector 15, Pocket 6, Sector 15B, Rohini, Delhi","16","Andre Malraux Marg, Ramnagar, Chanakyapuri, New Delhi","11/1/2016 - 11/1/2016, Every day, AM Peak",2426,1678,3507
"240","37, Sector 15, Pocket 6, Sector 15B, Rohini, Delhi","18","Unnamed Road, Lal Qila, Chandni Chowk, New Delhi","11/1/2016 - 11/1/2016, Every day, AM Peak",1507,1257,1805
"240","37, Sector 15, Pocket 6, Sector 15B, Rohini, Delhi","19","Mirdard Road, 64 Khamba, Maulana Azad Medical College Campus, New Delhi","11/1/2016 - 11/1/2016, Every day, AM Peak",1972,1655,2349
"240","37, Sector 15, Pocket 6, Sector 15B, Rohini, Delhi","24","268, Block B2, Shiv Nagar, Janakpuri, New Delhi","11/1/2016 - 11/1/2016, Every day, AM Peak",1632,1202,2215
"240","37, Sector 15, Pocket 6, Sector 15B, Rohini, Delhi","25","nullNehru Vihar Road, B Block, A Block, Nehru Vihar, Mukherjee Nagar, Delhi","11/1/2016 - 11/1/2016, Every day, AM Peak",756,562,1015
"240","37, Sector 15, Pocket 6, Sector 15B, Rohini, Delhi","26","A3-214, Asalatpur Village, Janakpuri, Delhi","11/1/2016 - 11/1/2016, Every day, AM Peak",1550,1070,2244
"240","37, Sector 15, Pocket 6, Sector 15B, Rohini, Delhi","27","0 Ram Mandir Marg, C5B Block, Janakpuri, New Delhi","11/1/2016 - 11/1/2016, Every day, AM Peak",1739,1320,2289
"240","37, Sector 15, Pocket 6, Sector 15B, Rohini, Delhi","28","nullSchool Road, Block M, Uttam Nagar, Delhi","11/1/2016 - 11/1/2016, Every day, AM Peak",1897,1312,2742
"240","37, Sector 15, Pocket 6, Sector 15B, Rohini, Delhi","29","Street Number 14, Block C, Sitapuri Part 1, Janakpuri, New Delhi","11/1/2016 - 11/1/2016, Every day, AM Peak",1655,1301,2105
"240","37, Sector 15, Pocket 6, Sector 15B, Rohini, Delhi","32","METRO MALL, Pocket 1, Sector 14 Dwarka, Dwarka, New Delhi","11/1/2016 - 11/1/2016, Every day, AM Peak",2733,2496,2991
"240","37, Sector 15, Pocket 6, Sector 15B, Rohini, Delhi","34","5/3, East Nathu Colony, GTB Enclave, Dilshad Garden, Delhi","11/1/2016 - 11/1/2016, Every day, AM Peak",2456,1771,3404
"240","37, Sector 15, Pocket 6, Sector 15B, Rohini, Delhi","40","Gali Saini Tent, Ram Nagar, Shahdara, Delhi","11/1/2016 - 11/1/2016, Every day, AM Peak",2111,1715,2598
"240","37, Sector 15, Pocket 6, Sector 15B, Rohini, Delhi","41","Lala Raghubar Dayal Marg, Phase 4, Block B, Subhash Park, Shahdara, Delhi","11/1/2016 - 11/1/2016, Every day, AM Peak",2048,1661,2523
"240","37, Sector 15, Pocket 6, Sector 15B, Rohini, Delhi","43","A537, New Seelampur Phase II, New Seelampur, Shahdara, Delhi","11/1/2016 - 11/1/2016, Every day, AM Peak",1808,1437,2274
"240","37, Sector 15, Pocket 6, Sector 15B, Rohini, Delhi","46","256, Block C 2, Bhajanpura, Tukhmirpur, Delhi","11/1/2016 - 11/1/2016, Every day, AM Peak",3281,2055,5237
"240","37, Sector 15, Pocket 6, Sector 15B, Rohini, Delhi","58","Pushta Road, Block A, Rajiv Nagar, Sonia Vihar, Delhi","11/1/2016 - 11/1/2016, Every day, AM Peak",1835,1253,2686
"240","37, Sector 15, Pocket 6, Sector 15B, Rohini, Delhi","61","Unnamed Road, National Zoological Park, Sundar Nagar, New Delhi","11/1/2016 - 11/1/2016, Every day, AM Peak",2360,1814,3069
"240","37, Sector 15, Pocket 6, Sector 15B, Rohini, Delhi","63","Jawaharlal Nehru Stadium Marg, CGO Complex, Pragati Vihar, New Delhi","11/1/2016 - 11/1/2016, Every day, AM Peak",3011,2379,3810
"240","37, Sector 15, Pocket 6, Sector 15B, Rohini, Delhi","65","Shaheed Jeet Singh Marg, NCERT Campus, Qutab Institutional Area, New Delhi","11/1/2016 - 11/1/2016, Every day, AM Peak",3531,2778,4487
"240","37, Sector 15, Pocket 6, Sector 15B, Rohini, Delhi","70","G288, Sector 3, Block G, Nanak Pura, South Moti Bagh, New Delhi","11/1/2016 - 11/1/2016, Every day, AM Peak",2359,1626,3420
"240","37, Sector 15, Pocket 6, Sector 15B, Rohini, Delhi","84","nullMathura Road, Friends Colony West, Block A, New Friends Colony, New Delhi","11/1/2016 - 11/1/2016, Every day, AM Peak",2613,2268,3010
"240","37, Sector 15, Pocket 6, Sector 15B, Rohini, Delhi","91","nullTum Road, Sanjay Colony II, Sanjay Colony, Okhla Phase II, Okhla Industrial Area, New Delhi","11/1/2016 - 11/1/2016, Every day, AM Peak",3284,2469,4367
"240","37, Sector 15, Pocket 6, Sector 15B, Rohini, Delhi","103","nullDasghara Road, Dasghara, New Delhi","11/1/2016 - 11/1/2016, Every day, AM Peak",1961,1309,2937
"240","37, Sector 15, Pocket 6, Sector 15B, Rohini, Delhi","105","nullGoswami Girdhari Lal Marg, Industrial Area Phase I, Block C, Naraina Industrial Area Phase 1, Naraina, New Delhi","11/1/2016 - 11/1/2016, Every day, AM Peak",1719,1198,2464
"240","37, Sector 15, Pocket 6, Sector 15B, Rohini, Delhi","112","F-8, West Chandra Nagar, Chander Nagar, Krishna Nagar, Delhi","11/1/2016 - 11/1/2016, Every day, AM Peak",1863,1698,2043
"240","37, Sector 15, Pocket 6, Sector 15B, Rohini, Delhi","116","9/5284, Shanti Mohalla, Seelampur, Shahdara, Delhi","11/1/2016 - 11/1/2016, Every day, AM Peak",1923,1518,2434
"240","37, Sector 15, Pocket 6, Sector 15B, Rohini, Delhi","119","81, Zulfe Bengal, Dilshad Garden, Delhi","11/1/2016 - 11/1/2016, Every day, AM Peak",2328,1861,2911
"240","37, Sector 15, Pocket 6, Sector 15B, Rohini, Delhi","120","50, Pocket J & K, Dilshad Garden, Delhi","11/1/2016 - 11/1/2016, Every day, AM Peak",2358,2137,2601
"240","37, Sector 15, Pocket 6, Sector 15B, Rohini, Delhi","121","22/55, West Punjabi Bagh, Punjabi Bagh, Delhi","11/1/2016 - 11/1/2016, Every day, AM Peak",1165,871,1557
"240","37, Sector 15, Pocket 6, Sector 15B, Rohini, Delhi","122","2600 Mandir Wali Gali, Ranjeet Nagar, Shadipur, Delhi","11/1/2016 - 11/1/2016, Every day, AM Peak",1616,1197,2180
"240","37, Sector 15, Pocket 6, Sector 15B, Rohini, Delhi","123","Loknath Marg, Block M, Kirti Nagar, New Delhi","11/1/2016 - 11/1/2016, Every day, AM Peak",1377,1009,1879
"240","37, Sector 15, Pocket 6, Sector 15B, Rohini, Delhi","124","30, 31, Block B, Mansarover Garden, New Delhi","11/1/2016 - 11/1/2016, Every day, AM Peak",1429,1062,1922
"240","37, Sector 15, Pocket 6, Sector 15B, Rohini, Delhi","128","0 Shakti Mandir Marg, Block 10, Shakti Nagar, Delhi","11/1/2016 - 11/1/2016, Every day, AM Peak",1661,1342,2054
"240","37, Sector 15, Pocket 6, Sector 15B, Rohini, Delhi","129","Gali Number 8, Anand Parbat, New Delhi","11/1/2016 - 11/1/2016, Every day, AM Peak",1329,1002,1761
"240","37, Sector 15, Pocket 6, Sector 15B, Rohini, Delhi","132","1600 Lothian Road, Chabi Ganj, Kashmere Gate, New Delhi","11/1/2016 - 11/1/2016, Every day, AM Peak",1228,972,1550
"240","37, Sector 15, Pocket 6, Sector 15B, Rohini, Delhi","133","0 Raj Niwas Marg, Ludlow Castle, Civil Lines, Delhi","11/1/2016 - 11/1/2016, Every day, AM Peak",991,763,1286
"240","37, Sector 15, Pocket 6, Sector 15B, Rohini, Delhi","136","nullKeshopur Road, New Chaukhandi, Paschim Vihar, Delhi","11/1/2016 - 11/1/2016, Every day, AM Peak",1172,808,1698
"240","37, Sector 15, Pocket 6, Sector 15B, Rohini, Delhi","137","nullRoad Number 235, Block H, Vikaspuri, Delhi","11/1/2016 - 11/1/2016, Every day, AM Peak",1142,840,1551
"240","37, Sector 15, Pocket 6, Sector 15B, Rohini, Delhi","139","nullBudh Bazar Road, Nawada, Nawada Majra Village, Nawada, Delhi","11/1/2016 - 11/1/2016, Every day, AM Peak",2153,1929,2401
"240","37, Sector 15, Pocket 6, Sector 15B, Rohini, Delhi","140","A12/B, Sainik Nagar, Mansa Ram Park, Uttam Nagar, Delhi","11/1/2016 - 11/1/2016, Every day, AM Peak",2364,2019,2767
"240","37, Sector 15, Pocket 6, Sector 15B, Rohini, Delhi","142","Gali Number 1, Dabri Village, Dabri, New Delhi","11/1/2016 - 11/1/2016, Every day, AM Peak",1779,1346,2349
"240","37, Sector 15, Pocket 6, Sector 15B, Rohini, Delhi","143","nullRoad Number 221, Pocket 1, Sector 10 Dwarka, Dwarka, Delhi","11/1/2016 - 11/1/2016, Every day, AM Peak",2619,2317,2959
"240","37, Sector 15, Pocket 6, Sector 15B, Rohini, Delhi","146","nullKotla Road, Pocket F2, Pocket 1, Sector 11F, Rohini, Delhi","11/1/2016 - 11/1/2016, Every day, AM Peak",442,198,983
"240","37, Sector 15, Pocket 6, Sector 15B, Rohini, Delhi","148","Unnamed Road, Patparganj, New Delhi","11/1/2016 - 11/1/2016, Every day, AM Peak",2246,1880,2681
"240","37, Sector 15, Pocket 6, Sector 15B, Rohini, Delhi","154","nullGali Number 6, Block B, Block D, Vinod Nagar North, Delhi","11/1/2016 - 11/1/2016, Every day, AM Peak",1987,1733,2277
"240","37, Sector 15, Pocket 6, Sector 15B, Rohini, Delhi","155","Maharaja Agaersen Road, Block D, Pocket D, Phase 1, Ashok Vihar, Delhi","11/1/2016 - 11/1/2016, Every day, AM Peak",1098,900,1338
"240","37, Sector 15, Pocket 6, Sector 15B, Rohini, Delhi","156","Doctor Satpal Sachdeva Marg, Keshav Puram, Tri Nagar, Delhi","11/1/2016 - 11/1/2016, Every day, AM Peak",882,614,1265
"240","37, Sector 15, Pocket 6, Sector 15B, Rohini, Delhi","157","CH Devender Singh Tewatia Marg, Ashok Vihar II, Pocket B 1, Phase 3, Ashok Vihar, Delhi","11/1/2016 - 11/1/2016, Every day, AM Peak",1284,1052,1565
"240","37, Sector 15, Pocket 6, Sector 15B, Rohini, Delhi","158","484, Block E, Nimri Colony, Ashok Vihar, Delhi","11/1/2016 - 11/1/2016, Every day, AM Peak",1248,1030,1511
"240","37, Sector 15, Pocket 6, Sector 15B, Rohini, Delhi","159","300 Maharishi Balmiki Mandir Marg, Block H, Shakurpur Colony, Pitampura, Delhi","11/1/2016 - 11/1/2016, Every day, AM Peak",833,561,1234
"240","37, Sector 15, Pocket 6, Sector 15B, Rohini, Delhi","160","23, Shiva Enclave, Pitampura, Delhi","11/1/2016 - 11/1/2016, Every day, AM Peak",506,233,1098
"240","37, Sector 15, Pocket 6, Sector 15B, Rohini, Delhi","161","nullLawrence Road, Rampura Industrial Area, Tri Nagar, Delhi","11/1/2016 - 11/1/2016, Every day, AM Peak",1061,718,1566
"240","37, Sector 15, Pocket 6, Sector 15B, Rohini, Delhi","162","2400 Pt Govind Ram Shastri Marg, Ganeshpura, Tri Nagar, Delhi","11/1/2016 - 11/1/2016, Every day, AM Peak",1012,804,1272
"240","37, Sector 15, Pocket 6, Sector 15B, Rohini, Delhi","163","0 Guru Harkishan Marg, Maulana Azad Society, Bhagwan Buddha Housing Corporation Society, Pitampura, Delhi","11/1/2016 - 11/1/2016, Every day, AM Peak",672,360,1253
"240","37, Sector 15, Pocket 6, Sector 15B, Rohini, Delhi","164","Shakurbasti Pedestrian Foot Over Bridge, Shakur Basti Railway Colony, Railway Colony South, Pitampura, Delhi","11/1/2016 - 11/1/2016, Every day, AM Peak",1213,673,2185
"240","37, Sector 15, Pocket 6, Sector 15B, Rohini, Delhi","165","31, Cottage Enclave, Paschim Vihar, Delhi","11/1/2016 - 11/1/2016, Every day, AM Peak",831,553,1247
"240","37, Sector 15, Pocket 6, Sector 15B, Rohini, Delhi","166","nullRBI Enclave Road, Ankur Enclave, Paschim Vihar, Delhi","11/1/2016 - 11/1/2016, Every day, AM Peak",988,673,1450
"240","37, Sector 15, Pocket 6, Sector 15B, Rohini, Delhi","167","nullShaheed Udham Singh Marg, AE Block, Poorbi Shalimar Bag, Shalimar Bagh, Delhi","11/1/2016 - 11/1/2016, Every day, AM Peak",1054,743,1493
"240","37, Sector 15, Pocket 6, Sector 15B, Rohini, Delhi","168","nullGyan Shakti Mandir Marg, Block BA, West Shalimar Bagh, Shalimar Bagh, Delhi","11/1/2016 - 11/1/2016, Every day, AM Peak",834,546,1272
"240","37, Sector 15, Pocket 6, Sector 15B, Rohini, Delhi","169","G-9, Block F 1U, Ranikhet, Pitampura, Delhi","11/1/2016 - 11/1/2016, Every day, AM Peak",317,80,1254
"240","37, Sector 15, Pocket 6, Sector 15B, Rohini, Delhi","170","nullColony Road, Block QP, Poorvi Pitampura, Pitampura, Delhi","11/1/2016 - 11/1/2016, Every day, AM Peak",495,229,1066
"240","37, Sector 15, Pocket 6, Sector 15B, Rohini, Delhi","171","nullG Block Road, Pocket 21, Sector 7G, Rohini, Delhi","11/1/2016 - 11/1/2016, Every day, AM Peak",496,281,873
"240","37, Sector 15, Pocket 6, Sector 15B, Rohini, Delhi","172","nullShiva Road, Pocket 14, Sector 8D, Rohini, Delhi","11/1/2016 - 11/1/2016, Every day, AM Peak",340,123,938
"240","37, Sector 15, Pocket 6, Sector 15B, Rohini, Delhi","173","Unnamed Road, Swarn Jayanti Park, Sector 10, Rohini, Delhi","11/1/2016 - 11/1/2016, Every day, AM Peak",197,60,636
"240","37, Sector 15, Pocket 6, Sector 15B, Rohini, Delhi","175","235, Block E, Block E, Mangolpuri, Delhi","11/1/2016 - 11/1/2016, Every day, AM Peak",678,441,1041
"240","37, Sector 15, Pocket 6, Sector 15B, Rohini, Delhi","176","B7-187, Pocket 7, Sector 3B, Rohini, Delhi","11/1/2016 - 11/1/2016, Every day, AM Peak",549,329,914
"240","37, Sector 15, Pocket 6, Sector 15B, Rohini, Delhi","179","0 AB Road, Block RR, Mianwali Nagar, Paschim Vihar, Delhi","11/1/2016 - 11/1/2016, Every day, AM Peak",693,471,1018
"240","37, Sector 15, Pocket 6, Sector 15B, Rohini, Delhi","180","GH-14/234, GH 14, Block GH 14, Paschim Vihar, Delhi","11/1/2016 - 11/1/2016, Every day, AM Peak",1143,839,1555
"240","37, Sector 15, Pocket 6, Sector 15B, Rohini, Delhi","186","14, Sector 21, Rohini, Delhi","11/1/2016 - 11/1/2016, Every day, AM Peak",1383,972,1966
"240","37, Sector 15, Pocket 6, Sector 15B, Rohini, Delhi","188","12/188, Shastri Nagar, Geeta Colony, New Delhi","11/1/2016 - 11/1/2016, Every day, AM Peak",1678,1406,2002
"240","37, Sector 15, Pocket 6, Sector 15B, Rohini, Delhi","189","F22, Block F, Krishna Nagar, Delhi","11/1/2016 - 11/1/2016, Every day, AM Peak",1582,1342,1863
"240","37, Sector 15, Pocket 6, Sector 15B, Rohini, Delhi","190","F-33, Block F, Preet Vihar, Delhi","11/1/2016 - 11/1/2016, Every day, AM Peak",2284,1979,2634
"240","37, Sector 15, Pocket 6, Sector 15B, Rohini, Delhi","191","0 Hasanpur, I.P.Extension, Patparganj, Delhi","11/1/2016 - 11/1/2016, Every day, AM Peak",2379,1937,2920
"240","37, Sector 15, Pocket 6, Sector 15B, Rohini, Delhi","192","0 Bhartendu Harish Chandra Marg, Ram Vihar, Anand Vihar, Delhi","11/1/2016 - 11/1/2016, Every day, AM Peak",2474,2069,2957
"240","37, Sector 15, Pocket 6, Sector 15B, Rohini, Delhi","193","Unnamed Road, Usmanpur, Shahdara, Delhi","11/1/2016 - 11/1/2016, Every day, AM Peak",1505,1183,1914
"240","37, Sector 15, Pocket 6, Sector 15B, Rohini, Delhi","194","nullGali Number 1, Block G, Block A, Shakarpur, Delhi","11/1/2016 - 11/1/2016, Every day, AM Peak",2867,1935,4245
"240","37, Sector 15, Pocket 6, Sector 15B, Rohini, Delhi","195","F-208/C, Block F, Laxmi Nagar, New Delhi","11/1/2016 - 11/1/2016, Every day, AM Peak",2258,1645,3099
"240","37, Sector 15, Pocket 6, Sector 15B, Rohini, Delhi","196","nullSir Chotu Ram Marg, Pocket 4, Sector 6C, Rohini, Delhi","11/1/2016 - 11/1/2016, Every day, AM Peak",696,410,1178
"240","37, Sector 15, Pocket 6, Sector 15B, Rohini, Delhi","199","0 Shivaji Marg, New Moti Nagar, Najafgarh Road Industrial Area, Delhi","11/1/2016 - 11/1/2016, Every day, AM Peak",1256,975,1617
"240","37, Sector 15, Pocket 6, Sector 15B, Rohini, Delhi","200","Dabri - Gurgaon Road, Pocket 2, Sector 1 Dwarka, Dwarka, New Delhi","11/1/2016 - 11/1/2016, Every day, AM Peak",2193,1651,2911
"240","37, Sector 15, Pocket 6, Sector 15B, Rohini, Delhi","204","0 East Patel Nagar Road, Block 10A, East Patel Nagar, Patel Nagar, New Delhi","11/1/2016 - 11/1/2016, Every day, AM Peak",1724,1326,2241
"240","37, Sector 15, Pocket 6, Sector 15B, Rohini, Delhi","205","2100 Gali Number 14, Block B, Prem Nagar, Patel Nagar, New Delhi","11/1/2016 - 11/1/2016, Every day, AM Peak",1521,1113,2078
"240","37, Sector 15, Pocket 6, Sector 15B, Rohini, Delhi","212","Bawana Road, Sector 30, Rohini, Delhi","11/1/2016 - 11/1/2016, Every day, AM Peak",651,410,1033
"240","37, Sector 15, Pocket 6, Sector 15B, Rohini, Delhi","215","Unnamed Road, Bagiabad, Jharoda Majra Burari, Delhi","11/1/2016 - 11/1/2016, Every day, AM Peak",608,435,848
"240","37, Sector 15, Pocket 6, Sector 15B, Rohini, Delhi","216","0 Main Canal Road, Harit Vihar, Mukandpur Part 2, Mukundpur, Delhi","11/1/2016 - 11/1/2016, Every day, AM Peak",486,335,703
"240","37, Sector 15, Pocket 6, Sector 15B, Rohini, Delhi","218","nullTandoor Wali Gali, Swami Shraddhanand Park, Bhalswa Dairy, Jahangirpura, Delhi","11/1/2016 - 11/1/2016, Every day, AM Peak",280,162,481
"240","37, Sector 15, Pocket 6, Sector 15B, Rohini, Delhi","219","461, Block AG, Sanjay Gandhi Transport Nagar, Delhi","11/1/2016 - 11/1/2016, Every day, AM Peak",182,91,363
"240","37, Sector 15, Pocket 6, Sector 15B, Rohini, Delhi","221","Srinagar - Kanyakumari Highway, Bhalswa Jahangirpuri, Jahangirpuri, Delhi","11/1/2016 - 11/1/2016, Every day, AM Peak",341,157,740
"240","37, Sector 15, Pocket 6, Sector 15B, Rohini, Delhi","222","Sector E, Mahipalpur Village, Vasant Kunj, New Delhi","11/1/2016 - 11/1/2016, Every day, AM Peak",3236,2211,4735
"240","37, Sector 15, Pocket 6, Sector 15B, Rohini, Delhi","223","Urban Extension Road II, Indira Gandhi International Airport, New Delhi","11/1/2016 - 11/1/2016, Every day, AM Peak",3145,2314,4273
"240","37, Sector 15, Pocket 6, Sector 15B, Rohini, Delhi","225","0 Netaji Road, A Block, Block C, Adarsh Nagar, Delhi","11/1/2016 - 11/1/2016, Every day, AM Peak",875,684,1118
"240","37, Sector 15, Pocket 6, Sector 15B, Rohini, Delhi","226","Unnamed Road, Model Town, Delhi","11/1/2016 - 11/1/2016, Every day, AM Peak",687,450,1048
"240","37, Sector 15, Pocket 6, Sector 15B, Rohini, Delhi","228","0 Lucknow Road, Banarsi Das Estate, Timarpur, Delhi","11/1/2016 - 11/1/2016, Every day, AM Peak",868,636,1182
"240","37, Sector 15, Pocket 6, Sector 15B, Rohini, Delhi","229","200 Road Number 28, Nehru Nagar, Shivaji Place, Basai Dara pur, Tagore Garden Extension, New Delhi","11/1/2016 - 11/1/2016, Every day, AM Peak",1307,963,1772
"240","37, Sector 15, Pocket 6, Sector 15B, Rohini, Delhi","231","G-17/6, Block G, Rajouri Garden, New Delhi","11/1/2016 - 11/1/2016, Every day, AM Peak",1602,1193,2149
"240","37, Sector 15, Pocket 6, Sector 15B, Rohini, Delhi","233","nullSatguru Ram Singh Marg, Block B, Mayapuri Industrial Area Phase I, Mayapuri, New Delhi","11/1/2016 - 11/1/2016, Every day, AM Peak",1575,1182,2098
"240","37, Sector 15, Pocket 6, Sector 15B, Rohini, Delhi","234","113, Press Colony, Press Colony, Mayapuri, New Delhi","11/1/2016 - 11/1/2016, Every day, AM Peak",1645,1183,2285
"240","37, Sector 15, Pocket 6, Sector 15B, Rohini, Delhi","241","Foot Road, Libas Pur Village, Siraspur, Delhi","11/1/2016 - 11/1/2016, Every day, AM Peak",343,93,1254
"240","37, Sector 15, Pocket 6, Sector 15B, Rohini, Delhi","242","nullGali Number 2, Jagjeet Nagar, Shahdara, Delhi","11/1/2016 - 11/1/2016, Every day, AM Peak",1804,1495,2175
"240","37, Sector 15, Pocket 6, Sector 15B, Rohini, Delhi","244","Dhingra Park Trail, Punjabi Bagh Cooperative Housing Soceity, East Punjabi Bagh, Punjabi Bagh, Delhi","11/1/2016 - 11/1/2016, Every day, AM Peak",1108,823,1490
"240","37, Sector 15, Pocket 6, Sector 15B, Rohini, Delhi","245","N-1/17, Block M, Mangolpuri, Delhi","11/1/2016 - 11/1/2016, Every day, AM Peak",672,535,843
"240","37, Sector 15, Pocket 6, Sector 15B, Rohini, Delhi","247","9/2082, Pocket 2, Block RZ, Palam Colony, New Delhi","11/1/2016 - 11/1/2016, Every day, AM Peak",2536,1974,3257
"240","37, Sector 15, Pocket 6, Sector 15B, Rohini, Delhi","248","Unnamed Road, Harijan Basti, Rajokri, New Delhi","11/1/2016 - 11/1/2016, Every day, AM Peak",3513,2470,4995
"240","37, Sector 15, Pocket 6, Sector 15B, Rohini, Delhi","251","A25, Block R, Pocket A, Rajender Nagar Part 1, New Rajinder Nagar, New Delhi","11/1/2016 - 11/1/2016, Every day, AM Peak",2039,1499,2772
"240","37, Sector 15, Pocket 6, Sector 15B, Rohini, Delhi","252","813, Sector 1, RK Puram, New Delhi","11/1/2016 - 11/1/2016, Every day, AM Peak",2664,1987,3570
"240","37, Sector 15, Pocket 6, Sector 15B, Rohini, Delhi","253","0 Chaudhary Harsukh Marg, B6, Block B6, Humayunpur, Safdarjung Enclave, New Delhi","11/1/2016 - 11/1/2016, Every day, AM Peak",2916,2097,4054
"240","37, Sector 15, Pocket 6, Sector 15B, Rohini, Delhi","254","Squadron Leader Mohinder Kumar Jain Marg, Block B, New Delhi","11/1/2016 - 11/1/2016, Every day, AM Peak",3410,2592,4485
"240","37, Sector 15, Pocket 6, Sector 15B, Rohini, Delhi","256","D-70, Mahavir Enclave I, Mahavir Enclave Part 2, Mahavir Enclave, New Delhi","11/1/2016 - 11/1/2016, Every day, AM Peak",2133,1549,2936
"240","37, Sector 15, Pocket 6, Sector 15B, Rohini, Delhi","261","Nangli Ibrahimpur Road, Kadipur, Kushak Colony, Kadipur Village, Delhi","11/1/2016 - 11/1/2016, Every day, AM Peak",401,266,604
"240","37, Sector 15, Pocket 6, Sector 15B, Rohini, Delhi","263","200 Pirwali Gali, Block P, Block P, Patparganj, New Delhi","11/1/2016 - 11/1/2016, Every day, AM Peak",2066,1739,2453
"240","37, Sector 15, Pocket 6, Sector 15B, Rohini, Delhi","264","Noida Link Road, Nehru Enclave, Shakarpur Khas, New Delhi","11/1/2016 - 11/1/2016, Every day, AM Peak",1963,1614,2386
"240","37, Sector 15, Pocket 6, Sector 15B, Rohini, Delhi","265","0 Lane Number 8, Krishan Kunj Extension Part 2, Block G, Vishwakarma Park, Laxmi Nagar, Delhi","11/1/2016 - 11/1/2016, Every day, AM Peak",1823,1472,2256
"240","37, Sector 15, Pocket 6, Sector 15B, Rohini, Delhi","266","Yamuna Marginal Bandh Marg, Block A, Shastri Park, Jagjit Nagar, New Delhi","11/1/2016 - 11/1/2016, Every day, AM Peak",1871,1380,2535
"240","37, Sector 15, Pocket 6, Sector 15B, Rohini, Delhi","267","nullPanduk Shila Marg, Kaithwara Jagjivan Nagar, New Usmanpur, Shahdara, Delhi","11/1/2016 - 11/1/2016, Every day, AM Peak",1689,1319,2162
"240","37, Sector 15, Pocket 6, Sector 15B, Rohini, Delhi","268","null5th Pustha Road, Block B, Bhajanpura, Shahdara, Delhi","11/1/2016 - 11/1/2016, Every day, AM Peak",2055,1600,2638
"240","37, Sector 15, Pocket 6, Sector 15B, Rohini, Delhi","275","125/16, Jogabai Extension, Zakir Nagar, Okhla, New Delhi","11/1/2016 - 11/1/2016, Every day, AM Peak",2290,2001,2619
"240","37, Sector 15, Pocket 6, Sector 15B, Rohini, Delhi","277","700 Outer Ring Road, Bhalswa Jahangir Village, Jahangirpuri, नई दिल्ली","11/1/2016 - 11/1/2016, Every day, AM Peak",333,204,541
"240","37, Sector 15, Pocket 6, Sector 15B, Rohini, Delhi","279","Nightingale Road, Budella, Vikaspuri, Delhi","11/1/2016 - 11/1/2016, Every day, AM Peak",1210,938,1560
"240","37, Sector 15, Pocket 6, Sector 15B, Rohini, Delhi","280","nullHastsal Road, Block A2, JJ Colony, Uttam Nagar, Delhi","11/1/2016 - 11/1/2016, Every day, AM Peak",1727,1297,2298
"240","37, Sector 15, Pocket 6, Sector 15B, Rohini, Delhi","281","D915, New Mahavir Nagar, Tilak Nagar, Delhi","11/1/2016 - 11/1/2016, Every day, AM Peak",1230,929,1628
"240","37, Sector 15, Pocket 6, Sector 15B, Rohini, Delhi","282","Velodrome Road, Gandhi Smriti, Raj Ghat, New Delhi","11/1/2016 - 11/1/2016, Every day, AM Peak",1893,1438,2490
"240","37, Sector 15, Pocket 6, Sector 15B, Rohini, Delhi","283","nullVijay Marg, Block B, Baljit Nagar, Patel Nagar, New Delhi","11/1/2016 - 11/1/2016, Every day, AM Peak",1492,1086,2048
"240","37, Sector 15, Pocket 6, Sector 15B, Rohini, Delhi","287","L47, Block L, Shastri Nagar, Delhi","11/1/2016 - 11/1/2016, Every day, AM Peak",1205,964,1505