"Origin Movement ID","Origin Display Name","Destination Movement ID","Destination Display Name","Date Range","Mean Travel Time (Seconds)","Range - Lower Bound Travel Time (Seconds)","Range - Upper Bound Travel Time (Seconds)"
"181","F6-214, Block F 6, Sultanpuri, Delhi","163","0 Guru Harkishan Marg, Maulana Azad Society, Bhagwan Buddha Housing Corporation Society, Pitampura, Delhi","11/2/2016 - 11/2/2016, Every day, AM Peak",822,625,1080
"181","F6-214, Block F 6, Sultanpuri, Delhi","165","31, Cottage Enclave, Paschim Vihar, Delhi","11/2/2016 - 11/2/2016, Every day, AM Peak",975,808,1175
"181","F6-214, Block F 6, Sultanpuri, Delhi","166","nullRBI Enclave Road, Ankur Enclave, Paschim Vihar, Delhi","11/2/2016 - 11/2/2016, Every day, AM Peak",932,779,1114
"181","F6-214, Block F 6, Sultanpuri, Delhi","174","Road Number 316, Mangol Puri Industrial Area Phase I, Block Q, Mangolpuri, Delhi","11/2/2016 - 11/2/2016, Every day, AM Peak",389,284,531
"181","F6-214, Block F 6, Sultanpuri, Delhi","175","235, Block E, Block E, Mangolpuri, Delhi","11/2/2016 - 11/2/2016, Every day, AM Peak",634,486,825
"181","F6-214, Block F 6, Sultanpuri, Delhi","182","C2/5, Block C2, Sultanpuri, Delhi","11/2/2016 - 11/2/2016, Every day, AM Peak",97,52,180