"Origin Movement ID","Origin Display Name","Destination Movement ID","Destination Display Name","Date Range","Mean Travel Time (Seconds)","Range - Lower Bound Travel Time (Seconds)","Range - Upper Bound Travel Time (Seconds)"
"32","METRO MALL, Pocket 1, Sector 14 Dwarka, Dwarka, New Delhi","2","Unnamed Road, Delhi Cantonment, New Delhi","11/1/2016 - 11/1/2016, Every day, AM Peak",2169,1648,2854
"32","METRO MALL, Pocket 1, Sector 14 Dwarka, Dwarka, New Delhi","3","Unnamed Road, Mahipalpur, New Delhi","11/1/2016 - 11/1/2016, Every day, AM Peak",1702,1238,2339
"32","METRO MALL, Pocket 1, Sector 14 Dwarka, Dwarka, New Delhi","4","P-268/3, Rock View, Delhi Cantonment, Delhi","11/1/2016 - 11/1/2016, Every day, AM Peak",1557,1283,1888
"32","METRO MALL, Pocket 1, Sector 14 Dwarka, Dwarka, New Delhi","5","Old Palam Road, Delhi Cantonment, New Delhi","11/1/2016 - 11/1/2016, Every day, AM Peak",1376,1011,1871
"32","METRO MALL, Pocket 1, Sector 14 Dwarka, Dwarka, New Delhi","6","Unnamed Road, CVD Line, Delhi Cantonment, New Delhi","11/1/2016 - 11/1/2016, Every day, AM Peak",1984,1410,2790
"32","METRO MALL, Pocket 1, Sector 14 Dwarka, Dwarka, New Delhi","7","P 13, Baird Place, Delhi Cantonment, New Delhi","11/1/2016 - 11/1/2016, Every day, AM Peak",1939,1436,2617
"32","METRO MALL, Pocket 1, Sector 14 Dwarka, Dwarka, New Delhi","8","Mall Road, Khyber Lines, Delhi Cantonment, New Delhi","11/1/2016 - 11/1/2016, Every day, AM Peak",2308,1828,2912
"32","METRO MALL, Pocket 1, Sector 14 Dwarka, Dwarka, New Delhi","9","Mahatma Jyothi Rao Phule Marg, Mahatma Jyoti Rao Phule Marg Area, New Delhi","11/1/2016 - 11/1/2016, Every day, AM Peak",3326,2799,3951
"32","METRO MALL, Pocket 1, Sector 14 Dwarka, Dwarka, New Delhi","11","Mother Teresa Crescent, Talkatora Garden, Central Ridge Reserve Forest, New Delhi","11/1/2016 - 11/1/2016, Every day, AM Peak",2654,2166,3251
"32","METRO MALL, Pocket 1, Sector 14 Dwarka, Dwarka, New Delhi","12","Jantar Mantar Road, Janpath, Connaught Place, New Delhi","11/1/2016 - 11/1/2016, Every day, AM Peak",3261,2654,4006
"32","METRO MALL, Pocket 1, Sector 14 Dwarka, Dwarka, New Delhi","13","10, Aurangzeb Road, New Delhi","11/1/2016 - 11/1/2016, Every day, AM Peak",3042,2495,3708
"32","METRO MALL, Pocket 1, Sector 14 Dwarka, Dwarka, New Delhi","14","Mahatma Gandhi Road, Kidwai Nagar West, Kidwai Nagar, New Delhi","11/1/2016 - 11/1/2016, Every day, AM Peak",2656,2092,3370
"32","METRO MALL, Pocket 1, Sector 14 Dwarka, Dwarka, New Delhi","16","Andre Malraux Marg, Ramnagar, Chanakyapuri, New Delhi","11/1/2016 - 11/1/2016, Every day, AM Peak",2470,1949,3130
"32","METRO MALL, Pocket 1, Sector 14 Dwarka, Dwarka, New Delhi","24","268, Block B2, Shiv Nagar, Janakpuri, New Delhi","11/1/2016 - 11/1/2016, Every day, AM Peak",1602,1261,2034
"32","METRO MALL, Pocket 1, Sector 14 Dwarka, Dwarka, New Delhi","26","A3-214, Asalatpur Village, Janakpuri, Delhi","11/1/2016 - 11/1/2016, Every day, AM Peak",1556,1183,2045
"32","METRO MALL, Pocket 1, Sector 14 Dwarka, Dwarka, New Delhi","27","0 Ram Mandir Marg, C5B Block, Janakpuri, New Delhi","11/1/2016 - 11/1/2016, Every day, AM Peak",1462,1153,1853
"32","METRO MALL, Pocket 1, Sector 14 Dwarka, Dwarka, New Delhi","28","nullSchool Road, Block M, Uttam Nagar, Delhi","11/1/2016 - 11/1/2016, Every day, AM Peak",1108,700,1751
"32","METRO MALL, Pocket 1, Sector 14 Dwarka, Dwarka, New Delhi","29","Street Number 14, Block C, Sitapuri Part 1, Janakpuri, New Delhi","11/1/2016 - 11/1/2016, Every day, AM Peak",1160,883,1523
"32","METRO MALL, Pocket 1, Sector 14 Dwarka, Dwarka, New Delhi","31","Main Jhatikra Road, Paprawat, Delhi","11/1/2016 - 11/1/2016, Every day, AM Peak",466,264,820
"32","METRO MALL, Pocket 1, Sector 14 Dwarka, Dwarka, New Delhi","65","Shaheed Jeet Singh Marg, NCERT Campus, Qutab Institutional Area, New Delhi","11/1/2016 - 11/1/2016, Every day, AM Peak",2259,1856,2748
"32","METRO MALL, Pocket 1, Sector 14 Dwarka, Dwarka, New Delhi","67","63/33, Hudco Place, Andrews Ganj Extension, Andrews Ganj, New Delhi","11/1/2016 - 11/1/2016, Every day, AM Peak",2730,2239,3328
"32","METRO MALL, Pocket 1, Sector 14 Dwarka, Dwarka, New Delhi","68","0 Paschimi Marg, Block E, Vasant Vihar, New Delhi","11/1/2016 - 11/1/2016, Every day, AM Peak",1875,1588,2213
"32","METRO MALL, Pocket 1, Sector 14 Dwarka, Dwarka, New Delhi","69","1129, Sector 2 R K Puram, Sector 2, RK Puram, New Delhi","11/1/2016 - 11/1/2016, Every day, AM Peak",2083,1703,2546
"32","METRO MALL, Pocket 1, Sector 14 Dwarka, Dwarka, New Delhi","70","G288, Sector 3, Block G, Nanak Pura, South Moti Bagh, New Delhi","11/1/2016 - 11/1/2016, Every day, AM Peak",1957,1599,2394
"32","METRO MALL, Pocket 1, Sector 14 Dwarka, Dwarka, New Delhi","71","JNU Ring Road, Jawaharlal Nehru University, New Delhi","11/1/2016 - 11/1/2016, Every day, AM Peak",2053,1703,2474
"32","METRO MALL, Pocket 1, Sector 14 Dwarka, Dwarka, New Delhi","81","126, Block L 1, Alaknanda, New Delhi","11/1/2016 - 11/1/2016, Every day, AM Peak",2374,1588,3547
"32","METRO MALL, Pocket 1, Sector 14 Dwarka, Dwarka, New Delhi","82","286, Asian Games Village Complex, Siri Fort, New Delhi","11/1/2016 - 11/1/2016, Every day, AM Peak",2440,1786,3331
"32","METRO MALL, Pocket 1, Sector 14 Dwarka, Dwarka, New Delhi","83","C2, Block C, Kailash Colony, Greater Kailash, New Delhi","11/1/2016 - 11/1/2016, Every day, AM Peak",2729,2270,3279
"32","METRO MALL, Pocket 1, Sector 14 Dwarka, Dwarka, New Delhi","84","nullMathura Road, Friends Colony West, Block A, New Friends Colony, New Delhi","11/1/2016 - 11/1/2016, Every day, AM Peak",2920,2556,3335
"32","METRO MALL, Pocket 1, Sector 14 Dwarka, Dwarka, New Delhi","85","Outer Ring Road, Block 13, Nehru Enclave East, Okhla Industrial Area, New Delhi","11/1/2016 - 11/1/2016, Every day, AM Peak",2890,2366,3529
"32","METRO MALL, Pocket 1, Sector 14 Dwarka, Dwarka, New Delhi","103","nullDasghara Road, Dasghara, New Delhi","11/1/2016 - 11/1/2016, Every day, AM Peak",2552,2324,2801
"32","METRO MALL, Pocket 1, Sector 14 Dwarka, Dwarka, New Delhi","108","Unnamed Road, Block G, Bhim Basti, Jaunapur, New Delhi","11/1/2016 - 11/1/2016, Every day, AM Peak",2239,1844,2718
"32","METRO MALL, Pocket 1, Sector 14 Dwarka, Dwarka, New Delhi","121","22/55, West Punjabi Bagh, Punjabi Bagh, Delhi","11/1/2016 - 11/1/2016, Every day, AM Peak",2335,1831,2976
"32","METRO MALL, Pocket 1, Sector 14 Dwarka, Dwarka, New Delhi","123","Loknath Marg, Block M, Kirti Nagar, New Delhi","11/1/2016 - 11/1/2016, Every day, AM Peak",2741,2186,3435
"32","METRO MALL, Pocket 1, Sector 14 Dwarka, Dwarka, New Delhi","124","30, 31, Block B, Mansarover Garden, New Delhi","11/1/2016 - 11/1/2016, Every day, AM Peak",2174,1796,2630
"32","METRO MALL, Pocket 1, Sector 14 Dwarka, Dwarka, New Delhi","125","Shaheed Chander Shekhar Azad Marg, Laxmi Park, Ranhola Extesion, Delhi","11/1/2016 - 11/1/2016, Every day, AM Peak",910,553,1497
"32","METRO MALL, Pocket 1, Sector 14 Dwarka, Dwarka, New Delhi","135","0 Uggarsen Market Road, Meenakshi Garden, Ashok Nagar, Delhi","11/1/2016 - 11/1/2016, Every day, AM Peak",1737,1352,2230
"32","METRO MALL, Pocket 1, Sector 14 Dwarka, Dwarka, New Delhi","137","nullRoad Number 235, Block H, Vikaspuri, Delhi","11/1/2016 - 11/1/2016, Every day, AM Peak",1919,1459,2523
"32","METRO MALL, Pocket 1, Sector 14 Dwarka, Dwarka, New Delhi","138","Gali Number 11, Vipin Garden Extension, Laxmi Vihar, Nawada, Delhi","11/1/2016 - 11/1/2016, Every day, AM Peak",500,212,1175
"32","METRO MALL, Pocket 1, Sector 14 Dwarka, Dwarka, New Delhi","139","nullBudh Bazar Road, Nawada, Nawada Majra Village, Nawada, Delhi","11/1/2016 - 11/1/2016, Every day, AM Peak",374,131,1063
"32","METRO MALL, Pocket 1, Sector 14 Dwarka, Dwarka, New Delhi","140","A12/B, Sainik Nagar, Mansa Ram Park, Uttam Nagar, Delhi","11/1/2016 - 11/1/2016, Every day, AM Peak",341,123,939
"32","METRO MALL, Pocket 1, Sector 14 Dwarka, Dwarka, New Delhi","142","Gali Number 1, Dabri Village, Dabri, New Delhi","11/1/2016 - 11/1/2016, Every day, AM Peak",1262,968,1645
"32","METRO MALL, Pocket 1, Sector 14 Dwarka, Dwarka, New Delhi","143","nullRoad Number 221, Pocket 1, Sector 10 Dwarka, Dwarka, Delhi","11/1/2016 - 11/1/2016, Every day, AM Peak",406,177,926
"32","METRO MALL, Pocket 1, Sector 14 Dwarka, Dwarka, New Delhi","144","Najafgarh Road, Indra Park, Block A, Masudabad, Najafgarh, Delhi","11/1/2016 - 11/1/2016, Every day, AM Peak",706,371,1340
"32","METRO MALL, Pocket 1, Sector 14 Dwarka, Dwarka, New Delhi","156","Doctor Satpal Sachdeva Marg, Keshav Puram, Tri Nagar, Delhi","11/1/2016 - 11/1/2016, Every day, AM Peak",3221,2380,4358
"32","METRO MALL, Pocket 1, Sector 14 Dwarka, Dwarka, New Delhi","159","300 Maharishi Balmiki Mandir Marg, Block H, Shakurpur Colony, Pitampura, Delhi","11/1/2016 - 11/1/2016, Every day, AM Peak",2579,2015,3300
"32","METRO MALL, Pocket 1, Sector 14 Dwarka, Dwarka, New Delhi","160","23, Shiva Enclave, Pitampura, Delhi","11/1/2016 - 11/1/2016, Every day, AM Peak",2594,2073,3244
"32","METRO MALL, Pocket 1, Sector 14 Dwarka, Dwarka, New Delhi","161","nullLawrence Road, Rampura Industrial Area, Tri Nagar, Delhi","11/1/2016 - 11/1/2016, Every day, AM Peak",2514,1960,3224
"32","METRO MALL, Pocket 1, Sector 14 Dwarka, Dwarka, New Delhi","163","0 Guru Harkishan Marg, Maulana Azad Society, Bhagwan Buddha Housing Corporation Society, Pitampura, Delhi","11/1/2016 - 11/1/2016, Every day, AM Peak",2444,1957,3050
"32","METRO MALL, Pocket 1, Sector 14 Dwarka, Dwarka, New Delhi","164","Shakurbasti Pedestrian Foot Over Bridge, Shakur Basti Railway Colony, Railway Colony South, Pitampura, Delhi","11/1/2016 - 11/1/2016, Every day, AM Peak",2413,1874,3106
"32","METRO MALL, Pocket 1, Sector 14 Dwarka, Dwarka, New Delhi","165","31, Cottage Enclave, Paschim Vihar, Delhi","11/1/2016 - 11/1/2016, Every day, AM Peak",2200,1785,2710
"32","METRO MALL, Pocket 1, Sector 14 Dwarka, Dwarka, New Delhi","166","nullRBI Enclave Road, Ankur Enclave, Paschim Vihar, Delhi","11/1/2016 - 11/1/2016, Every day, AM Peak",2112,1646,2708
"32","METRO MALL, Pocket 1, Sector 14 Dwarka, Dwarka, New Delhi","167","nullShaheed Udham Singh Marg, AE Block, Poorbi Shalimar Bag, Shalimar Bagh, Delhi","11/1/2016 - 11/1/2016, Every day, AM Peak",2622,2092,3286
"32","METRO MALL, Pocket 1, Sector 14 Dwarka, Dwarka, New Delhi","170","nullColony Road, Block QP, Poorvi Pitampura, Pitampura, Delhi","11/1/2016 - 11/1/2016, Every day, AM Peak",2820,2199,3616
"32","METRO MALL, Pocket 1, Sector 14 Dwarka, Dwarka, New Delhi","172","nullShiva Road, Pocket 14, Sector 8D, Rohini, Delhi","11/1/2016 - 11/1/2016, Every day, AM Peak",2632,2103,3293
"32","METRO MALL, Pocket 1, Sector 14 Dwarka, Dwarka, New Delhi","175","235, Block E, Block E, Mangolpuri, Delhi","11/1/2016 - 11/1/2016, Every day, AM Peak",2326,1857,2912
"32","METRO MALL, Pocket 1, Sector 14 Dwarka, Dwarka, New Delhi","176","B7-187, Pocket 7, Sector 3B, Rohini, Delhi","11/1/2016 - 11/1/2016, Every day, AM Peak",2468,1984,3068
"32","METRO MALL, Pocket 1, Sector 14 Dwarka, Dwarka, New Delhi","179","0 AB Road, Block RR, Mianwali Nagar, Paschim Vihar, Delhi","11/1/2016 - 11/1/2016, Every day, AM Peak",2269,1728,2978
"32","METRO MALL, Pocket 1, Sector 14 Dwarka, Dwarka, New Delhi","180","GH-14/234, GH 14, Block GH 14, Paschim Vihar, Delhi","11/1/2016 - 11/1/2016, Every day, AM Peak",2203,1669,2907
"32","METRO MALL, Pocket 1, Sector 14 Dwarka, Dwarka, New Delhi","193","Unnamed Road, Usmanpur, Shahdara, Delhi","11/1/2016 - 11/1/2016, Every day, AM Peak",3870,3424,4373
"32","METRO MALL, Pocket 1, Sector 14 Dwarka, Dwarka, New Delhi","200","Dabri - Gurgaon Road, Pocket 2, Sector 1 Dwarka, Dwarka, New Delhi","11/1/2016 - 11/1/2016, Every day, AM Peak",839,574,1225
"32","METRO MALL, Pocket 1, Sector 14 Dwarka, Dwarka, New Delhi","222","Sector E, Mahipalpur Village, Vasant Kunj, New Delhi","11/1/2016 - 11/1/2016, Every day, AM Peak",1499,1140,1969
"32","METRO MALL, Pocket 1, Sector 14 Dwarka, Dwarka, New Delhi","223","Urban Extension Road II, Indira Gandhi International Airport, New Delhi","11/1/2016 - 11/1/2016, Every day, AM Peak",1157,865,1546
"32","METRO MALL, Pocket 1, Sector 14 Dwarka, Dwarka, New Delhi","224","Main Road, Bharthal, Sector 27 Dwarka, Bharthal, New Delhi","11/1/2016 - 11/1/2016, Every day, AM Peak",723,492,1062
"32","METRO MALL, Pocket 1, Sector 14 Dwarka, Dwarka, New Delhi","229","200 Road Number 28, Nehru Nagar, Shivaji Place, Basai Dara pur, Tagore Garden Extension, New Delhi","11/1/2016 - 11/1/2016, Every day, AM Peak",2263,1784,2870
"32","METRO MALL, Pocket 1, Sector 14 Dwarka, Dwarka, New Delhi","231","G-17/6, Block G, Rajouri Garden, New Delhi","11/1/2016 - 11/1/2016, Every day, AM Peak",2072,1621,2647
"32","METRO MALL, Pocket 1, Sector 14 Dwarka, Dwarka, New Delhi","232","4-3, Mayapuri Industrial Area Phase II, Mayapuri, New Delhi","11/1/2016 - 11/1/2016, Every day, AM Peak",1631,1245,2135
"32","METRO MALL, Pocket 1, Sector 14 Dwarka, Dwarka, New Delhi","233","nullSatguru Ram Singh Marg, Block B, Mayapuri Industrial Area Phase I, Mayapuri, New Delhi","11/1/2016 - 11/1/2016, Every day, AM Peak",1894,1565,2290
"32","METRO MALL, Pocket 1, Sector 14 Dwarka, Dwarka, New Delhi","234","113, Press Colony, Press Colony, Mayapuri, New Delhi","11/1/2016 - 11/1/2016, Every day, AM Peak",2011,1695,2385
"32","METRO MALL, Pocket 1, Sector 14 Dwarka, Dwarka, New Delhi","235","nullBharat Vihar Road, Block G, Raja Puri, Matiala, Delhi","11/1/2016 - 11/1/2016, Every day, AM Peak",553,342,891
"32","METRO MALL, Pocket 1, Sector 14 Dwarka, Dwarka, New Delhi","240","37, Sector 15, Pocket 6, Sector 15B, Rohini, Delhi","11/1/2016 - 11/1/2016, Every day, AM Peak",2834,2217,3621
"32","METRO MALL, Pocket 1, Sector 14 Dwarka, Dwarka, New Delhi","247","9/2082, Pocket 2, Block RZ, Palam Colony, New Delhi","11/1/2016 - 11/1/2016, Every day, AM Peak",1125,837,1511
"32","METRO MALL, Pocket 1, Sector 14 Dwarka, Dwarka, New Delhi","248","Unnamed Road, Harijan Basti, Rajokri, New Delhi","11/1/2016 - 11/1/2016, Every day, AM Peak",1465,1114,1926
"32","METRO MALL, Pocket 1, Sector 14 Dwarka, Dwarka, New Delhi","251","A25, Block R, Pocket A, Rajender Nagar Part 1, New Rajinder Nagar, New Delhi","11/1/2016 - 11/1/2016, Every day, AM Peak",2814,2587,3060
"32","METRO MALL, Pocket 1, Sector 14 Dwarka, Dwarka, New Delhi","252","813, Sector 1, RK Puram, New Delhi","11/1/2016 - 11/1/2016, Every day, AM Peak",2019,1722,2366
"32","METRO MALL, Pocket 1, Sector 14 Dwarka, Dwarka, New Delhi","253","0 Chaudhary Harsukh Marg, B6, Block B6, Humayunpur, Safdarjung Enclave, New Delhi","11/1/2016 - 11/1/2016, Every day, AM Peak",2251,1832,2765
"32","METRO MALL, Pocket 1, Sector 14 Dwarka, Dwarka, New Delhi","254","Squadron Leader Mohinder Kumar Jain Marg, Block B, New Delhi","11/1/2016 - 11/1/2016, Every day, AM Peak",2312,1905,2805
"32","METRO MALL, Pocket 1, Sector 14 Dwarka, Dwarka, New Delhi","255","1700 Uday Chand Marg, Arya Basti, Zafar Nagar, Kotla Mubarakpur, South Extension I, New Delhi","11/1/2016 - 11/1/2016, Every day, AM Peak",2695,2233,3251
"32","METRO MALL, Pocket 1, Sector 14 Dwarka, Dwarka, New Delhi","256","D-70, Mahavir Enclave I, Mahavir Enclave Part 2, Mahavir Enclave, New Delhi","11/1/2016 - 11/1/2016, Every day, AM Peak",1082,763,1533
"32","METRO MALL, Pocket 1, Sector 14 Dwarka, Dwarka, New Delhi","258","Sant Sujan Singh Marg, JJ Colony, Block N, Tagore Garden, Tagore Garden Extension, New Delhi","11/1/2016 - 11/1/2016, Every day, AM Peak",1896,1447,2483
"32","METRO MALL, Pocket 1, Sector 14 Dwarka, Dwarka, New Delhi","259","Jogging Lane, Pocket B-C, Sector-A, Vasant Kunj, New Delhi","11/1/2016 - 11/1/2016, Every day, AM Peak",2480,2050,2999
"32","METRO MALL, Pocket 1, Sector 14 Dwarka, Dwarka, New Delhi","276","MCD Office, South delhi, Najafgarh Dhansa Road, Najafgarh Village, Najafgarh, Delhi","11/1/2016 - 11/1/2016, Every day, AM Peak",947,705,1271
"32","METRO MALL, Pocket 1, Sector 14 Dwarka, Dwarka, New Delhi","278","nullNangloi - Najafgarh Road, Brahampuri Colony, Kotla Vihar Phase 2, Ranhola, Delhi","11/1/2016 - 11/1/2016, Every day, AM Peak",1114,746,1662
"32","METRO MALL, Pocket 1, Sector 14 Dwarka, Dwarka, New Delhi","279","Nightingale Road, Budella, Vikaspuri, Delhi","11/1/2016 - 11/1/2016, Every day, AM Peak",1831,1354,2475
"32","METRO MALL, Pocket 1, Sector 14 Dwarka, Dwarka, New Delhi","280","nullHastsal Road, Block A2, JJ Colony, Uttam Nagar, Delhi","11/1/2016 - 11/1/2016, Every day, AM Peak",1064,778,1453
"32","METRO MALL, Pocket 1, Sector 14 Dwarka, Dwarka, New Delhi","281","D915, New Mahavir Nagar, Tilak Nagar, Delhi","11/1/2016 - 11/1/2016, Every day, AM Peak",1767,1319,2365